_id,userId,learningMaterialId,content,createdAt,__v
670cca76e0941d56b05f23cc,670cca73e0941d56b05ee478,670cca73e0941d56b05ee919,Cimentarius celer pauper. Calamitas inflammatio adversus laudantium titulus curtus volubilis colligo copia cumque. Tam sui appono suspendo ventosus bonus amita antiquus.,2024-10-13T08:19:15.038Z,0
670cca76e0941d56b05f23cd,670cca73e0941d56b05ee508,670cca73e0941d56b05ee94b,Illum aestivus articulus corona aspicio tripudio natus arx artificiose. Patior vicissitudo alo urbs crudelis accedo incidunt tum. Thymum sumptus dolorem denego unus claudeo similique.,2024-10-13T20:21:45.973Z,0
670cca76e0941d56b05f23ce,670cca73e0941d56b05ee652,670cca73e0941d56b05ee846,Eos peccatus comitatus defetiscor adimpleo tot. Canonicus traho bene. Iusto cogito defluo aeger appono bis victoria tolero.,2024-10-14T02:03:15.594Z,0
670cca76e0941d56b05f23cf,670cca73e0941d56b05ee456,670cca73e0941d56b05eea0b,Auxilium desolo alienus patria ago peccatus. Conforto averto placeat beneficium. Veritas derelinquo apostolus.,2024-10-13T11:21:32.641Z,0
670cca76e0941d56b05f23d0,670cca73e0941d56b05ee3fc,670cca73e0941d56b05ee7e9,Cimentarius calculus creo spectaculum modi vulgaris natus. Nihil atrox delicate perspiciatis iure ademptio desparatus conduco. Ago ara campana.,2024-10-13T11:25:01.216Z,0
670cca76e0941d56b05f23d1,670cca73e0941d56b05ee369,670cca73e0941d56b05ee75f,Appello urbanus corroboro animadverto antiquus sed adimpleo. Avarus quos quibusdam patrocinor celo sunt verus. Triumphus laboriosam sodalitas nam abbas ullam uter altus corporis vinculum.,2024-10-13T17:37:42.988Z,0
670cca76e0941d56b05f23d2,670cca73e0941d56b05ee571,670cca73e0941d56b05ee725,Sponte viscus bis spes condico trucido. Totidem amet thema capitulus deprimo adicio acsi decimus carus tricesimus. Copia dedico termes strenuus ventosus trado terebro.,2024-10-13T20:09:45.010Z,0
670cca76e0941d56b05f23d3,670cca73e0941d56b05ee31e,670cca73e0941d56b05ee92a,Temporibus commodo cresco villa conspergo eos sufficio centum non suppono. Cedo adeo distinctio ascit thorax templum solus. Terebro crapula acies.,2024-10-13T21:14:44.187Z,0
670cca76e0941d56b05f23d4,670cca73e0941d56b05ee48c,670cca73e0941d56b05ee739,Repudiandae caelum deporto approbo cotidie templum virtus peccatus. Cum curtus ait tempus exercitationem aro quo. Iste beatae vulnus claudeo culpo magnam ultra tenax.,2024-10-13T18:33:02.149Z,0
670cca76e0941d56b05f23d5,670cca73e0941d56b05ee5f1,670cca73e0941d56b05ee8d4,Cariosus nesciunt demulceo optio temperantia vero venustas illum officiis. Alii deprimo uredo acer. Tui depulso earum demum tantum.,2024-10-14T04:29:54.220Z,0
670cca76e0941d56b05f23d6,670cca73e0941d56b05ee375,670cca73e0941d56b05ee9ce,Cohaero amor theologus comburo aperiam usus terebro curtus tyrannus. Trucido qui texo cognatus. Culpa sumptus saepe ipsa audeo tener audio alias iusto.,2024-10-13T12:35:07.920Z,0
670cca76e0941d56b05f23d7,670cca73e0941d56b05ee3b5,670cca73e0941d56b05ee711,Alius communis amplitudo cresco auxilium. Sursum perspiciatis suadeo arcus debitis vereor caecus terra. Vehemens volo laborum.,2024-10-13T22:28:28.011Z,0
670cca76e0941d56b05f23d8,670cca73e0941d56b05ee4fd,670cca73e0941d56b05ee9f1,Admiratio ratione harum conicio. Sunt sortitus velum error nihil curso fugiat pel ars. Ait cunctatio congregatio cilicium quam sophismata pel triduana sulum conor.,2024-10-13T11:21:23.905Z,0
670cca76e0941d56b05f23d9,670cca73e0941d56b05ee511,670cca73e0941d56b05ee6e5,Arbitro ventito verto vapulus dolore abutor tertius vere. Confugo aliquid acceptus suspendo. Decet amissio velociter taceo.,2024-10-14T02:21:19.351Z,0
670cca76e0941d56b05f23da,670cca73e0941d56b05ee34a,670cca73e0941d56b05ee71a,Ambitus aveho sublime certe strenuus ipsa. Ago centum absens. Vulgivagus tam claudeo corporis ceno damno adimpleo dedico.,2024-10-13T15:52:27.320Z,0
670cca76e0941d56b05f23db,670cca73e0941d56b05ee40f,670cca73e0941d56b05ee8eb,Damnatio delego pauci repudiandae virgo auctor. Stabilis pax ara maiores bellicus degenero arx terror acervus aegrotatio. Sed tibi clibanus studio viridis cubicularis cohors defleo caput.,2024-10-13T08:27:13.442Z,0
670cca76e0941d56b05f23dc,670cca73e0941d56b05ee5c4,670cca73e0941d56b05ee95d,Arguo sto tempora sint velut reprehenderit. Hic cubitum textus aequus thesaurus esse virga absconditus. Denique totus cinis subiungo urbanus numquam vicissitudo canto attonbitus termes.,2024-10-13T10:53:49.740Z,0
670cca76e0941d56b05f23dd,670cca73e0941d56b05ee534,670cca73e0941d56b05ee95a,Demoror accusamus valens. Comis spes triduana cometes sopor aperiam thymbra adsum ambulo. Contigo versus caritas deficio victus tui sum.,2024-10-14T04:57:16.641Z,0
670cca76e0941d56b05f23de,670cca73e0941d56b05ee3c0,670cca73e0941d56b05ee693,Verumtamen abundans assumenda. Alveus subvenio undique degero. Caelestis inventore solium.,2024-10-13T08:47:03.100Z,0
670cca76e0941d56b05f23df,670cca73e0941d56b05ee42e,670cca73e0941d56b05ee852,Cetera censura valens nisi unus. Studio torrens similique deleo crapula vallum magnam villa aspicio. Officia pariatur creo cogito celebrer adhaero soluta supra.,2024-10-13T17:47:40.943Z,0
670cca76e0941d56b05f23e0,670cca73e0941d56b05ee5c6,670cca73e0941d56b05ee725,Ocer atavus utroque sint magni conservo tantillus votum. Administratio utrum cerno. Stultus ultra cognomen ultio cito.,2024-10-13T22:17:14.222Z,0
670cca76e0941d56b05f23e1,670cca73e0941d56b05ee434,670cca73e0941d56b05ee76c,Adduco titulus curis utor. Coniecto comparo sulum sophismata abeo. Tantum angustus triduana casus solitudo.,2024-10-13T22:19:23.115Z,0
670cca76e0941d56b05f23e2,670cca73e0941d56b05ee4ef,670cca73e0941d56b05ee971,Aperte unus venustas armarium. Correptius cauda aestus uberrime. Tertius charisma ulciscor aequus harum.,2024-10-13T13:27:21.868Z,0
670cca76e0941d56b05f23e3,670cca73e0941d56b05ee4a8,670cca73e0941d56b05ee98f,Amita curriculum suggero excepturi conforto cimentarius carmen desidero suffoco. Fugiat dignissimos rerum. Civis id thorax amicitia arca ancilla.,2024-10-13T11:43:10.596Z,0
670cca76e0941d56b05f23e4,670cca73e0941d56b05ee611,670cca73e0941d56b05ee994,Adicio thesaurus vinco conscendo. Viduo adhaero voluntarius subito umquam vox amplitudo arcus suspendo supra. Aestas verbera explicabo.,2024-10-13T15:22:54.226Z,0
670cca76e0941d56b05f23e5,670cca73e0941d56b05ee41c,670cca73e0941d56b05ee6ec,Vociferor ver bellicus bellum reprehenderit accendo temporibus ter. Vita agnosco crux apto pax ago acies accusator. Caelum demo accedo sit vorago volup cresco coniuratio triduana.,2024-10-14T01:47:35.950Z,0
670cca76e0941d56b05f23e6,670cca73e0941d56b05ee519,670cca73e0941d56b05ee8b3,Bibo tero claro dens. Somniculosus adsum corrigo alo callide. Condico articulus caritas cultellus audentia sumo adipisci curvo.,2024-10-14T05:08:37.264Z,0
670cca76e0941d56b05f23e7,670cca73e0941d56b05ee4a3,670cca73e0941d56b05ee770,Surgo ancilla cervus templum caterva vulariter abundans thymum ventito. Assumenda ab sordeo minus assentator crur comminor pariatur. Colo ademptio vomica terror delicate cito.,2024-10-13T22:53:07.194Z,0
670cca76e0941d56b05f23e8,670cca73e0941d56b05ee57e,670cca73e0941d56b05ee669,Debeo aestus tabesco villa calcar quasi ustulo argumentum constans verumtamen. Voluptates validus congregatio conatus excepturi utrimque dedico cavus. Auxilium vulticulus aer ater cupio voluntarius.,2024-10-14T06:30:19.837Z,0
670cca76e0941d56b05f23e9,670cca73e0941d56b05ee480,670cca73e0941d56b05ee67a,Crepusculum esse crapula volubilis. Eius nihil admoneo anser congregatio officiis blanditiis taceo conqueror vesco. Tendo temptatio comis tener socius triduana sulum deleo.,2024-10-13T09:55:53.384Z,0
670cca76e0941d56b05f23ea,670cca73e0941d56b05ee293,670cca73e0941d56b05ee9e2,Cumque absum totidem deficio censura statim alienus id damno. Tergiversatio deripio vester. Corrigo ipsam cicuta sumo thorax maxime quas comptus sursum vilitas.,2024-10-13T09:47:45.303Z,0
670cca76e0941d56b05f23eb,670cca73e0941d56b05ee550,670cca73e0941d56b05ee882,Curo cervus bis amplitudo. Cunctatio earum terra paens cupiditate conturbo viriliter coniuratio vapulus. Alias perspiciatis virga altus convoco curvo universe argentum theologus dedico.,2024-10-13T15:26:30.079Z,0
670cca76e0941d56b05f23ec,670cca73e0941d56b05ee447,670cca73e0941d56b05ee979,Desolo tondeo demens abscido conduco. Peccatus ipsam acer texo tristis. Stella coepi aliquam repellendus torqueo.,2024-10-14T04:29:21.295Z,0
670cca76e0941d56b05f23ed,670cca73e0941d56b05ee589,670cca73e0941d56b05ee924,Cohors valens sumo arma delibero nostrum quod desolo. Addo animadverto curis eveniet caelum acerbitas totus tutamen vorago. Vetus cena in vitiosus absconditus conitor amicitia sollers voveo decerno.,2024-10-14T06:50:42.444Z,0
670cca76e0941d56b05f23ee,670cca73e0941d56b05ee45b,670cca73e0941d56b05ee90d,Volva versus tamen demitto accommodo tepidus ipsa voro. Arca voluptates demitto. Terra succurro denego annus quidem atrocitas pax.,2024-10-13T13:56:17.478Z,0
670cca76e0941d56b05f23ef,670cca73e0941d56b05ee2ce,670cca73e0941d56b05ee710,Degusto cum canis umbra peior non. Vae umerus thymum statua paulatim absum tandem addo candidus adicio. Vulgivagus cito sophismata tametsi amo tripudio spiritus cui.,2024-10-13T19:31:27.625Z,0
670cca76e0941d56b05f23f0,670cca73e0941d56b05ee348,670cca73e0941d56b05ee9a8,Recusandae defleo crepusculum sortitus paens deprimo censura averto undique ullus. Eaque ipsam bestia. Nisi cursim cauda cubo non aeternus voluptatem tener commodi.,2024-10-14T02:30:32.936Z,0
670cca76e0941d56b05f23f1,670cca73e0941d56b05ee482,670cca73e0941d56b05ee87f,Apostolus adipiscor amita deprimo substantia temporibus vomica aliquam. Aro cultura reprehenderit tibi abutor tantillus vis copia. Enim validus ante nisi solio alter incidunt vox acer suffragium.,2024-10-14T03:21:17.383Z,0
670cca76e0941d56b05f23f2,670cca73e0941d56b05ee33e,670cca73e0941d56b05ee9a2,Defaeco vesco pectus antiquus curso vinum. Pecus pax sonitus. Optio uredo deserunt cogo amet aeger vulgaris umquam.,2024-10-13T22:03:34.991Z,0
670cca76e0941d56b05f23f3,670cca73e0941d56b05ee36f,670cca73e0941d56b05ee821,Deleniti approbo calcar amet curatio colo tres convoco. Conforto volutabrum suppellex vulnero. Adopto correptius damno trado volutabrum creta cilicium solium decipio.,2024-10-14T05:17:25.213Z,0
670cca76e0941d56b05f23f4,670cca73e0941d56b05ee5db,670cca73e0941d56b05ee6e6,Delego suppellex cognatus. Vinum vesper constans. Decerno tum paulatim agnosco vindico ventito vix.,2024-10-13T15:40:11.323Z,0
670cca76e0941d56b05f23f5,670cca73e0941d56b05ee353,670cca73e0941d56b05ee867,Abduco succedo ulterius rerum utrum tabula architecto hic vomica vapulus. Sono bibo xiphias taedium peior sumptus vado adfectus. Debitis confero caelum terminatio decimus.,2024-10-13T11:03:25.714Z,0
670cca76e0941d56b05f23f6,670cca73e0941d56b05ee4bb,670cca73e0941d56b05ee897,Cinis voluptatum voluptatum desino laboriosam tumultus atrox ait creptio aufero. Sit occaecati pax stella thema sursum tabernus stillicidium verecundia culpa. Vitae valetudo solio absum charisma summopere tertius temptatio.,2024-10-13T22:30:50.759Z,0
670cca76e0941d56b05f23f7,670cca73e0941d56b05ee53c,670cca73e0941d56b05ee861,Dolores amplus spargo celo baiulus anser modi tum derideo. Temeritas arca ager thesaurus veritatis velum vesco. Calamitas alter temperantia.,2024-10-13T18:42:28.586Z,0
670cca76e0941d56b05f23f8,670cca73e0941d56b05ee42e,670cca73e0941d56b05ee6f8,Attollo dapifer uberrime. Acsi uterque sufficio caste alienus considero acerbitas pecus supra. Desparatus audio autus aggredior tot.,2024-10-14T05:19:01.360Z,0
670cca76e0941d56b05f23f9,670cca73e0941d56b05ee57d,670cca73e0941d56b05eea14,Nihil sublime unde accusantium. Utor coma aiunt temperantia. Adulescens curia trucido solitudo abstergo adipiscor usitas caries laborum.,2024-10-13T20:30:11.235Z,0
670cca76e0941d56b05f23fa,670cca73e0941d56b05ee2c9,670cca73e0941d56b05ee951,Dens omnis abstergo defaeco amaritudo civitas absens cibus. Tabella atrocitas cribro theatrum at. Agnitio subseco civitas sum.,2024-10-14T05:15:45.871Z,0
670cca76e0941d56b05f23fb,670cca73e0941d56b05ee46f,670cca73e0941d56b05ee883,Pauper victoria utpote quibusdam magnam. Administratio vado crux delectus atrocitas cohaero defungo suscipit alter inflammatio. Perspiciatis temporibus voluptate defaeco comprehendo.,2024-10-13T19:26:37.056Z,0
670cca76e0941d56b05f23fc,670cca73e0941d56b05ee35a,670cca73e0941d56b05ee768,Ante attero vinculum conturbo. Solium contigo delectus. Depulso suppono cicuta capillus appositus arceo blandior eum.,2024-10-13T23:40:40.630Z,0
670cca76e0941d56b05f23fd,670cca73e0941d56b05ee519,670cca73e0941d56b05ee884,Arcesso synagoga pecto. Stabilis demonstro terminatio asperiores velum spiritus arceo coruscus aliquam cornu. Nostrum stipes alii.,2024-10-14T00:12:59.960Z,0
670cca76e0941d56b05f23fe,670cca73e0941d56b05ee2fb,670cca73e0941d56b05ee966,Deinde amo aedificium voluptatem adiuvo versus. Defluo et auxilium audax aggredior sponte aegre assentator officia. Tardus aspicio arguo auctus amet.,2024-10-14T04:09:04.005Z,0
670cca76e0941d56b05f23ff,670cca73e0941d56b05ee3df,670cca73e0941d56b05ee9b1,Utrimque vitae ea denego teneo. Caelum antepono cunabula advenio ab delinquo adamo trucido carbo velum. Conitor tenax eveniet creber adsidue pax aeternus.,2024-10-13T22:07:07.366Z,0
670cca76e0941d56b05f2400,670cca73e0941d56b05ee62a,670cca73e0941d56b05ee967,Adsidue volva cresco occaecati turpis vorago aequitas. Sollicito defleo cattus ara sustineo aer tempore synagoga appono vivo. Caecus molestias accusamus terreo optio cilicium corpus placeat.,2024-10-14T05:46:00.780Z,0
670cca76e0941d56b05f2401,670cca73e0941d56b05ee46a,670cca73e0941d56b05ee809,Conor comprehendo bis angulus perferendis dolorum adulatio amplexus umerus. Tempora thalassinus alo verus cibo inventore sui. Verbum unus viriliter acidus.,2024-10-13T23:40:45.959Z,0
670cca76e0941d56b05f2402,670cca73e0941d56b05ee2bc,670cca73e0941d56b05ee669,Acerbitas ulterius delibero verus. Spargo possimus strues ventus blanditiis cupio. Sordeo deporto adversus tutamen.,2024-10-13T09:37:14.435Z,0
670cca76e0941d56b05f2403,670cca73e0941d56b05ee382,670cca73e0941d56b05ee687,Textilis contabesco tero depulso. Absque casus tubineus corporis aperio vespillo stillicidium vero maiores. Officia uxor compono.,2024-10-13T14:35:35.690Z,0
670cca76e0941d56b05f2404,670cca73e0941d56b05ee611,670cca73e0941d56b05ee935,Caecus ut crastinus tempore terga. Sponte careo demonstro audentia vesper harum aeger eligendi. Adsuesco debitis carus assumenda.,2024-10-14T04:20:06.211Z,0
670cca76e0941d56b05f2405,670cca73e0941d56b05ee458,670cca73e0941d56b05ee9e1,Vorax sopor cuppedia beatae advoco valeo audax depopulo theca. Cibo anser dedico sordeo. Vulnus labore ulterius timor utrimque tot.,2024-10-13T15:46:57.748Z,0
670cca76e0941d56b05f2406,670cca73e0941d56b05ee576,670cca73e0941d56b05ee99c,Aperio uberrime avaritia expedita tendo sub amor ambulo. Caecus tamen tego commodi tricesimus. Textilis curatio vomica.,2024-10-14T01:51:32.444Z,0
670cca76e0941d56b05f2407,670cca73e0941d56b05ee5f6,670cca73e0941d56b05ee943,Advenio nisi utique callide cicuta sol cras adfero textus asperiores. Calculus audio statua pecco amaritudo spoliatio. Celebrer nam ver aureus pel audeo textor socius.,2024-10-13T22:34:20.111Z,0
670cca76e0941d56b05f2408,670cca73e0941d56b05ee2d6,670cca73e0941d56b05eea2c,Thesis credo sortitus denique cuius tactus tergiversatio acquiro cauda. Torqueo animus vaco comes. Ater deleo curiositas alias arx nobis alioqui xiphias combibo sint.,2024-10-13T12:30:52.696Z,0
670cca76e0941d56b05f2409,670cca73e0941d56b05ee63e,670cca73e0941d56b05ee962,Tum iusto ter amet bene abutor. Vis valens verbera damnatio molestias pariatur defendo dolorum. Conspergo via cunae demoror.,2024-10-14T05:48:25.201Z,0
670cca76e0941d56b05f240a,670cca73e0941d56b05ee2d6,670cca73e0941d56b05ee761,Cruentus sum tersus nobis ancilla amet. Sui amo mollitia undique tantillus. Appono tandem eum aestus adulatio territo centum veritatis territo comprehendo.,2024-10-13T10:54:49.321Z,0
670cca76e0941d56b05f240b,670cca73e0941d56b05ee338,670cca73e0941d56b05ee796,Magnam dolores admoneo summa solium alius vinitor coniuratio. Rem suppono correptius thema adinventitias crux. Cogo alienus atque deduco cubo decerno paulatim dolor amoveo appositus.,2024-10-13T11:42:30.228Z,0
670cca76e0941d56b05f240c,670cca73e0941d56b05ee5ef,670cca73e0941d56b05ee94e,Summisse canto statua venustas textilis arca thesis. Velut admoneo peior. Tristis aegrotatio cunae termes celebrer occaecati cerno excepturi eveniet sono.,2024-10-13T18:14:57.632Z,0
670cca76e0941d56b05f240d,670cca73e0941d56b05ee47d,670cca73e0941d56b05ee851,Vomer deficio et substantia auctus cur sunt voluntarius venio autus. Animus cariosus umquam architecto colo bellicus utroque. Thesis ara id sum statim coadunatio adhaero sollers.,2024-10-14T04:44:13.154Z,0
670cca76e0941d56b05f240e,670cca73e0941d56b05ee3de,670cca73e0941d56b05ee8e2,Testimonium argentum solutio summisse deduco vinculum. Aegre atqui sol circumvenio suspendo pecus avaritia voco alo communis. Umerus argentum cupiditas.,2024-10-13T11:32:09.250Z,0
670cca76e0941d56b05f240f,670cca73e0941d56b05ee4d9,670cca73e0941d56b05ee836,Tui mollitia balbus victoria sollers comprehendo damnatio aperte venia administratio. Eaque terreo aestus tabernus decens virga curatio apparatus concedo peior. Sortitus verecundia cornu.,2024-10-13T12:27:26.376Z,0
670cca76e0941d56b05f2410,670cca73e0941d56b05ee476,670cca73e0941d56b05ee764,Vestigium asporto ratione tener vicissitudo confero copia. Vilicus video usus tondeo. Damno vulgus absconditus conservo vere audacia.,2024-10-13T22:03:27.969Z,0
670cca76e0941d56b05f2411,670cca73e0941d56b05ee597,670cca73e0941d56b05ee971,Viriliter baiulus appositus cauda tredecim eos vulgivagus patria suadeo magni. Cognatus tendo vomito vigilo tersus dicta infit aggredior spiculum suffragium. Cibus demoror maiores argumentum odit spero odit.,2024-10-14T05:38:43.171Z,0
670cca76e0941d56b05f2412,670cca73e0941d56b05ee2ba,670cca73e0941d56b05ee9b9,Caecus accusator arca patrocinor color communis. Absum patior vulpes dens benigne virtus mollitia. Avaritia saepe qui timor surculus.,2024-10-13T19:26:08.817Z,0
670cca76e0941d56b05f2413,670cca73e0941d56b05ee364,670cca73e0941d56b05ee7f4,Certus aeneus avaritia somnus tamen casus veritatis. Suppono dolorum ipsum appello bellicus adversus reprehenderit cumque. Vilitas molestias vox vigor.,2024-10-14T04:09:39.445Z,0
670cca76e0941d56b05f2414,670cca73e0941d56b05ee513,670cca73e0941d56b05ee990,Cui creator ars alius damnatio odit voluptatem stillicidium provident. Animus theatrum suus suffoco carbo modi decumbo suggero decens. Aer utrum voluptatibus tantillus cursus atavus astrum capillus veritatis auditor.,2024-10-13T14:39:26.584Z,0
670cca76e0941d56b05f2415,670cca73e0941d56b05ee4ce,670cca73e0941d56b05ee8a4,Adicio cogito adhuc timidus pax adipisci antea vestigium. Cunabula cura annus. Confido quisquam armarium vos.,2024-10-13T18:52:33.353Z,0
670cca76e0941d56b05f2416,670cca73e0941d56b05ee5b9,670cca73e0941d56b05ee9f6,Denego apostolus auditor. Adamo toties terga vetus arcus vigilo curis. Blanditiis tardus vetus.,2024-10-14T04:50:17.016Z,0
670cca76e0941d56b05f2417,670cca73e0941d56b05ee2d4,670cca73e0941d56b05ee92d,Sursum vos possimus voro desidero. Crepusculum tutis tantum turbo stips aeger sapiente aliquam terra. Constans ter caute fugiat arma brevis cernuus creator voluntarius appello.,2024-10-14T04:36:36.402Z,0
670cca76e0941d56b05f2418,670cca73e0941d56b05ee51f,670cca73e0941d56b05ee978,Circumvenio vulgaris verus caecus assentator stultus aureus audax. Video fugiat urbs valetudo aer timor texo delectatio soleo. Delectatio dolorum quibusdam deprimo charisma decumbo cattus veritas votum.,2024-10-13T08:54:09.730Z,0
670cca76e0941d56b05f2419,670cca73e0941d56b05ee612,670cca73e0941d56b05ee7af,Despecto amet desparatus cubicularis at. Vel certus atrox ter apostolus villa. Ancilla suppono solium aequitas voluptatem conor claustrum aggredior coniuratio.,2024-10-13T22:27:48.954Z,0
670cca76e0941d56b05f241a,670cca73e0941d56b05ee48c,670cca73e0941d56b05eea37,Accommodo convoco basium animi. Quasi suus stultus thermae ipsa ratione umquam tantum sublime. Peior laboriosam avarus volva carpo admoveo.,2024-10-13T12:25:09.635Z,0
670cca76e0941d56b05f241b,670cca73e0941d56b05ee623,670cca73e0941d56b05ee7c9,Amplus copiose cohibeo delego cunae similique tutamen. Suppono campana vulgaris ducimus creta occaecati nisi aeternus impedit. Tendo vado speciosus amaritudo ascisco titulus super.,2024-10-13T12:45:11.879Z,0
670cca76e0941d56b05f241c,670cca73e0941d56b05ee648,670cca73e0941d56b05ee67f,Succurro sum tero tyrannus ver attonbitus modi. Tantum tantillus atqui carmen ventito in eveniet desolo cupio. Pauci civis derelinquo tracto tyrannus comburo aeneus confido assentator.,2024-10-14T06:09:38.520Z,0
670cca76e0941d56b05f241d,670cca73e0941d56b05ee39f,670cca73e0941d56b05ee9ed,Quis speculum somnus attonbitus. Vereor repudiandae nesciunt bonus nemo absens. Ars creber copiose creptio.,2024-10-14T04:44:47.160Z,0
670cca76e0941d56b05f241e,670cca73e0941d56b05ee5a3,670cca73e0941d56b05ee7d0,Damnatio amo quam amicitia super arto arceo eum. Viriliter texo conqueror quae templum urbs. Terga textilis delectatio temporibus praesentium textor deprecator eos.,2024-10-14T06:10:16.152Z,0
670cca76e0941d56b05f241f,670cca73e0941d56b05ee544,670cca73e0941d56b05ee73a,Tubineus comburo ventosus reprehenderit caries speculum. Turpis consequuntur vestrum paulatim. Cribro quaerat tenus stabilis timor audentia angelus curvo.,2024-10-13T19:27:07.892Z,0
670cca76e0941d56b05f2420,670cca73e0941d56b05ee579,670cca73e0941d56b05ee903,Colligo crastinus aegrotatio tot tabula decimus esse custodia. Voluptates sollers tubineus ratione crinis sonitus. Crur vulgus id vito.,2024-10-14T05:14:58.688Z,0
670cca76e0941d56b05f2421,670cca73e0941d56b05ee5c0,670cca73e0941d56b05ee9de,Arbor compono clarus clarus correptius creo. Tricesimus amor curto quas venustas vulnero virgo. Delicate aveho adipiscor aperio ait armarium temporibus tibi perspiciatis.,2024-10-13T16:26:19.385Z,0
670cca76e0941d56b05f2422,670cca73e0941d56b05ee459,670cca73e0941d56b05ee829,Teres tristis canis catena vicissitudo quod calcar tum talio. Vitae cohors sortitus depopulo cognomen vir. Trepide tempore torrens vulariter adficio brevis magnam creo.,2024-10-14T02:21:31.348Z,0
670cca76e0941d56b05f2423,670cca73e0941d56b05ee3d7,670cca73e0941d56b05ee82c,Animus eaque ceno comitatus somniculosus turbo trepide sponte cunae. Antiquus despecto et iure. Degenero deorsum concido maxime valens arcesso comes ulciscor curis contabesco.,2024-10-14T00:11:16.021Z,0
670cca76e0941d56b05f2424,670cca73e0941d56b05ee438,670cca73e0941d56b05ee7aa,Conitor laudantium cognomen deprecator vinitor nihil cursus exercitationem. Vetus ventus dolorum. Utilis supra complectus aut.,2024-10-13T10:01:41.294Z,0
670cca76e0941d56b05f2425,670cca73e0941d56b05ee5b4,670cca73e0941d56b05ee7a4,Verus conatus contigo amplitudo. Apostolus validus vindico cultellus. Culpa calcar velit commemoro arbustum adnuo exercitationem bene.,2024-10-13T15:36:14.628Z,0
670cca76e0941d56b05f2426,670cca73e0941d56b05ee42c,670cca73e0941d56b05ee78f,Patria vulpes acidus decimus amaritudo cilicium viscus. Caries libero facere. Contra corrigo aggredior cursim coniecto sint laudantium agnosco templum demo.,2024-10-13T17:34:57.491Z,0
670cca76e0941d56b05f2427,670cca73e0941d56b05ee49e,670cca73e0941d56b05eea0d,Tremo nam cilicium adsuesco cresco traho claudeo quo sperno pecus. Consequatur terebro tolero adficio commemoro terror tenax ducimus spectaculum succedo. Villa similique deprimo coaegresco solum sto.,2024-10-13T17:41:47.663Z,0
670cca76e0941d56b05f2428,670cca73e0941d56b05ee5ad,670cca73e0941d56b05ee9be,Cognatus usque acquiro vilis sulum demulceo anser saepe sulum provident. Vorago crepusculum aut. Paens circumvenio talus.,2024-10-14T00:00:05.829Z,0
670cca76e0941d56b05f2429,670cca73e0941d56b05ee407,670cca73e0941d56b05ee87e,Repudiandae volva theatrum tristis cibus uberrime ex turpis vomer patrocinor. Repellendus alveus stella canis comparo subvenio spiculum ciminatio. Iste cribro nulla eos cuppedia aspicio triumphus minima quisquam coma.,2024-10-13T13:00:00.771Z,0
670cca76e0941d56b05f242a,670cca73e0941d56b05ee4b4,670cca73e0941d56b05ee6f3,Clementia ager adeo non ante dolore appello viduo crinis. Decerno tametsi colligo crux ars vomer virgo concido accusantium crustulum. Solio sustineo textus.,2024-10-14T04:11:48.663Z,0
670cca76e0941d56b05f242b,670cca73e0941d56b05ee291,670cca73e0941d56b05ee974,Tempore ipsam nam. Vergo adsum universe conor ustulo damnatio. Clementia admoveo cubicularis incidunt vergo cotidie terreo aestas suffoco conservo.,2024-10-14T04:12:23.116Z,0
670cca76e0941d56b05f242c,670cca73e0941d56b05ee363,670cca73e0941d56b05eea29,Vigilo atqui totidem teneo demo. Arcus vilicus comis umerus carus cuppedia adstringo. Censura thymbra terra dolores tondeo creator.,2024-10-13T23:30:05.316Z,0
670cca76e0941d56b05f242d,670cca73e0941d56b05ee27d,670cca73e0941d56b05ee706,Utroque exercitationem ultio tergiversatio apud vero xiphias cariosus assumenda thesaurus. Coerceo defendo officiis similique utroque officia fugiat eum valeo. Crinis cilicium repellat collum arx infit vulgaris commodo cavus cultellus.,2024-10-14T05:11:59.490Z,0
670cca76e0941d56b05f242e,670cca73e0941d56b05ee383,670cca73e0941d56b05ee882,Aeternus aggero caveo vulgaris ver. Victus vomito aveho vomer talus consequuntur bardus adhaero. Theca sed accusamus copia.,2024-10-14T01:32:20.341Z,0
670cca76e0941d56b05f242f,670cca73e0941d56b05ee347,670cca73e0941d56b05ee7e0,Carmen decumbo cicuta accendo demonstro deripio tutis. Tepesco concido aestus vapulus aveho consuasor solitudo titulus. Tamisium aperte apostolus tolero ipsa nam depereo tametsi debeo.,2024-10-13T16:28:01.041Z,0
670cca76e0941d56b05f2430,670cca73e0941d56b05ee567,670cca73e0941d56b05ee9d9,Inventore vestigium conculco. Deprimo sol eveniet vergo timor reiciendis voluptas clam. Antepono solium ulterius utrimque.,2024-10-13T16:03:43.505Z,0
