_id,userId,learningMaterialId,content,createdAt,__v
670cca76e0941d56b05f20fe,670cca73e0941d56b05ee4ff,670cca73e0941d56b05ee85e,Dolorum est unde clibanus cariosus artificiose dicta vita celo. Cruciamentum territo timor facere subseco vobis tabula. Trado deludo apto denuncio aestus tumultus cavus.,2024-10-13T14:09:27.449Z,0
670cca76e0941d56b05f20ff,670cca73e0941d56b05ee5da,670cca73e0941d56b05ee86a,Ambulo conventus paulatim caute fuga audeo iure. Reiciendis delectus cursus vitium surgo abscido debilito curo thalassinus amplexus. Toties nemo sol crepusculum caput.,2024-10-13T15:25:08.532Z,0
670cca76e0941d56b05f2100,670cca73e0941d56b05ee55b,670cca73e0941d56b05ee732,Non commodo fugiat defero admiratio pax. Deinde creptio trepide bis derelinquo audacia. Vilis aureus arbustum necessitatibus.,2024-10-13T22:25:14.365Z,0
670cca76e0941d56b05f2101,670cca73e0941d56b05ee60d,670cca73e0941d56b05ee75e,Alii molestiae tertius quibusdam adnuo vulnero. Vestigium veniam beatus curiositas cogo conor ut verto aliquam sint. Claro acies combibo sui amet custodia doloribus alo vorax.,2024-10-14T05:26:46.954Z,0
670cca76e0941d56b05f2102,670cca73e0941d56b05ee307,670cca73e0941d56b05eea3a,Curatio civis caritas. Accusantium temporibus terror verumtamen demens. Conscendo caute admitto cervus astrum suppono audentia officia decerno supellex.,2024-10-13T08:40:06.158Z,0
670cca76e0941d56b05f2103,670cca73e0941d56b05ee31c,670cca73e0941d56b05ee823,Via allatus voco tamen ventosus nisi vapulus cohibeo. Culpo commodo beatae turbo tero. Culpa occaecati aspernatur constans cernuus adeo accusator conspergo cunctatio temptatio.,2024-10-14T01:17:06.710Z,0
670cca76e0941d56b05f2104,670cca73e0941d56b05ee40e,670cca73e0941d56b05ee7c7,Circumvenio ademptio attero arma beatus desino esse voluptate spectaculum error. Solum contigo verbum comptus capto cupio conqueror utrum adipisci. Stipes crustulum coaegresco vetus solio baiulus denique.,2024-10-14T02:26:35.455Z,0
670cca76e0941d56b05f2105,670cca73e0941d56b05ee377,670cca73e0941d56b05ee86a,Arca cado calculus. Fuga quo ad sumo. Theca commodo ustilo apparatus ullam tam arx.,2024-10-14T00:03:30.384Z,0
670cca76e0941d56b05f2106,670cca73e0941d56b05ee64d,670cca73e0941d56b05ee757,Universe coadunatio aperio tempus torrens terreo. Quasi tabella ab ducimus delectatio. Claudeo valde voluptatem.,2024-10-14T01:33:26.393Z,0
670cca76e0941d56b05f2107,670cca73e0941d56b05ee4e8,670cca73e0941d56b05ee9cf,Victoria velociter suscipit territo veniam sapiente terebro. Concedo tamquam sub tempus colo. Amitto soluta spargo conitor supplanto.,2024-10-14T06:28:54.491Z,0
670cca76e0941d56b05f2108,670cca73e0941d56b05ee311,670cca73e0941d56b05eea25,Aliquid aetas depopulo cavus admiratio. Claustrum aut copia confero. Crapula volo depereo cauda.,2024-10-14T05:04:39.007Z,0
670cca76e0941d56b05f2109,670cca73e0941d56b05ee454,670cca73e0941d56b05ee94b,Corroboro quibusdam teres velit ullus delectus ipsa laboriosam. Vado mollitia validus catena crinis veritatis vereor tamisium conculco. Aqua cenaculum hic cumque fugiat acervus calculus quia vero arceo.,2024-10-13T19:54:02.458Z,0
670cca76e0941d56b05f210a,670cca73e0941d56b05ee618,670cca73e0941d56b05eea3a,Sui amissio speculum patrocinor subseco arbustum texo damno tutamen decens. Adopto ullam adficio cupiditate surculus terror condico. Facilis virgo angelus.,2024-10-14T00:44:37.147Z,0
670cca76e0941d56b05f210b,670cca73e0941d56b05ee285,670cca73e0941d56b05ee80d,Creber absum canis alii utpote caritas agnitio spargo. Conicio reiciendis demulceo sto contego caterva vigor textus curso adversus. Tripudio expedita denuncio balbus ascit arbustum eum ago vivo vitiosus.,2024-10-14T01:06:25.731Z,0
670cca76e0941d56b05f210c,670cca73e0941d56b05ee56b,670cca73e0941d56b05ee6db,Contra ultio vos aeneus brevis. Comminor tyrannus verto turpis cognomen. Tametsi suadeo maiores deprimo sono somniculosus.,2024-10-14T00:54:57.179Z,0
670cca76e0941d56b05f210d,670cca73e0941d56b05ee501,670cca73e0941d56b05ee8ce,Cubo combibo constans vestigium ago tremo admiratio alii. Uxor denuncio villa sordeo urbanus cruciamentum. Vox decerno distinctio demum cavus.,2024-10-14T04:22:52.893Z,0
670cca76e0941d56b05f210e,670cca73e0941d56b05ee333,670cca73e0941d56b05ee9dc,Terga ante voluptas tandem quia. Tergeo solum vapulus tolero magni officia. Abscido quidem aequus delego condico at curriculum defungo facere appono.,2024-10-14T02:23:16.455Z,0
670cca76e0941d56b05f210f,670cca73e0941d56b05ee416,670cca73e0941d56b05ee740,Amiculum totam vulgo. Confero tendo tersus tondeo appono audentia. Demens audacia apostolus nisi vinitor.,2024-10-13T19:14:35.560Z,0
670cca76e0941d56b05f2110,670cca73e0941d56b05ee329,670cca73e0941d56b05ee6cd,Bellicus demum assentator architecto cohibeo timidus. Totidem ater victus cogo corpus villa ulciscor mollitia. Thymum argumentum placeat verus patruus pecto conicio.,2024-10-13T12:06:53.504Z,0
670cca76e0941d56b05f2111,670cca73e0941d56b05ee2e5,670cca73e0941d56b05eea46,Depereo speciosus ubi et volutabrum tollo molestias cogito delego angustus. Cunabula vulnero tenetur. Amet summisse ancilla virgo conscendo amet.,2024-10-13T16:40:30.315Z,0
670cca76e0941d56b05f2112,670cca73e0941d56b05ee488,670cca73e0941d56b05ee6be,Aestas vacuus thalassinus supra torrens. Voluptatem velit voluptate tui stipes templum tabula aedificium universe thesaurus. Universe xiphias amitto allatus benevolentia aestas summa.,2024-10-13T22:35:38.470Z,0
670cca76e0941d56b05f2113,670cca73e0941d56b05ee2ce,670cca73e0941d56b05ee976,Suppellex vicinus vespillo denuo auxilium censura dens creber. Dicta vita aedificium tamen cilicium basium. Voluptate comprehendo cogito verbum ab peccatus modi ultio voveo contabesco.,2024-10-13T13:57:17.963Z,0
670cca76e0941d56b05f2114,670cca73e0941d56b05ee61f,670cca73e0941d56b05ee7ab,Cilicium truculenter tui tribuo. Clam incidunt adficio depereo. Crur temperantia volup vivo.,2024-10-13T23:45:11.052Z,0
670cca76e0941d56b05f2115,670cca73e0941d56b05ee4b7,670cca73e0941d56b05ee987,Usus vis carus creber copia fugiat bellum laudantium speciosus adaugeo. Soleo depereo patria tredecim caveo conventus demergo adhaero admiratio. Strenuus tum arbitro.,2024-10-13T23:02:05.003Z,0
670cca76e0941d56b05f2116,670cca73e0941d56b05ee319,670cca73e0941d56b05ee7c2,Claro nesciunt cur capitulus caritas desparatus. Conforto tabesco soleo desparatus. Mollitia abutor vesica supplanto minima demo.,2024-10-13T09:52:22.610Z,0
670cca76e0941d56b05f2117,670cca73e0941d56b05ee57a,670cca73e0941d56b05ee76d,Voluptates sperno arx tenuis. Comis vulgus nam caste tabella cornu via autem. Curriculum sono consuasor admiratio cerno conturbo corpus omnis.,2024-10-14T06:07:03.988Z,0
670cca76e0941d56b05f2118,670cca73e0941d56b05ee55a,670cca73e0941d56b05ee8df,Barba cogo taceo stabilis capto adversus supplanto tribuo. Tepidus culpo conspergo ultra urbs. Voro valetudo corona cubitum custodia illo.,2024-10-13T13:03:26.623Z,0
670cca76e0941d56b05f2119,670cca73e0941d56b05ee550,670cca73e0941d56b05ee8cb,Utrum voluptatem vapulus accusator ea annus. Civitas confido quas votum civitas aetas administratio aranea cribro. Votum antepono summisse surculus theatrum.,2024-10-14T01:44:49.330Z,0
670cca76e0941d56b05f211a,670cca73e0941d56b05ee568,670cca73e0941d56b05ee836,Suggero convoco statua comptus annus cicuta defungo. Virtus aperiam decumbo validus sollers placeat. Compello avarus cavus vulgaris.,2024-10-14T07:14:32.829Z,0
670cca76e0941d56b05f211b,670cca73e0941d56b05ee5b6,670cca73e0941d56b05ee9c8,Labore adfero ultio velut aedificium architecto baiulus beatus. Conitor toties caecus. Optio vomito desino aetas textus surculus.,2024-10-14T01:24:11.419Z,0
670cca76e0941d56b05f211c,670cca73e0941d56b05ee5cb,670cca73e0941d56b05ee992,Crustulum suscipit venia crustulum numquam. Cohors cognatus thesis tactus temeritas. Caelum cubicularis vinco baiulus aggero degusto trucido talio curso coruscus.,2024-10-13T11:01:08.537Z,0
670cca76e0941d56b05f211d,670cca73e0941d56b05ee3f6,670cca73e0941d56b05ee8da,Ullus tamisium talus supellex degusto succedo. Tredecim possimus comes versus. Molestiae cruciamentum amaritudo adversus suscipio.,2024-10-13T18:50:33.082Z,0
670cca76e0941d56b05f211e,670cca73e0941d56b05ee4d4,670cca73e0941d56b05ee7a0,Abscido supplanto artificiose tres canis ter delego. Supellex dedico coadunatio terror adficio defleo cognatus concido tremo vigor. Viscus caterva caries cruentus teneo.,2024-10-13T18:19:55.088Z,0
670cca76e0941d56b05f211f,670cca73e0941d56b05ee581,670cca73e0941d56b05ee8e0,Commemoro conicio amoveo. Libero amo textilis tracto tyrannus tabesco coepi averto. Decipio cibus cubicularis coma cito vix argumentum textor thema tabula.,2024-10-14T01:56:56.445Z,0
670cca76e0941d56b05f2120,670cca73e0941d56b05ee5a7,670cca73e0941d56b05ee80c,Occaecati cui antea pauci curo cunctatio dolores cariosus. Distinctio uxor casso studio corroboro torrens speciosus adsidue suasoria cohaero. Audeo repudiandae solitudo auctor spoliatio appositus vilicus adicio.,2024-10-13T16:40:43.392Z,0
670cca76e0941d56b05f2121,670cca73e0941d56b05ee3da,670cca73e0941d56b05ee762,Ago amoveo soleo pecus. Averto adsidue credo vereor nostrum cresco voluntarius substantia contego. Contabesco voluptates perspiciatis veritas adaugeo desipio tempus terga pecus conculco.,2024-10-14T06:38:27.410Z,0
670cca76e0941d56b05f2122,670cca73e0941d56b05ee533,670cca73e0941d56b05ee82f,Contabesco utilis aestus aequus. Casus suppellex sint curriculum acerbitas desparatus argumentum. Tam virga aperiam ipsa acer turbo sequi unde.,2024-10-13T10:39:47.129Z,0
670cca76e0941d56b05f2123,670cca73e0941d56b05ee516,670cca73e0941d56b05ee764,Talio adimpleo defleo curis tredecim neque cavus abutor. Vinculum cuppedia provident cetera stipes aspicio turba coma adhuc. Asper reprehenderit admitto.,2024-10-14T03:19:26.684Z,0
670cca76e0941d56b05f2124,670cca73e0941d56b05ee350,670cca73e0941d56b05ee80d,Spes at usitas valens. Unde comes curia confugo accusator pauper. Cogito coadunatio tergeo commemoro consequatur addo numquam cena facere denuncio.,2024-10-13T16:31:19.134Z,0
670cca76e0941d56b05f2125,670cca73e0941d56b05ee5e1,670cca73e0941d56b05ee6c8,Appello damnatio antiquus eum eos consequuntur impedit sto. Ultra tyrannus appono alii aliquam. Curso spiritus bonus cultellus strenuus studio creator abbas adstringo.,2024-10-14T05:15:46.746Z,0
670cca76e0941d56b05f2126,670cca73e0941d56b05ee3f4,670cca73e0941d56b05ee65f,Stipes communis doloremque cumque cohibeo varietas utilis tersus verecundia. Commodi vulnus accommodo. Sodalitas deserunt pariatur sum.,2024-10-13T19:38:03.678Z,0
670cca76e0941d56b05f2127,670cca73e0941d56b05ee357,670cca73e0941d56b05ee6c9,Animi aer abeo tantillus. Dolor repudiandae curvo coma clibanus admitto absum compello volup surculus. Asporto ratione tredecim defungo caries molestias deorsum.,2024-10-14T05:50:52.267Z,0
670cca76e0941d56b05f2128,670cca73e0941d56b05ee5f0,670cca73e0941d56b05ee874,Aperiam tollo dolore utrimque. Adulescens delectus caterva crinis voveo super adfectus vestigium vulariter sto. Delibero adsum toties stabilis apto deorsum.,2024-10-13T11:35:53.000Z,0
670cca76e0941d56b05f2129,670cca73e0941d56b05ee361,670cca73e0941d56b05ee856,Depopulo unus corroboro alienus facilis voluptatem possimus tutis delinquo. Clam aspicio possimus claro bibo tonsor aegrus vacuus. Accusantium civis adicio.,2024-10-13T18:35:54.229Z,0
670cca76e0941d56b05f212a,670cca73e0941d56b05ee52e,670cca73e0941d56b05ee752,Exercitationem nostrum arma delicate supplanto vulnus curso vinculum coaegresco. Nulla textus tenax caritas cultura volo absum thymbra conscendo autus. Pecco volaticus eligendi adhaero video varius.,2024-10-13T12:24:53.175Z,0
670cca76e0941d56b05f212b,670cca73e0941d56b05ee287,670cca73e0941d56b05ee732,Campana ventus atrox deludo pax suscipio vetus defungo. Amplitudo admitto timor. Victoria labore cognatus unde adflicto ocer esse.,2024-10-13T18:33:47.144Z,0
670cca76e0941d56b05f212c,670cca73e0941d56b05ee2dd,670cca73e0941d56b05ee921,Ambulo in consectetur pauper nisi blanditiis cumque totus. Tandem autem pariatur mollitia curo patruus sperno cervus voluptatibus. Conor animadverto thymum velum adstringo uberrime.,2024-10-13T11:29:30.765Z,0
670cca76e0941d56b05f212d,670cca73e0941d56b05ee5b1,670cca73e0941d56b05ee84e,Trucido quaerat peccatus argentum dicta tabella comis. Deleniti decipio amplitudo uterque hic ea cado. Vestrum custodia caritas.,2024-10-14T00:39:16.070Z,0
670cca76e0941d56b05f212e,670cca73e0941d56b05ee2f7,670cca73e0941d56b05ee983,Accommodo sto caute virgo usitas vulnero sapiente depopulo vere numquam. Vulgaris tero decimus approbo. Allatus tepesco usus esse succedo aestus.,2024-10-13T23:31:49.383Z,0
670cca76e0941d56b05f212f,670cca73e0941d56b05ee3eb,670cca73e0941d56b05ee76a,Derelinquo ratione admoveo conturbo. Adflicto spes tamdiu. Decet sumo annus avarus consectetur dicta derideo voro bis verus.,2024-10-14T03:31:35.145Z,0
670cca76e0941d56b05f2130,670cca73e0941d56b05ee3ae,670cca73e0941d56b05eea21,Summopere adsidue vilis antiquus universe. Tabella minus volubilis odit paens tersus repudiandae. Caterva thesis surculus consectetur spectaculum laboriosam quam vilitas.,2024-10-14T00:02:40.661Z,0
670cca76e0941d56b05f2131,670cca73e0941d56b05ee481,670cca73e0941d56b05ee7f3,Caelestis non color aegrotatio corona tabella avarus cognomen arma. Desipio conspergo sed tutamen. Comminor ambitus contego sursum cauda.,2024-10-13T18:39:21.132Z,0
670cca76e0941d56b05f2132,670cca73e0941d56b05ee3a1,670cca73e0941d56b05ee993,Tubineus agnosco terreo necessitatibus texo esse cubicularis conspergo tollo. Aequus carus eaque comburo. Cicuta tamquam verbum.,2024-10-13T15:11:38.587Z,0
670cca76e0941d56b05f2133,670cca73e0941d56b05ee2f6,670cca73e0941d56b05ee8b2,Pectus conitor suscipit confido. Laboriosam vulnero cinis capio dedico terminatio. Tergo nostrum astrum ventus celebrer culpa vergo cogito.,2024-10-13T08:45:07.535Z,0
670cca76e0941d56b05f2134,670cca73e0941d56b05ee404,670cca73e0941d56b05ee77b,Ait apostolus color cernuus. Basium supellex dolor nobis. Colligo defetiscor ver tero damnatio.,2024-10-13T17:10:22.145Z,0
670cca76e0941d56b05f2135,670cca73e0941d56b05ee2e3,670cca73e0941d56b05ee6e0,Earum coadunatio cruciamentum aegrus voco comis advenio vorax. Conspergo video thymbra textilis praesentium demoror. Aliqua demens cubo amita adulatio curis crux.,2024-10-13T15:55:56.672Z,0
670cca76e0941d56b05f2136,670cca73e0941d56b05ee2d5,670cca73e0941d56b05ee814,Conatus aureus cuppedia accommodo. Admoveo sub cum cavus aeger. Turpis confugo vestrum despecto.,2024-10-13T12:03:39.451Z,0
670cca76e0941d56b05f2137,670cca73e0941d56b05ee58c,670cca73e0941d56b05ee6c6,Quisquam mollitia sophismata error caute. Arbor annus demonstro vorago bos cernuus vespillo considero ocer adficio. Custodia mollitia amplus ullam corrigo blanditiis adimpleo desino.,2024-10-13T17:04:03.196Z,0
670cca76e0941d56b05f2138,670cca73e0941d56b05ee2a6,670cca73e0941d56b05ee7fe,Usus tantum comptus valens caput quae similique suscipio. Rem vinitor denique. Vesica cetera sulum totidem atrocitas.,2024-10-13T20:26:38.038Z,0
670cca76e0941d56b05f2139,670cca73e0941d56b05ee53c,670cca73e0941d56b05ee833,Bis tolero ustilo cohaero suppono speculum trans. Bellum brevis assentator creptio caelestis astrum spero animi depromo. Auditor turbo aggero considero carus verto abeo aurum abscido utor.,2024-10-14T06:11:23.349Z,0
670cca76e0941d56b05f213a,670cca73e0941d56b05ee2be,670cca73e0941d56b05ee982,Sulum tepesco tego. Depono vilitas vinco urbs cornu. Copiose capto audeo ambitus tolero concido cotidie curvo bardus.,2024-10-14T04:29:47.636Z,0
670cca76e0941d56b05f213b,670cca73e0941d56b05ee356,670cca73e0941d56b05ee980,Succedo labore complectus tergiversatio talus thymum repudiandae utor earum. Clibanus defero celer velociter volo volaticus surgo terebro caelum ulterius. Cornu pecco iste suadeo illum sufficio virgo tristis vinitor.,2024-10-13T15:12:16.894Z,0
670cca76e0941d56b05f213c,670cca73e0941d56b05ee636,670cca73e0941d56b05ee7ae,Tutamen vestigium considero debilito sto adfero texo tubineus. Voluptatum voluntarius spiculum amaritudo sodalitas cunae. Thorax tondeo itaque volup uterque.,2024-10-13T23:23:52.816Z,0
670cca76e0941d56b05f213d,670cca73e0941d56b05ee33a,670cca73e0941d56b05eea2f,Complectus temptatio clamo subiungo aveho surculus. Tenus vulnero angelus tamen ago. Sui clam tonsor deleo despecto arbustum adeo vesper.,2024-10-13T20:13:21.394Z,0
670cca76e0941d56b05f213e,670cca73e0941d56b05ee50e,670cca73e0941d56b05ee895,Quo titulus infit pauci deprecator. Quidem comparo ulterius vaco doloribus bonus vivo clibanus magni. Vilitas spargo at ulciscor pauci.,2024-10-13T18:52:44.561Z,0
670cca76e0941d56b05f213f,670cca73e0941d56b05ee55c,670cca73e0941d56b05ee6fa,Earum ascisco volup curia. Chirographum aliqua repudiandae aliquam defetiscor amet atque pecto. Suffoco traho armarium tabella deleniti tracto.,2024-10-13T19:41:25.845Z,0
670cca76e0941d56b05f2140,670cca73e0941d56b05ee559,670cca73e0941d56b05ee89b,Doloribus suasoria temeritas atrox ipsam ater cunae beneficium tersus. Suffoco tenax attero suasoria argumentum colo tabesco amitto arbitro velit. Libero urbs tardus amplitudo.,2024-10-14T03:52:34.044Z,0
670cca76e0941d56b05f2141,670cca73e0941d56b05ee5bf,670cca73e0941d56b05ee708,Aequitas vulticulus cavus degero capto voro tandem utique. Adversus aestivus usus vis. Degenero suus spargo deleo vis unde.,2024-10-13T18:25:55.383Z,0
670cca76e0941d56b05f2142,670cca73e0941d56b05ee64b,670cca73e0941d56b05ee82b,Turpis tamisium sulum artificiose valens defluo compello uterque cursus. Depopulo arto aggredior suscipio vicissitudo adsuesco conspergo. Numquam usitas aeternus amo pel ustilo virtus arbitro quasi acies.,2024-10-14T01:55:53.126Z,0
670cca76e0941d56b05f2143,670cca73e0941d56b05ee55e,670cca73e0941d56b05ee73a,Celer fuga umbra pel talio ascisco. Aiunt ratione correptius arcesso aegrotatio optio culpa deleo beatus nisi. Abstergo denuncio eveniet creta textilis casso culpo ascit.,2024-10-13T19:51:18.974Z,0
670cca76e0941d56b05f2144,670cca73e0941d56b05ee43c,670cca73e0941d56b05ee7d4,Talis cibo demoror theologus delinquo clarus pecco vae officia. Carmen coniuratio cunabula despecto. Cernuus cruentus adsuesco.,2024-10-13T17:44:58.907Z,0
670cca76e0941d56b05f2145,670cca73e0941d56b05ee4e0,670cca73e0941d56b05ee871,Abstergo minima sulum addo damnatio torqueo villa. Vomica dedico subito acidus aequitas clam urbanus. Pecto demonstro defendo decet defero.,2024-10-13T08:07:24.225Z,0
670cca76e0941d56b05f2146,670cca73e0941d56b05ee5ef,670cca73e0941d56b05ee79a,Adfero defessus cena. Adficio thalassinus ver. Curiositas tollo crepusculum cattus dicta error.,2024-10-13T19:27:05.016Z,0
670cca76e0941d56b05f2147,670cca73e0941d56b05ee28c,670cca73e0941d56b05ee7aa,Utique aequitas tutis fuga ager tabgo demens consectetur tempus vis. Vigor accusantium clibanus demonstro video talus. Speculum una illum creator decipio celebrer.,2024-10-13T10:19:23.706Z,0
670cca76e0941d56b05f2148,670cca73e0941d56b05ee426,670cca73e0941d56b05ee7ee,Compono vivo celo. Unde vinculum calcar quas quas tenetur vulgivagus audacia curriculum bibo. Cicuta apto vigor tabernus totidem abbas acervus odio.,2024-10-14T03:07:16.784Z,0
670cca76e0941d56b05f2149,670cca73e0941d56b05ee457,670cca73e0941d56b05ee9e6,Arbustum tener accusator est conatus. Stabilis cultura vulgivagus cado aer canis nemo desidero callide. Aestivus arcesso veritatis vorax ventus adulatio ascisco ars volubilis adinventitias.,2024-10-14T04:02:51.105Z,0
670cca76e0941d56b05f214a,670cca73e0941d56b05ee407,670cca73e0941d56b05ee6ef,Temeritas solus voro tollo copiose decor undique angulus thorax tamisium. Suspendo vaco tribuo patior acer aliqua fugit saepe cilicium alo. Tantum decimus censura defessus pariatur cuius cuius explicabo nisi depraedor.,2024-10-13T20:11:07.518Z,0
670cca76e0941d56b05f214b,670cca73e0941d56b05ee4ac,670cca73e0941d56b05eea12,Decens acceptus curiositas aestivus venio aegre. Approbo totam ultio vitae color. Terreo certus laudantium facilis deleniti tametsi appositus urbanus.,2024-10-13T23:17:18.621Z,0
670cca76e0941d56b05f214c,670cca73e0941d56b05ee5eb,670cca73e0941d56b05ee948,Defendo considero triduana magni accusantium laudantium. Vicinus truculenter derideo atrocitas angulus cras valetudo. Depromo quidem victoria vesco angustus demens.,2024-10-13T17:59:13.779Z,0
670cca76e0941d56b05f214d,670cca73e0941d56b05ee4d5,670cca73e0941d56b05eea30,Aegrus absum vere tripudio ratione. Desino quia ventosus. Impedit et acidus aestus conatus.,2024-10-14T06:05:42.494Z,0
670cca76e0941d56b05f214e,670cca73e0941d56b05ee344,670cca73e0941d56b05ee7e9,Spoliatio video abduco patrocinor sodalitas. Vulnero condico amor deficio caelum. Capio inflammatio appositus vociferor amissio vereor depono.,2024-10-13T13:28:14.321Z,0
670cca76e0941d56b05f214f,670cca73e0941d56b05ee655,670cca73e0941d56b05ee9ed,Assumenda accusamus degenero tripudio ancilla adhuc statua. Sumo solum corroboro addo teneo comprehendo cotidie suscipio. Labore minus spargo bonus ater ipsa thymum cervus vespillo.,2024-10-13T11:25:54.666Z,0
670cca76e0941d56b05f2150,670cca73e0941d56b05ee50f,670cca73e0941d56b05eea16,Adicio decipio voluptatum laudantium despecto approbo volva cultellus calamitas. Aliqua nam vilicus vicinus vicissitudo subito crustulum adflicto subvenio. Suppono crapula aestus nesciunt quibusdam.,2024-10-13T12:06:23.238Z,0
670cca76e0941d56b05f2151,670cca73e0941d56b05ee650,670cca73e0941d56b05ee9a9,Ceno defendo vitae doloremque cupiditate sperno quasi tollo vinitor colligo. Apto acervus cibo stabilis deludo cinis. Aperio copia necessitatibus summopere cena amaritudo delectatio adhaero viridis cetera.,2024-10-13T12:39:02.606Z,0
670cca76e0941d56b05f2152,670cca73e0941d56b05ee559,670cca73e0941d56b05ee8be,Tego soluta odit conculco copiose. Delego modi coadunatio nulla viridis strenuus vestigium terreo surculus veniam. Temporibus aiunt provident virgo.,2024-10-13T13:09:37.560Z,0
670cca76e0941d56b05f2153,670cca73e0941d56b05ee4a6,670cca73e0941d56b05ee9bc,Tersus atque adicio auxilium eum audacia videlicet ducimus vacuus. Sollicito delego unus peccatus corroboro. Testimonium vesica ulciscor asporto.,2024-10-13T10:20:31.177Z,0
670cca76e0941d56b05f2154,670cca73e0941d56b05ee585,670cca73e0941d56b05ee8fc,Corrigo desidero necessitatibus audacia curis. Antea tamdiu cohibeo tergiversatio quae rem delectus. Soleo iste celebrer minima sublime annus tumultus consequuntur tredecim.,2024-10-13T16:40:40.328Z,0
670cca76e0941d56b05f2155,670cca73e0941d56b05ee4a3,670cca73e0941d56b05ee7df,Cohaero voluptas minus. Quae acer coniecto sponte thalassinus tametsi. Possimus coma infit suasoria.,2024-10-13T19:34:51.827Z,0
670cca76e0941d56b05f2156,670cca73e0941d56b05ee301,670cca73e0941d56b05ee82b,Modi angelus et ducimus eligendi. Sono pauper paulatim. Auctus coadunatio ipsam summopere studio arx ceno absens vulnus.,2024-10-14T00:43:35.872Z,0
670cca76e0941d56b05f2157,670cca73e0941d56b05ee3f0,670cca73e0941d56b05ee994,Turba ver ante collum vinum tergo somniculosus suscipit combibo. Delicate crepusculum sum ascisco defungo cruentus textilis excepturi curtus. Creator tactus aegre advenio.,2024-10-13T20:29:09.902Z,0
670cca76e0941d56b05f2158,670cca73e0941d56b05ee625,670cca73e0941d56b05ee94d,Spero thorax architecto concido crinis amplexus. Tactus subvenio combibo vestrum alioqui peior copia demens ipsum. Amor cultellus non capitulus thymbra neque conventus.,2024-10-13T12:04:14.034Z,0
670cca76e0941d56b05f2159,670cca73e0941d56b05ee291,670cca73e0941d56b05ee805,Attero defungo depromo sophismata usus studio. Vitium demens labore animi. Cilicium attollo denego tracto cumque beatae autem casus bardus aegre.,2024-10-14T00:47:36.406Z,0
670cca76e0941d56b05f215a,670cca73e0941d56b05ee28c,670cca73e0941d56b05ee728,Fuga bardus termes aetas thalassinus curvo ambitus aegre arto. Trepide decens amitto deludo thema attollo aranea. Depulso tenax turba decerno animi suus aliquid super paens sollicito.,2024-10-13T09:44:22.973Z,0
670cca76e0941d56b05f215b,670cca73e0941d56b05ee51f,670cca73e0941d56b05ee76c,Eum aggredior sto delego ancilla quod dolores uxor cattus. Desparatus contego totidem patrocinor ascisco apud sursum adficio coadunatio. Ventus audacia urbanus cupiditas derelinquo.,2024-10-13T20:05:34.584Z,0
670cca76e0941d56b05f215c,670cca73e0941d56b05ee51c,670cca73e0941d56b05eea01,Maiores adipisci corrupti summisse. Vado baiulus sublime conventus. Temporibus clementia recusandae ceno odio ager torqueo.,2024-10-14T06:46:16.358Z,0
670cca76e0941d56b05f215d,670cca73e0941d56b05ee3b5,670cca73e0941d56b05ee84c,Spiritus tabesco asporto alveus attero pel veniam adstringo. Consequuntur somnus talis velut possimus ipsa adduco attonbitus. Custodia vos surculus caries creator.,2024-10-14T00:14:48.837Z,0
670cca76e0941d56b05f215e,670cca73e0941d56b05ee487,670cca73e0941d56b05ee827,Terror coniecto temperantia et ara. Amplitudo aperio sol callide tredecim aperio depromo dolor arcus. Auxilium suscipio adulatio culpo vinculum demergo conturbo clam vir volup.,2024-10-13T11:01:54.300Z,0
670cca76e0941d56b05f215f,670cca73e0941d56b05ee3c2,670cca73e0941d56b05ee7b0,Deprimo deludo tum magni baiulus admoveo truculenter taedium. Defluo tergiversatio repudiandae sequi aut dolorem centum qui arcus talis. Considero vulticulus statim ut vigilo error abstergo valeo aiunt vaco.,2024-10-13T11:38:25.159Z,0
670cca76e0941d56b05f2160,670cca73e0941d56b05ee3fc,670cca73e0941d56b05ee9db,Pecus basium cognatus. Theca tum video bene aliquid urbs ver astrum. Dicta cubicularis thymbra artificiose tui antiquus tracto adstringo aeneus vehemens.,2024-10-14T06:06:31.158Z,0
670cca76e0941d56b05f2161,670cca73e0941d56b05ee55d,670cca73e0941d56b05ee985,Verus magnam denego eaque occaecati unus custodia. Maiores assentator antiquus color aegrus amicitia tempora rem canis aeneus. Theca deleo mollitia versus asperiores beneficium.,2024-10-13T13:37:58.314Z,0
670cca76e0941d56b05f2162,670cca73e0941d56b05ee502,670cca73e0941d56b05ee968,Alias stella calamitas. Aut est vehemens vomito eaque synagoga vespillo arceo capillus thymbra. Modi acquiro dolores pauci ocer nulla canis despecto uterque tibi.,2024-10-13T16:29:30.419Z,0
