_id,userId,learningMaterialId,content,createdAt,__v
670cca76e0941d56b05f21c8,670cca73e0941d56b05ee2ed,670cca73e0941d56b05ee810,Non adduco triduana volutabrum candidus depereo vicinus cultura averto. Vomer color cum. Theca suasoria tredecim vinitor arbor ratione cruciamentum creber tertius.,2024-10-13T18:57:40.135Z,0
670cca76e0941d56b05f21c9,670cca73e0941d56b05ee59e,670cca73e0941d56b05ee87b,Depulso vindico deporto creator minima denuncio cupiditate theca possimus ara. Sordeo coaegresco alveus. Vomica voluptas aequitas coepi tripudio benigne adfero strues abbas.,2024-10-13T14:44:25.047Z,0
670cca76e0941d56b05f21ca,670cca73e0941d56b05ee5d5,670cca73e0941d56b05ee8d4,Una delego solium umbra. Urbs tersus decipio cavus aliquam contego cuppedia cresco cena. Collum aegre armarium aeternus tactus adimpleo decimus.,2024-10-13T21:24:55.489Z,0
670cca76e0941d56b05f21cb,670cca73e0941d56b05ee4e5,670cca73e0941d56b05ee8e4,Fuga thymum trepide ciminatio patria. Delinquo vomica caecus cras vulticulus deputo villa suscipio avarus aspernatur. Coerceo territo distinctio adflicto impedit aptus pecto curiositas.,2024-10-14T02:27:40.869Z,0
670cca76e0941d56b05f21cc,670cca73e0941d56b05ee2d4,670cca73e0941d56b05ee977,Quae atrocitas aggredior arma coadunatio. Summopere credo sustineo itaque cogito clamo suspendo defendo. Voluptates curso vesica aliqua catena absconditus adfectus adfectus conturbo.,2024-10-13T08:05:51.145Z,0
670cca76e0941d56b05f21cd,670cca73e0941d56b05ee27a,670cca73e0941d56b05ee8c2,Maxime adulescens deserunt. Ara tollo subiungo dolor cursim umquam vilitas collum. Caput defleo damno teres curo decens aurum votum.,2024-10-13T22:49:52.416Z,0
670cca76e0941d56b05f21ce,670cca73e0941d56b05ee52a,670cca73e0941d56b05ee8e3,Usus tubineus vicissitudo depono. Ultio dolorum cibus vestigium animus congregatio aperiam. Sumptus vinitor cinis deprimo tyrannus suus infit vaco convoco.,2024-10-14T02:09:15.180Z,0
670cca76e0941d56b05f21cf,670cca73e0941d56b05ee4de,670cca73e0941d56b05ee99d,Peccatus abscido molestiae curvo desipio vinitor. Conor ante tardus bibo adamo. Super paulatim pauper delectatio catena.,2024-10-13T23:19:06.772Z,0
670cca76e0941d56b05f21d0,670cca73e0941d56b05ee52b,670cca73e0941d56b05ee85d,Casso volutabrum ullam abutor. Demergo inflammatio somniculosus suasoria circumvenio conatus. Tonsor agnosco sordeo cotidie comis adflicto.,2024-10-13T21:20:55.469Z,0
670cca76e0941d56b05f21d1,670cca73e0941d56b05ee2e9,670cca73e0941d56b05ee8fa,Audax ipsam arbor ratione odit comminor aedificium cultura. Tempore inflammatio victoria subito turpis incidunt astrum dolorum celebrer. Sophismata cenaculum tepidus complectus corona appello tyrannus.,2024-10-13T13:55:05.360Z,0
670cca76e0941d56b05f21d2,670cca73e0941d56b05ee431,670cca73e0941d56b05ee74c,Summa campana dedico cultellus uberrime abbas conduco tum. Pel ustulo molestias cariosus tolero aut. Tabella nisi absorbeo sol utrimque.,2024-10-13T19:20:12.836Z,0
670cca76e0941d56b05f21d3,670cca73e0941d56b05ee3c8,670cca73e0941d56b05ee70d,Capillus calco depulso aestivus arto synagoga. Defaeco thesis tabgo despecto ea tumultus alioqui ullam stillicidium bis. Assumenda compono conduco taedium velum maxime astrum non sperno.,2024-10-13T23:01:26.296Z,0
670cca76e0941d56b05f21d4,670cca73e0941d56b05ee3a5,670cca73e0941d56b05ee6f5,Artificiose ultio defungo delicate. Tolero amet cavus confugo alii ait. Suscipit tutis degenero crastinus accedo urbs.,2024-10-13T11:30:59.083Z,0
670cca76e0941d56b05f21d5,670cca73e0941d56b05ee310,670cca73e0941d56b05ee8e5,Aspernatur cinis impedit constans alius delinquo candidus dignissimos. Voluptas tepidus aperte aequitas adeptio pariatur. Timidus vis stillicidium casus saepe deleo eaque adeptio auditor.,2024-10-13T10:14:42.249Z,0
670cca76e0941d56b05f21d6,670cca73e0941d56b05ee470,670cca73e0941d56b05ee98e,Admoneo commodo adfectus voluptatibus terreo teres. Absconditus alius exercitationem alioqui sit tego tredecim bibo. Aufero tabella virtus voco creber vitae supra.,2024-10-13T21:27:55.802Z,0
670cca76e0941d56b05f21d7,670cca73e0941d56b05ee5e2,670cca73e0941d56b05ee7c8,Angustus tui aurum aegrus paens blandior coma hic ver. Ascisco credo suscipio. Assumenda congregatio certe sustineo caritas ullus cum corrupti.,2024-10-13T22:26:08.582Z,0
670cca76e0941d56b05f21d8,670cca73e0941d56b05ee4b1,670cca73e0941d56b05ee9aa,Adulescens ulciscor synagoga. Antiquus esse bellicus somniculosus defluo velociter. Virga theca textus depopulo arbustum amet.,2024-10-13T15:38:19.905Z,0
670cca76e0941d56b05f21d9,670cca73e0941d56b05ee470,670cca73e0941d56b05ee901,Aspicio arguo sortitus vilis acies. Atque tondeo veritatis ipsam. Odio verumtamen candidus administratio.,2024-10-13T13:14:01.647Z,0
670cca76e0941d56b05f21da,670cca73e0941d56b05ee409,670cca73e0941d56b05ee72c,Velociter valetudo advenio solum casus ceno. Vigilo cibo crastinus a capto vulticulus sono theca. Vesica compello minus libero occaecati arbustum temperantia corrumpo torrens.,2024-10-13T20:31:01.265Z,0
670cca76e0941d56b05f21db,670cca73e0941d56b05ee3c1,670cca73e0941d56b05ee85b,Cupressus vero theologus accommodo suadeo tot tenus aliqua confero. Illum antepono acervus texo agnosco confugo rem. Solum odio cogo toties tactus clam.,2024-10-13T13:44:59.727Z,0
670cca76e0941d56b05f21dc,670cca73e0941d56b05ee58f,670cca73e0941d56b05ee779,Tredecim sordeo confido magni textor summopere. Terror benevolentia sortitus soleo. Possimus tracto suspendo ciminatio speciosus complectus velit.,2024-10-13T15:27:30.239Z,0
670cca76e0941d56b05f21dd,670cca73e0941d56b05ee4d3,670cca73e0941d56b05ee747,Cumque maiores delectatio valde amoveo templum stips demens venia. Texo quisquam subvenio vergo ars. Ver soluta totidem necessitatibus adnuo.,2024-10-13T19:51:39.991Z,0
670cca76e0941d56b05f21de,670cca73e0941d56b05ee5a4,670cca73e0941d56b05ee79e,Charisma catena decumbo. Clarus amiculum bis validus nobis. Ubi aliquid utor creo crinis depulso ubi utpote comprehendo.,2024-10-13T15:58:55.931Z,0
670cca76e0941d56b05f21df,670cca73e0941d56b05ee566,670cca73e0941d56b05ee938,Corpus demoror asper absorbeo careo custodia ventito vesco conculco ea. Supplanto ustilo capto cribro admoneo aegrus numquam accommodo adicio benigne. Utpote capto despecto delibero suppellex ars tutis.,2024-10-14T07:20:22.465Z,0
670cca76e0941d56b05f21e0,670cca73e0941d56b05ee335,670cca73e0941d56b05ee6a5,Astrum solitudo utpote conservo strues. Sordeo bellum ipsa collum balbus colligo delectus illum conduco tantillus. Cursus conscendo victus creber conor strenuus quaerat cornu spes tutamen.,2024-10-13T13:37:04.896Z,0
670cca76e0941d56b05f21e1,670cca73e0941d56b05ee316,670cca73e0941d56b05ee884,Curtus quod nobis. Cetera modi careo venia suscipio cenaculum nostrum taceo umbra crastinus. Depereo teneo vere denego fugit audentia trado volubilis cohaero amor.,2024-10-13T11:18:16.404Z,0
670cca76e0941d56b05f21e2,670cca73e0941d56b05ee454,670cca73e0941d56b05ee6cb,Maxime degenero calcar ducimus. Adsuesco trans ciminatio acceptus catena cornu cruciamentum sodalitas culpa officiis. Sodalitas communis varietas validus patria asper ea.,2024-10-13T15:32:10.242Z,0
670cca76e0941d56b05f21e3,670cca73e0941d56b05ee538,670cca73e0941d56b05ee7eb,Suus confugo audentia alias labore. Vulgus summa virtus theatrum molestias surgo aequus peior. Quia audacia ab cerno aqua stella una acsi.,2024-10-14T04:46:52.684Z,0
670cca76e0941d56b05f21e4,670cca73e0941d56b05ee5fb,670cca73e0941d56b05ee8d5,Audio atqui adficio dedecor sodalitas arcus vicinus illo adsum. Ea depereo substantia doloribus sed culpo varius celo aveho. Appositus culpo thymbra conitor tertius brevis antea arbitro considero confido.,2024-10-13T15:28:32.849Z,0
670cca76e0941d56b05f21e5,670cca73e0941d56b05ee322,670cca73e0941d56b05ee9ad,Cogito tergum adfectus cruentus termes cuppedia. Complectus cupio artificiose minima cibo texo excepturi facere tepesco degusto. Despecto vetus inflammatio.,2024-10-13T23:08:47.304Z,0
670cca76e0941d56b05f21e6,670cca73e0941d56b05ee473,670cca73e0941d56b05eea0e,Vomito varius tibi verumtamen. Cometes vae vesco delego thermae comptus ad concido omnis sui. Occaecati rerum adopto conservo deprecator volo thorax audio vulgivagus.,2024-10-14T00:53:32.810Z,0
670cca76e0941d56b05f21e7,670cca73e0941d56b05ee2f6,670cca73e0941d56b05ee7ce,Dolorum expedita virga curso conitor tametsi tyrannus auctor unde. Aperio acsi damno decens canonicus adinventitias ambitus. Administratio vereor cunabula vetus adinventitias confero contabesco absens uterque.,2024-10-13T11:21:07.532Z,0
670cca76e0941d56b05f21e8,670cca73e0941d56b05ee2a7,670cca73e0941d56b05ee7fc,Ascisco addo comis capitulus. Adopto theca apostolus ullam. Carmen vitiosus censura temperantia caste talus consuasor venio claudeo.,2024-10-13T09:09:13.682Z,0
670cca76e0941d56b05f21e9,670cca73e0941d56b05ee344,670cca73e0941d56b05ee724,Tremo demonstro stipes arbitro. Deleniti utor tamdiu facere depopulo. Statua quo maiores vespillo terra.,2024-10-13T23:20:34.763Z,0
670cca76e0941d56b05f21ea,670cca73e0941d56b05ee42f,670cca73e0941d56b05ee948,Summopere aqua blanditiis quia temeritas venia. Curo certus minus carus acidus cotidie rerum sufficio. Viriliter quae alveus veniam cervus nihil.,2024-10-13T18:01:14.924Z,0
670cca76e0941d56b05f21eb,670cca73e0941d56b05ee553,670cca73e0941d56b05ee728,Omnis sol nulla animus compello. Velociter atque mollitia capio. Adaugeo cetera amicitia.,2024-10-13T16:32:32.709Z,0
670cca76e0941d56b05f21ec,670cca73e0941d56b05ee53c,670cca73e0941d56b05ee881,Tutis centum earum. Nulla illum beneficium verto stabilis aeger velociter. Tamen uxor aspernatur abundans.,2024-10-13T23:37:21.249Z,0
670cca76e0941d56b05f21ed,670cca73e0941d56b05ee515,670cca73e0941d56b05ee8cc,Vigor vindico chirographum aeneus veritas. Tendo cedo vociferor quibusdam cum. Facilis deduco amplexus copia perspiciatis.,2024-10-13T15:36:16.569Z,0
670cca76e0941d56b05f21ee,670cca73e0941d56b05ee421,670cca73e0941d56b05ee91b,Audio amicitia modi suppellex benigne clam cursus valeo. Copiose apostolus vorago. Videlicet barba cursim vir solio aufero cui suffoco.,2024-10-13T19:33:58.787Z,0
670cca76e0941d56b05f21ef,670cca73e0941d56b05ee606,670cca73e0941d56b05ee684,Corrigo debeo claro. Quo aurum inflammatio toties spes ducimus tepidus subvenio. Odio avarus cunae viriliter angelus.,2024-10-13T08:36:05.905Z,0
670cca76e0941d56b05f21f0,670cca73e0941d56b05ee38b,670cca73e0941d56b05ee872,Thorax certe architecto viduo culpa. Aeger degusto modi urbs ambitus benigne vaco. Commodi speciosus quasi tardus pel theologus.,2024-10-13T12:46:43.124Z,0
670cca76e0941d56b05f21f1,670cca73e0941d56b05ee38c,670cca73e0941d56b05ee7b8,Alioqui deinde assumenda utilis adduco non quibusdam verumtamen decor amaritudo. Defluo suffragium vestigium. Terra agnitio cuius vigilo carmen vito optio sint careo vergo.,2024-10-13T20:18:24.232Z,0
670cca76e0941d56b05f21f2,670cca73e0941d56b05ee5af,670cca73e0941d56b05ee9e7,Absens confero quo vinco considero socius confugo assentator benevolentia. Aestas adfectus neque comminor amitto capto aut. Nesciunt ars pauci succurro copia conforto tremo aliqua audeo.,2024-10-14T05:33:13.891Z,0
670cca76e0941d56b05f21f3,670cca73e0941d56b05ee28e,670cca73e0941d56b05ee8c8,Depulso unus adeptio absorbeo thymbra alius conspergo calco basium. Beneficium cervus infit corrupti comedo. Aestus confero virga amplitudo amoveo fugit.,2024-10-14T00:58:16.366Z,0
670cca76e0941d56b05f21f4,670cca73e0941d56b05ee5e5,670cca73e0941d56b05ee803,Tyrannus stella trepide cruciamentum at amplexus tantum. Ex stipes voluptate cogito sperno aeneus. Adfectus adopto vereor valetudo caute dignissimos venio angelus vetus deludo.,2024-10-13T12:26:19.269Z,0
670cca76e0941d56b05f21f5,670cca73e0941d56b05ee3bd,670cca73e0941d56b05ee6af,Ager subito curriculum vinco unus tenuis careo corrumpo altus. Nam cubo annus adipiscor minus virtus thorax conturbo. Candidus vicissitudo architecto demoror.,2024-10-13T19:03:19.853Z,0
670cca76e0941d56b05f21f6,670cca73e0941d56b05ee324,670cca73e0941d56b05ee862,Terror iure carus conspergo tam aptus. Decimus conforto corona sufficio cumque. Appositus tam fugit tenuis perspiciatis ducimus acceptus creator atrox.,2024-10-13T22:51:34.921Z,0
670cca76e0941d56b05f21f7,670cca73e0941d56b05ee4f3,670cca73e0941d56b05ee9ff,Tenus tergum sint arceo adstringo dapifer. Vapulus adfero dens defendo. Consectetur aegrus cruciamentum nulla voco ademptio una beatus cunabula convoco.,2024-10-14T06:15:21.185Z,0
670cca76e0941d56b05f21f8,670cca73e0941d56b05ee45a,670cca73e0941d56b05ee89d,Nemo spoliatio utilis. Speculum admoveo coma hic testimonium coniuratio mollitia utor canonicus adhuc. Tibi aureus aiunt sollicito aestus cursus comparo.,2024-10-13T17:16:32.255Z,0
670cca76e0941d56b05f21f9,670cca73e0941d56b05ee524,670cca73e0941d56b05ee888,Abduco cupressus studio. Autem addo terga temporibus demoror coadunatio tendo. Cenaculum argumentum balbus decet.,2024-10-13T23:57:40.307Z,0
670cca76e0941d56b05f21fa,670cca73e0941d56b05ee38d,670cca73e0941d56b05ee8e4,Vinitor cattus averto. Theologus vesper amplus adnuo bellum umbra. Aer tabula aetas ancilla.,2024-10-13T22:34:42.847Z,0
670cca76e0941d56b05f21fb,670cca73e0941d56b05ee625,670cca73e0941d56b05ee9e3,Compono vilis conforto alioqui absorbeo traho stella repellendus peior. Patria aufero qui. Autem clamo maiores avaritia vulgo basium adopto.,2024-10-13T13:38:41.958Z,0
670cca76e0941d56b05f21fc,670cca73e0941d56b05ee5bc,670cca73e0941d56b05ee819,Defetiscor voluptates tam stipes villa ultra uterque. Soluta confido deserunt succurro valde. Antepono ipsum vero utrum.,2024-10-14T00:43:49.067Z,0
670cca76e0941d56b05f21fd,670cca73e0941d56b05ee5ac,670cca73e0941d56b05ee8f4,Surgo strenuus pecco carmen tollo. Cuius vindico turba minima tristis socius ager. Cura tutamen usque occaecati alienus atque villa sol voluptatem contra.,2024-10-13T14:33:56.872Z,0
670cca76e0941d56b05f21fe,670cca73e0941d56b05ee329,670cca73e0941d56b05ee789,Tredecim tricesimus tergum vobis speculum tener atqui. Claudeo perspiciatis civitas repudiandae comes venustas. Porro ex totidem explicabo.,2024-10-13T18:40:43.573Z,0
670cca76e0941d56b05f21ff,670cca73e0941d56b05ee380,670cca73e0941d56b05ee701,Vicinus iusto ullus somniculosus antepono charisma tam veritas. Armarium socius error. Abeo xiphias voluntarius solus verto cresco voluptatum.,2024-10-13T23:14:50.348Z,0
670cca76e0941d56b05f2200,670cca73e0941d56b05ee281,670cca73e0941d56b05ee94a,Mollitia admoneo creo accommodo adulatio sunt capitulus. Contabesco volubilis subiungo voluptas patruus complectus terebro terminatio versus. Amet decipio voluptate desidero suscipit umbra cerno nam aestus.,2024-10-13T11:35:14.329Z,0
670cca76e0941d56b05f2201,670cca73e0941d56b05ee291,670cca73e0941d56b05ee8b8,Amo demergo vobis varietas ustulo aveho crapula tamquam bibo desino. Depulso acsi tui eos verus surculus occaecati enim deputo. Contra quibusdam commodi inventore thorax congregatio toties trado vindico.,2024-10-14T01:32:40.076Z,0
670cca76e0941d56b05f2202,670cca73e0941d56b05ee470,670cca73e0941d56b05ee7e3,Bibo iusto talus absque cursus templum admoneo adsuesco vomer. Calculus taceo tricesimus commodo atavus adhuc. Arceo considero ventosus tamquam.,2024-10-13T19:33:09.593Z,0
670cca76e0941d56b05f2203,670cca73e0941d56b05ee627,670cca73e0941d56b05eea2e,Cunae attonbitus comburo tribuo sequi ipsum. Ager spargo volo timor quo verumtamen credo delego. Vulnus suffragium amet.,2024-10-13T22:12:00.975Z,0
670cca76e0941d56b05f2204,670cca73e0941d56b05ee436,670cca73e0941d56b05ee73b,Cedo socius claudeo templum cinis aliquam. Sono benevolentia minus. Termes color vigor barba crur basium cimentarius aequitas.,2024-10-13T21:19:36.851Z,0
670cca76e0941d56b05f2205,670cca73e0941d56b05ee280,670cca73e0941d56b05ee834,Super conqueror conturbo cito. Quo solvo terga careo curiositas aeternus arcesso optio itaque truculenter. Vilitas creo universe claustrum crastinus deprecator.,2024-10-13T08:02:01.950Z,0
670cca76e0941d56b05f2206,670cca73e0941d56b05ee3fa,670cca73e0941d56b05ee7f9,Condico textus chirographum molestias vacuus. Absque desino ustulo crustulum cetera itaque. Condico abundans vestrum cognomen consuasor acidus bos.,2024-10-13T17:14:18.770Z,0
670cca76e0941d56b05f2207,670cca73e0941d56b05ee647,670cca73e0941d56b05ee8ae,Conturbo aveho tergiversatio demitto aqua amissio nihil circumvenio subseco veniam. Amoveo complectus vir depulso cometes bellicus. Coepi aptus aetas cunabula attollo abutor abstergo ceno.,2024-10-13T17:53:15.742Z,0
670cca76e0941d56b05f2208,670cca73e0941d56b05ee542,670cca73e0941d56b05ee7ca,Clamo bardus solitudo tamquam. Thesaurus accendo soluta adicio vae canis eius arbor censura vester. Suggero cauda texo suppono voluntarius attero assentator vix constans molestiae.,2024-10-13T09:01:55.254Z,0
670cca76e0941d56b05f2209,670cca73e0941d56b05ee421,670cca73e0941d56b05ee80e,Sperno voluptatem cur asper conscendo adfero tam studio capio. Subito incidunt substantia terminatio. Aggero coma commodi advenio comitatus tolero considero cimentarius.,2024-10-14T03:22:48.316Z,0
670cca76e0941d56b05f220a,670cca73e0941d56b05ee533,670cca73e0941d56b05ee9cb,Spargo inflammatio valeo amissio concedo provident minima solium. Carbo aequus adopto cattus agnitio vulgo amplus. Autus cubicularis tollo admoveo thema bos aeternus.,2024-10-14T05:28:08.267Z,0
670cca76e0941d56b05f220b,670cca73e0941d56b05ee301,670cca73e0941d56b05eea40,Tenus texo tunc amoveo quo at. Advoco velociter tribuo aspernatur deleniti curatio. Suasoria ambitus delinquo testimonium conforto crinis.,2024-10-13T16:52:43.857Z,0
670cca76e0941d56b05f220c,670cca73e0941d56b05ee641,670cca73e0941d56b05ee86e,Saepe perspiciatis confido vulgivagus acerbitas tepesco deprecator subito alias. Ullus soluta studio agnosco vehemens denuncio culpa conicio. Vigor terga certe curvo ater.,2024-10-13T17:29:57.556Z,0
670cca76e0941d56b05f220d,670cca73e0941d56b05ee4a8,670cca73e0941d56b05ee949,Antea tremo stipes appono animadverto versus casso ver thorax. Terebro adfero corrupti alii. Argumentum atavus amplitudo certe aspernatur caries vitae virga.,2024-10-14T02:01:54.879Z,0
670cca76e0941d56b05f220e,670cca73e0941d56b05ee2ed,670cca73e0941d56b05ee8d2,Sequi tristis voluptatibus adiuvo usque teneo consuasor. Arbitro decerno synagoga deprecator. Minus sum clementia perferendis officiis.,2024-10-14T02:38:50.858Z,0
670cca76e0941d56b05f220f,670cca73e0941d56b05ee3fb,670cca73e0941d56b05ee992,Cibus coniecto at dolores defessus statua molestias similique. Beatus utroque conor avarus cimentarius dolor autem. Denique decretum utor sonitus tam asper animadverto delicate.,2024-10-13T15:11:04.428Z,0
670cca76e0941d56b05f2210,670cca73e0941d56b05ee475,670cca73e0941d56b05ee6f2,Videlicet deduco vinum eaque. Titulus carcer tam. Terreo aspicio uredo fuga aliquid subseco apud agnosco thesaurus astrum.,2024-10-13T16:58:47.470Z,0
670cca76e0941d56b05f2211,670cca73e0941d56b05ee48c,670cca73e0941d56b05eea37,Cohors civitas urbanus tametsi benevolentia adeo vitium. Celebrer spero demitto ab. Villa aestivus spectaculum cognatus.,2024-10-13T22:41:33.255Z,0
670cca76e0941d56b05f2212,670cca73e0941d56b05ee350,670cca73e0941d56b05ee822,Varius thorax nemo arca. Tum accedo tener curis ratione tunc. Verumtamen corrigo commemoro tabella thema iste audentia voluptas tenetur autem.,2024-10-13T21:26:55.595Z,0
670cca76e0941d56b05f2213,670cca73e0941d56b05ee31c,670cca73e0941d56b05ee7db,Possimus utpote quia corrigo assentator. Tempora cinis contabesco velit angelus arbitro. Abbas aperte comparo ulterius alius tibi vilis aperte.,2024-10-13T09:07:10.311Z,0
670cca76e0941d56b05f2214,670cca73e0941d56b05ee3f6,670cca73e0941d56b05ee811,Ullus ver spoliatio. Vero attonbitus esse substantia speculum aurum absque libero aveho vestigium. Advoco certus bonus.,2024-10-13T22:15:46.968Z,0
670cca76e0941d56b05f2215,670cca73e0941d56b05ee5d2,670cca73e0941d56b05ee806,Calculus comis torrens vergo. Cras vicinus depulso perspiciatis totus. Arcesso vorago accusator coruscus aequitas blanditiis.,2024-10-14T03:40:24.984Z,0
670cca76e0941d56b05f2216,670cca73e0941d56b05ee5a5,670cca73e0941d56b05ee761,Surculus denique laudantium attollo suspendo nemo beatus verto undique. Adfero vulpes attonbitus utrum absorbeo. Conturbo rerum derelinquo bonus confugo ratione.,2024-10-13T15:30:02.929Z,0
670cca76e0941d56b05f2217,670cca73e0941d56b05ee4e7,670cca73e0941d56b05ee975,Suffoco pax demum decumbo. Vapulus tempora neque soleo ambitus contigo. Tertius triduana amitto fugit.,2024-10-13T21:34:22.298Z,0
670cca76e0941d56b05f2218,670cca73e0941d56b05ee35d,670cca73e0941d56b05ee67c,Abutor voluptatibus deripio tamdiu quidem ultio vulpes capitulus cervus. Volup trans accusamus vobis. Comes ara antiquus.,2024-10-13T20:03:57.529Z,0
670cca76e0941d56b05f2219,670cca73e0941d56b05ee322,670cca73e0941d56b05ee862,Taceo tyrannus admiratio appello. Accusamus celebrer torrens sum solum universe adfero. Ambulo verecundia armarium currus eius usitas sapiente creator.,2024-10-13T15:26:18.486Z,0
670cca76e0941d56b05f221a,670cca73e0941d56b05ee640,670cca73e0941d56b05ee719,Consequatur adipisci civis apud perferendis. Convoco vetus cupiditate arca xiphias. Torrens suppellex vociferor decumbo desolo trepide conculco acsi comburo copia.,2024-10-13T19:51:25.472Z,0
670cca76e0941d56b05f221b,670cca73e0941d56b05ee2bb,670cca73e0941d56b05ee901,Summisse magni iusto voro cupressus trado strenuus tolero accusamus rerum. Accommodo magni debitis ante unus inflammatio confero sui cribro. Reiciendis aeternus vereor adiuvo.,2024-10-14T07:09:31.622Z,0
670cca76e0941d56b05f221c,670cca73e0941d56b05ee4e7,670cca73e0941d56b05ee795,Turpis arceo cohaero temptatio asporto. Tenuis supellex spiritus despecto. Articulus undique bestia tenus crur a vitium adimpleo aspicio.,2024-10-13T16:40:55.649Z,0
670cca76e0941d56b05f221d,670cca73e0941d56b05ee5ba,670cca73e0941d56b05ee78b,Talus caelestis vehemens averto corroboro tripudio candidus cupiditate conspergo tandem. Curiositas comprehendo venia error aurum curis peccatus conqueror claudeo tunc. Truculenter asper aestus thalassinus villa tepesco recusandae quam tantillus.,2024-10-14T00:29:53.538Z,0
670cca76e0941d56b05f221e,670cca73e0941d56b05ee3c6,670cca73e0941d56b05ee696,Vinitor sufficio currus uxor odio amitto tristis defluo crux. Synagoga ventosus ullus deludo. Apparatus clarus debitis agnitio terra.,2024-10-14T01:34:12.296Z,0
670cca76e0941d56b05f221f,670cca73e0941d56b05ee2d6,670cca73e0941d56b05ee876,Beatus civitas curia combibo arceo. Spoliatio voro velociter nostrum abduco. Atavus creptio suggero subnecto vilitas cimentarius arguo arx vallum depereo.,2024-10-13T13:03:53.244Z,0
670cca76e0941d56b05f2220,670cca73e0941d56b05ee544,670cca73e0941d56b05ee91f,Decor adinventitias stillicidium. Tracto civis verus usus calco comptus rerum adulescens dolor tumultus. Vinitor suffragium theca vetus delego velut.,2024-10-13T21:57:34.099Z,0
670cca76e0941d56b05f2221,670cca73e0941d56b05ee568,670cca73e0941d56b05ee974,Sit ara vorax clamo. Assumenda valde modi deinde vulticulus communis crux vesica umbra. Coruscus admitto calculus avarus comprehendo stabilis cunctatio totus excepturi.,2024-10-14T06:18:04.077Z,0
670cca76e0941d56b05f2222,670cca73e0941d56b05ee474,670cca73e0941d56b05ee75b,Territo conitor deprecator praesentium. Coniuratio uterque vulgo pauci turba ullus. Arx nihil trans libero aliquam commemoro vindico.,2024-10-13T10:33:59.119Z,0
670cca76e0941d56b05f2223,670cca73e0941d56b05ee5af,670cca73e0941d56b05ee71f,Aegrus avaritia sopor spes theologus attollo. Depereo iusto aestivus subiungo sursum labore cuius thorax. Apostolus atque suspendo vobis.,2024-10-14T04:05:11.637Z,0
670cca76e0941d56b05f2224,670cca73e0941d56b05ee41a,670cca73e0941d56b05ee7dc,Triduana vinitor copiose pecco sordeo complectus coepi circumvenio conduco stips. Absens theca curto abeo defaeco conforto taceo nesciunt. Ver quaerat undique talio voluptas ager coepi quibusdam desino conspergo.,2024-10-14T07:28:08.816Z,0
670cca76e0941d56b05f2225,670cca73e0941d56b05ee4b6,670cca73e0941d56b05ee83c,Torrens comitatus undique aer degero cuius. Vulnero velum aggredior tunc addo vestrum vado theatrum. Animi tribuo atavus antiquus subito vado averto amplexus.,2024-10-13T16:56:43.176Z,0
670cca76e0941d56b05f2226,670cca73e0941d56b05ee59e,670cca73e0941d56b05ee916,Atque animadverto quos. Quasi accusantium tremo adaugeo tantillus patria victus. Vilis demoror umerus aqua stips paulatim considero coerceo tempora.,2024-10-13T19:25:24.540Z,0
670cca76e0941d56b05f2227,670cca73e0941d56b05ee5ee,670cca73e0941d56b05ee98b,Causa atque vita derelinquo ascit audeo distinctio supra. Tempora sordeo dolorem. Ante thema dicta ceno vulnero patria.,2024-10-14T05:02:27.257Z,0
670cca76e0941d56b05f2228,670cca73e0941d56b05ee5c1,670cca73e0941d56b05ee90f,Amissio cotidie conqueror. Aduro acies vereor voluptatibus ascit carpo ancilla carmen tracto. Ulterius adulatio volubilis vigor aeneus denique.,2024-10-13T20:31:28.254Z,0
670cca76e0941d56b05f2229,670cca73e0941d56b05ee41a,670cca73e0941d56b05ee860,Veniam usque arcus animus voluntarius abundans confido vinculum valeo. Cogito reiciendis animi comparo capto subiungo pax tepesco. Totidem cornu thesaurus maiores ad.,2024-10-13T08:05:50.057Z,0
670cca76e0941d56b05f222a,670cca73e0941d56b05ee403,670cca73e0941d56b05ee994,Ulciscor ago bibo ascit denuncio id audio. Vito tergo custodia voro adhaero. Synagoga vomito arto sum.,2024-10-14T07:32:38.408Z,0
670cca76e0941d56b05f222b,670cca73e0941d56b05ee522,670cca73e0941d56b05ee95e,Supplanto termes curo alter ars spiculum subito caelestis taceo. Sono votum cursim tolero. Velit arbitro degusto iusto adsuesco umquam pauper deprecator tenax.,2024-10-13T14:57:24.628Z,0
670cca76e0941d56b05f222c,670cca73e0941d56b05ee629,670cca73e0941d56b05ee86b,Caritas stipes tristis capio hic tum varius varietas. Tempus arto cognomen unde delectus demum cervus decimus vulgivagus agnitio. Nulla comburo molestias adfectus claudeo deporto.,2024-10-13T08:13:03.347Z,0
670cca76e0941d56b05f222d,670cca73e0941d56b05ee2fb,670cca73e0941d56b05ee693,Tripudio expedita verus ocer dolorum artificiose cultellus alii tabella venustas. Desidero antepono casus. Sequi id quasi ago conturbo universe alii.,2024-10-13T13:27:58.900Z,0
