_id,userId,learningMaterialId,content,createdAt,__v
670cca76e0941d56b05f2294,670cca73e0941d56b05ee54a,670cca73e0941d56b05ee8c9,Vobis deduco temperantia aliquam vicissitudo contigo collum tempore mollitia adversus. Vulpes teres antea voluntarius demum despecto iste exercitationem vita vigor. Vulgo super autus subnecto administratio cornu atrocitas certe.,2024-10-14T06:09:50.095Z,0
670cca76e0941d56b05f2295,670cca73e0941d56b05ee2aa,670cca73e0941d56b05ee8c2,Porro tergum correptius tum. Amita ut certe voluptas asper suggero nulla debeo. Succurro vesica volo demo quasi voro eaque audax.,2024-10-13T18:38:20.228Z,0
670cca76e0941d56b05f2296,670cca73e0941d56b05ee32c,670cca73e0941d56b05ee7c1,Derideo tredecim aetas pauper sequi terga amplitudo denuncio terra. Viscus ulciscor cotidie delectatio dolorem. Ante claro arcus fuga terga tricesimus.,2024-10-13T17:12:25.334Z,0
670cca76e0941d56b05f2297,670cca73e0941d56b05ee4d9,670cca73e0941d56b05ee765,Traho casus cursim apparatus villa. Ciminatio conqueror appono denego peccatus amoveo adversus vehemens. Laboriosam demens antepono vulgaris volubilis centum toties adsidue bis conforto.,2024-10-14T04:00:22.186Z,0
670cca76e0941d56b05f2298,670cca73e0941d56b05ee498,670cca73e0941d56b05ee6fd,Depromo coniuratio assumenda cupio placeat. Coniuratio ars pax surculus degusto denuncio sit contabesco. Iusto voluptas acquiro coaegresco terra amissio tener ipsum.,2024-10-13T22:09:51.390Z,0
670cca76e0941d56b05f2299,670cca73e0941d56b05ee4ba,670cca73e0941d56b05eea01,Speculum provident deduco earum vereor verumtamen aperiam. Minus velociter pectus illo adhaero ducimus. Collum aro modi strenuus valeo.,2024-10-14T03:08:29.292Z,0
670cca76e0941d56b05f229a,670cca73e0941d56b05ee433,670cca73e0941d56b05ee8f4,Condico suspendo subseco spes dens conturbo voluptate. Teneo accedo votum curatio atrocitas. Cilicium minima benigne convoco angelus urbanus aliquam vestigium.,2024-10-13T20:29:10.656Z,0
670cca76e0941d56b05f229b,670cca73e0941d56b05ee367,670cca73e0941d56b05ee7fa,Tres creator defaeco viridis aspernatur tamdiu. Demo saepe varietas usque absconditus admoveo comedo. Vobis commodi teneo vociferor dicta.,2024-10-13T09:07:17.209Z,0
670cca76e0941d56b05f229c,670cca73e0941d56b05ee641,670cca73e0941d56b05ee929,Thermae curtus subvenio tremo. Sufficio advenio tollo vilitas nisi velociter trans corona nisi aperte. Temptatio cupio approbo angelus sufficio comburo trepide.,2024-10-14T05:36:11.146Z,0
670cca76e0941d56b05f229d,670cca73e0941d56b05ee307,670cca73e0941d56b05ee8a0,Vinculum terror vinum utpote. Calcar cruentus voluntarius solus spargo corrigo acies. Admoveo tabula explicabo approbo sint.,2024-10-13T12:02:04.550Z,0
670cca76e0941d56b05f229e,670cca73e0941d56b05ee575,670cca73e0941d56b05ee83c,Defluo succurro vergo decor corrumpo eum arbustum peior. Vestrum uterque voro absens. Clementia sordeo vorago termes.,2024-10-14T07:15:27.907Z,0
670cca76e0941d56b05f229f,670cca73e0941d56b05ee487,670cca73e0941d56b05eea21,Supplanto molestiae unde allatus abbas xiphias. Umerus apud dolore sophismata caput causa dedecor vulgo a tunc. Rerum quos supellex vindico veritas distinctio tergiversatio.,2024-10-13T11:49:07.682Z,0
670cca76e0941d56b05f22a0,670cca73e0941d56b05ee65d,670cca73e0941d56b05ee951,Vulnus trans toties coniecto adfectus suppellex copiose. Vulgo patruus cubo ad terga adulatio talio. Quasi vae soluta thorax repudiandae.,2024-10-13T22:45:17.012Z,0
670cca76e0941d56b05f22a1,670cca73e0941d56b05ee5f6,670cca73e0941d56b05ee738,Arcus sui amiculum ullam admitto bellum theologus adfectus. Tracto delectus nulla arcus demens dolorem complectus beatus. Omnis balbus voluptas antepono.,2024-10-13T23:05:14.178Z,0
670cca76e0941d56b05f22a2,670cca73e0941d56b05ee4e5,670cca73e0941d56b05ee7fc,Eius volva communis. Viduo quasi blandior vae varietas. Paulatim voluptatibus thesis.,2024-10-13T13:28:06.637Z,0
670cca76e0941d56b05f22a3,670cca73e0941d56b05ee4f2,670cca73e0941d56b05ee7a3,Contego aestas rem corona valens. Maxime subnecto tempore tolero careo. Corrupti una absconditus curto.,2024-10-13T19:48:59.874Z,0
670cca76e0941d56b05f22a4,670cca73e0941d56b05ee39d,670cca73e0941d56b05ee9c3,Clarus suscipit sodalitas taedium animus deludo. Templum beneficium subvenio temptatio clarus ullam curiositas vel termes. Alius commodo socius convoco sol tot tametsi neque vulgivagus abduco.,2024-10-13T17:33:24.432Z,0
670cca76e0941d56b05f22a5,670cca73e0941d56b05ee530,670cca73e0941d56b05ee976,Aiunt paulatim apostolus tendo cicuta uberrime caelestis stultus terra annus. Corrupti cubo vilitas absum veritas trepide comptus tenax. Volutabrum torrens adopto asper voluptas eos argumentum torrens.,2024-10-13T16:14:51.992Z,0
670cca76e0941d56b05f22a6,670cca73e0941d56b05ee333,670cca73e0941d56b05ee688,Corroboro labore suadeo statua antiquus audeo possimus statua tribuo cinis. Cohibeo tristis tactus articulus suus. Adhaero terga argentum amet collum corroboro demo varietas voluptatibus.,2024-10-13T21:14:07.536Z,0
670cca76e0941d56b05f22a7,670cca73e0941d56b05ee44e,670cca73e0941d56b05ee6d5,Voluptate cattus atque hic delectus adhuc distinctio. Universe ceno deporto antepono attero. Solum colo infit.,2024-10-13T10:21:10.454Z,0
670cca76e0941d56b05f22a8,670cca73e0941d56b05ee54f,670cca73e0941d56b05ee879,Ubi bibo attero traho crinis cum civitas vir spectaculum. Amiculum totidem capto cotidie. Temporibus conicio carmen creta abeo creptio cerno audentia altus.,2024-10-14T03:50:58.826Z,0
670cca76e0941d56b05f22a9,670cca73e0941d56b05ee511,670cca73e0941d56b05ee997,Quis a auxilium vacuus solus. Suasoria supra praesentium temperantia sumptus veniam suus. Terreo vitae virtus denuncio aureus textus cupiditas.,2024-10-13T20:58:15.090Z,0
670cca76e0941d56b05f22aa,670cca73e0941d56b05ee353,670cca73e0941d56b05ee69e,Delibero vapulus aestivus sollicito stella demoror cedo. Deputo balbus succurro ulterius solium. Accusator demonstro volutabrum attero.,2024-10-14T03:25:47.958Z,0
670cca76e0941d56b05f22ab,670cca73e0941d56b05ee367,670cca73e0941d56b05ee78d,Tero vallum celebrer denuncio casso tui sto acies. Carpo pel sit tersus aspicio sulum sui attero correptius amita. Mollitia suscipit congregatio absum vix alias.,2024-10-13T16:51:06.255Z,0
670cca76e0941d56b05f22ac,670cca73e0941d56b05ee5f9,670cca73e0941d56b05ee7ba,Calcar ubi quia ad aperiam umquam uter voluptatem communis. Deludo possimus odio aro incidunt conicio subito. Nesciunt abutor tempore spes.,2024-10-13T17:27:39.449Z,0
670cca76e0941d56b05f22ad,670cca73e0941d56b05ee387,670cca73e0941d56b05eea27,Versus sol conventus corrupti demonstro comptus abbas maxime. Coruscus apostolus canonicus defaeco angustus beatus vado bibo. Celo peior repellendus baiulus allatus cupiditate.,2024-10-14T06:25:39.312Z,0
670cca76e0941d56b05f22ae,670cca73e0941d56b05ee4c9,670cca73e0941d56b05ee87a,Coruscus surgo volva approbo constans cado amplus colligo excepturi decimus. Cito crepusculum textilis autus magni derelinquo appello varietas atqui. Illo custodia acceptus textus.,2024-10-13T19:10:05.041Z,0
670cca76e0941d56b05f22af,670cca73e0941d56b05ee5a8,670cca73e0941d56b05ee84a,Utroque cum temptatio. Tunc accusantium acidus synagoga urbs. Sequi tumultus consequatur carmen solvo.,2024-10-13T10:37:47.494Z,0
670cca76e0941d56b05f22b0,670cca73e0941d56b05ee3ac,670cca73e0941d56b05ee6bf,Nesciunt vomito altus adulescens. Votum umquam repellendus repudiandae curatio fugit tardus umerus. Cunabula coniuratio cubitum.,2024-10-13T17:22:49.416Z,0
670cca76e0941d56b05f22b1,670cca73e0941d56b05ee2b4,670cca73e0941d56b05ee970,Demo utroque thermae. Quidem venio hic. Acies ipsum adstringo cras conitor caute terminatio allatus confugo.,2024-10-13T23:42:07.871Z,0
670cca76e0941d56b05f22b2,670cca73e0941d56b05ee4b8,670cca73e0941d56b05ee7bf,Artificiose adhaero ambitus uter rem derideo aestas vere depopulo esse. Sursum amita non virgo ambitus carus. Bos arbustum laudantium contigo repudiandae.,2024-10-13T10:20:03.905Z,0
670cca76e0941d56b05f22b3,670cca73e0941d56b05ee295,670cca73e0941d56b05ee87e,Cohaero rerum perspiciatis arcus. Suscipit creo xiphias sunt dolore. Temperantia verus officia.,2024-10-13T11:33:56.077Z,0
670cca76e0941d56b05f22b4,670cca73e0941d56b05ee4d8,670cca73e0941d56b05ee993,Vereor cavus acceptus aspernatur subito pariatur supra demoror dolorum quidem. Verbera correptius ter. Bis totus in.,2024-10-13T21:29:56.822Z,0
670cca76e0941d56b05f22b5,670cca73e0941d56b05ee56b,670cca73e0941d56b05ee822,Deputo vallum sophismata caelestis crapula laudantium. Contego constans repudiandae quis dolorum tergo coniecto delectus. Comburo angustus cupressus nemo velut.,2024-10-13T22:23:07.950Z,0
670cca76e0941d56b05f22b6,670cca73e0941d56b05ee28d,670cca73e0941d56b05ee6a7,Caelum vesper adnuo cogo cedo denego solvo decens. Nobis turpis aurum corrumpo volo repellendus tot virgo. Arbustum votum dolore volo una capto video vallum comis careo.,2024-10-13T14:25:57.434Z,0
670cca76e0941d56b05f22b7,670cca73e0941d56b05ee29d,670cca73e0941d56b05eea1d,Clarus decipio substantia thema cribro uberrime atqui. Vesper decipio totam ante repudiandae cumque thesaurus adopto. Cometes avaritia cauda quidem spes pauci.,2024-10-13T16:15:47.067Z,0
670cca76e0941d56b05f22b8,670cca73e0941d56b05ee589,670cca73e0941d56b05ee7c0,Teneo ocer tibi angustus crinis. Contabesco coerceo civis peior vinitor. Tum degenero impedit aequitas aufero.,2024-10-13T19:36:21.995Z,0
670cca76e0941d56b05f22b9,670cca73e0941d56b05ee45e,670cca73e0941d56b05ee78f,Adversus sed terra texo mollitia. Adsum occaecati spes amitto decipio amoveo. Traho corroboro cubitum numquam deduco labore labore.,2024-10-13T22:20:07.822Z,0
670cca76e0941d56b05f22ba,670cca73e0941d56b05ee307,670cca73e0941d56b05ee894,Adeptio assentator demo aqua tredecim. Alo deludo facere umquam. Currus somnus adipiscor degusto.,2024-10-13T09:35:24.448Z,0
670cca76e0941d56b05f22bb,670cca73e0941d56b05ee470,670cca73e0941d56b05eea10,Contabesco saepe ex tersus eos statua bis perspiciatis. Assentator vox creator absorbeo caries delicate illum approbo cupressus stella. Tricesimus torqueo coruscus.,2024-10-13T11:31:56.486Z,0
670cca76e0941d56b05f22bc,670cca73e0941d56b05ee5ea,670cca73e0941d56b05ee88a,Venustas assentator texo bos strues sonitus ulciscor contabesco tamen thymum. Traho titulus neque. Alveus armarium tepesco.,2024-10-14T06:01:19.269Z,0
670cca76e0941d56b05f22bd,670cca73e0941d56b05ee5f1,670cca73e0941d56b05ee952,Demum cunctatio derelinquo assentator. Mollitia civitas aro repudiandae expedita. Conculco ipsum comitatus est esse.,2024-10-14T01:56:36.396Z,0
670cca76e0941d56b05f22be,670cca73e0941d56b05ee2da,670cca73e0941d56b05ee9c3,Tristis stultus corpus. Acies curso cunae viduo. Surgo tenuis tego cubo crur textor quidem.,2024-10-13T21:22:51.575Z,0
670cca76e0941d56b05f22bf,670cca73e0941d56b05ee404,670cca73e0941d56b05ee9d5,Defero earum thesaurus demum doloribus ademptio calculus casso curis cernuus. Virtus sonitus eaque appono damno triduana adicio aliquam torrens. Valens stultus debitis ipsam.,2024-10-14T03:46:32.679Z,0
670cca76e0941d56b05f22c0,670cca73e0941d56b05ee2cf,670cca73e0941d56b05ee74f,Altus autus strues compello tamisium textor terminatio animadverto. Amaritudo thesaurus spiculum uterque. Subvenio aeneus sordeo angustus vallum tum dolores adfectus.,2024-10-13T17:31:22.948Z,0
670cca76e0941d56b05f22c1,670cca73e0941d56b05ee5fb,670cca73e0941d56b05ee9cd,Verbera abduco ipsa candidus. Balbus voco deputo fugiat. Taedium deleniti ventus crapula veritas valens tepesco adicio.,2024-10-13T15:46:34.560Z,0
670cca76e0941d56b05f22c2,670cca73e0941d56b05ee2cd,670cca73e0941d56b05eea21,Volup magnam volutabrum. Suppono tam chirographum assentator succurro assumenda tabula. Patrocinor asper nobis coaegresco caritas vallum deprimo degusto.,2024-10-13T11:41:17.561Z,0
670cca76e0941d56b05f22c3,670cca73e0941d56b05ee612,670cca73e0941d56b05eea13,Vitae sono deputo velum tunc aeternus tenuis varietas. Adopto trepide aperio anser. Conforto amoveo stillicidium nam quia patria est sto amo.,2024-10-13T14:59:33.730Z,0
670cca76e0941d56b05f22c4,670cca73e0941d56b05ee3e3,670cca73e0941d56b05ee905,Cotidie dolores rem cunae optio totidem universe. Civitas patior celer ventus cribro. Vulnus voro contego aduro demoror.,2024-10-14T01:09:00.259Z,0
670cca76e0941d56b05f22c5,670cca73e0941d56b05ee436,670cca73e0941d56b05ee7c1,Sollicito statua tertius. Vacuus contigo ab adamo viduo conculco a strenuus claro statua. Officiis deporto traho ars adfectus.,2024-10-13T18:04:27.299Z,0
670cca76e0941d56b05f22c6,670cca73e0941d56b05ee48b,670cca73e0941d56b05ee710,Odit depono varius arma. Cicuta nostrum degero balbus. Caries libero auxilium basium speculum colo peccatus.,2024-10-14T04:17:16.963Z,0
670cca76e0941d56b05f22c7,670cca73e0941d56b05ee43e,670cca73e0941d56b05ee715,Tristis usitas utrum voluptates crastinus aufero caries adulatio nam chirographum. Cogo amplexus ambulo cubo consequuntur deleniti cauda. Claustrum vaco aeger carus audio annus.,2024-10-14T05:23:32.981Z,0
670cca76e0941d56b05f22c8,670cca73e0941d56b05ee334,670cca73e0941d56b05ee85f,Vindico dolorum capillus adeo vulgus pecto aspicio celo. Templum amor adopto cruciamentum cupressus usitas bos decens. Acerbitas sed acer vigor aetas decimus.,2024-10-14T00:40:24.134Z,0
670cca76e0941d56b05f22c9,670cca73e0941d56b05ee626,670cca73e0941d56b05ee7f9,Ratione causa curiositas tersus cenaculum summisse brevis depulso tendo tonsor. Sperno amo cresco vesco thema cuius spoliatio totam agnosco cattus. Eveniet esse contra dolore coaegresco.,2024-10-14T00:01:06.434Z,0
670cca76e0941d56b05f22ca,670cca73e0941d56b05ee43c,670cca73e0941d56b05ee818,Vitium earum consequuntur tego. Tribuo decipio subseco. Aestas denuo agnitio venio.,2024-10-13T16:26:27.423Z,0
670cca76e0941d56b05f22cb,670cca73e0941d56b05ee3df,670cca73e0941d56b05ee867,Auctus creo cultellus corrumpo. Cursus adsidue cilicium cubo sordeo doloribus cuppedia clarus terga. Somnus voluptatibus adsuesco victus timidus derelinquo tubineus pecto apto cinis.,2024-10-13T13:00:10.107Z,0
670cca76e0941d56b05f22cc,670cca73e0941d56b05ee5c9,670cca73e0941d56b05ee9f6,Communis blandior degero absum claustrum tenetur colo conturbo. Decor turbo peior assentator. Debitis aperio ceno vere virtus advoco verbera sub.,2024-10-13T20:26:15.393Z,0
670cca76e0941d56b05f22cd,670cca73e0941d56b05ee5bd,670cca73e0941d56b05eea37,Approbo aperiam summopere. Desparatus vilis tego. Venio vereor minima summa accusamus optio coruscus.,2024-10-14T00:36:59.803Z,0
670cca76e0941d56b05f22ce,670cca73e0941d56b05ee4c0,670cca73e0941d56b05ee672,Arca barba sordeo tutis demitto tergo constans cinis audentia defleo. Coadunatio illum venia aranea quaerat odio verto vobis vespillo tamisium. Apud vos crinis.,2024-10-13T20:15:08.212Z,0
670cca76e0941d56b05f22cf,670cca73e0941d56b05ee455,670cca73e0941d56b05ee856,Tamdiu tam stabilis adfero ipsam acer conor nesciunt accusator. Exercitationem minus cohors sonitus. Peccatus eveniet facilis cedo explicabo.,2024-10-14T01:12:03.514Z,0
670cca76e0941d56b05f22d0,670cca73e0941d56b05ee647,670cca73e0941d56b05ee66a,Auctus decens quis. Atavus terreo valetudo. Advenio condico paulatim cometes verbum labore.,2024-10-13T23:14:35.772Z,0
670cca76e0941d56b05f22d1,670cca73e0941d56b05ee4ed,670cca73e0941d56b05eea36,Tondeo catena comedo allatus accommodo. Vulpes mollitia vulgus. Vomito caste tondeo suffoco caelum voluptates circumvenio vivo.,2024-10-13T11:45:42.549Z,0
670cca76e0941d56b05f22d2,670cca73e0941d56b05ee4f8,670cca73e0941d56b05ee6d9,Coma tempus terebro cuppedia doloribus. Adfectus veritas veritas adduco capio tantum. Contigo cado atavus contigo suspendo vitae reprehenderit.,2024-10-14T00:32:20.851Z,0
670cca76e0941d56b05f22d3,670cca73e0941d56b05ee3bd,670cca73e0941d56b05ee6d2,Adsuesco cursus vulgivagus patria sollers ratione. Vesco vinum tamdiu attollo. Fugiat verbum sopor volva creator architecto.,2024-10-13T21:34:35.713Z,0
670cca76e0941d56b05f22d4,670cca73e0941d56b05ee3ba,670cca73e0941d56b05ee88a,Culpa virgo cernuus. Denuo quidem vita pauper video eaque ago strenuus vesica. Trepide a summopere uter.,2024-10-13T18:28:54.156Z,0
670cca76e0941d56b05f22d5,670cca73e0941d56b05ee65d,670cca73e0941d56b05ee811,Textilis ademptio terebro sequi attero adnuo antea cervus perspiciatis. Temporibus voluptas tristis id. Sordeo cras curatio copia vulpes adopto.,2024-10-13T11:37:46.547Z,0
670cca76e0941d56b05f22d6,670cca73e0941d56b05ee48f,670cca73e0941d56b05ee66e,Cibus hic curatio sui admoneo tredecim magnam testimonium suppellex. Deripio carmen caelestis decet. Cinis deinde decimus quia.,2024-10-13T15:01:38.829Z,0
670cca76e0941d56b05f22d7,670cca73e0941d56b05ee35c,670cca73e0941d56b05ee955,Thema cribro curia cognomen utrum voro ceno cohaero. Cursim conqueror curtus correptius cupio verus apud. Vobis tametsi similique vilis.,2024-10-13T22:21:25.969Z,0
670cca76e0941d56b05f22d8,670cca73e0941d56b05ee566,670cca73e0941d56b05ee9f8,Tenus aiunt suggero fugiat. Aliquid tam recusandae barba. Degusto socius crepusculum.,2024-10-13T11:23:28.864Z,0
670cca76e0941d56b05f22d9,670cca73e0941d56b05ee307,670cca73e0941d56b05ee87b,Atqui callide suspendo libero. Tutis coniuratio argumentum ullus magni facilis supplanto curto cariosus nulla. Tot error tubineus.,2024-10-13T20:13:54.337Z,0
670cca76e0941d56b05f22da,670cca73e0941d56b05ee347,670cca73e0941d56b05ee77d,Nostrum alias adfero contigo. Artificiose attero territo cubitum. Ubi atqui audax impedit thesis cogito.,2024-10-14T02:59:29.974Z,0
670cca76e0941d56b05f22db,670cca73e0941d56b05ee415,670cca73e0941d56b05ee8af,Templum vesica degenero. Cilicium decor calco tersus dedico comptus subnecto. Volva vix vitiosus.,2024-10-14T07:32:32.360Z,0
670cca76e0941d56b05f22dc,670cca73e0941d56b05ee55a,670cca73e0941d56b05ee957,Spiculum catena tabula super teneo. Verto urbanus magni suus veniam aranea. Vetus sopor acsi desidero creptio demulceo ipsam volubilis consequatur.,2024-10-14T03:00:01.101Z,0
670cca76e0941d56b05f22dd,670cca73e0941d56b05ee31c,670cca73e0941d56b05ee898,Conforto tracto minus certe antea comparo supellex demoror voluptatem corrigo. Concedo claro accedo commemoro tabernus solitudo vae terminatio admiratio thalassinus. Magni tego turbo cognatus.,2024-10-13T18:32:47.243Z,0
670cca76e0941d56b05f22de,670cca73e0941d56b05ee5a9,670cca73e0941d56b05ee692,Collum aut arx aspernatur thema animadverto sui tepidus. Confugo clamo bellum. Ex vobis verus vehemens cibus auditor vomer turba.,2024-10-13T08:06:58.639Z,0
670cca76e0941d56b05f22df,670cca73e0941d56b05ee33a,670cca73e0941d56b05ee9a6,Id terebro angulus pariatur circumvenio titulus verus vito deprimo alii. Substantia colo balbus non aestas aeternus. Temptatio accommodo fugit appositus.,2024-10-13T21:53:18.424Z,0
670cca76e0941d56b05f22e0,670cca73e0941d56b05ee60f,670cca73e0941d56b05ee93c,Tondeo deleo bene ciminatio abeo impedit curvo. Aegrus theologus ter. Bene vetus timidus commemoro cernuus clam aegrotatio arceo.,2024-10-14T01:42:55.865Z,0
670cca76e0941d56b05f22e1,670cca73e0941d56b05ee379,670cca73e0941d56b05ee67a,Vorax tenax surculus coepi artificiose decor. Talio cibo tergiversatio corrupti abeo. Adhuc venio umerus victus demum annus ullam optio.,2024-10-14T07:25:38.907Z,0
670cca76e0941d56b05f22e2,670cca73e0941d56b05ee3b6,670cca73e0941d56b05ee745,Truculenter ante velut vestrum conculco dolore curia blandior. Via vivo tubineus. Surgo sortitus vergo aurum stillicidium perferendis patria.,2024-10-13T22:53:42.935Z,0
670cca76e0941d56b05f22e3,670cca73e0941d56b05ee40b,670cca73e0941d56b05ee87a,Sopor adnuo surculus verto cuppedia celebrer cultellus alias. Labore thorax verus cetera cena cumque tamisium sumptus. Bos acsi caelum aspernatur vigor depono tergo quod.,2024-10-13T11:12:08.197Z,0
670cca76e0941d56b05f22e4,670cca73e0941d56b05ee2f5,670cca73e0941d56b05ee9b8,Amita capto vigilo. Autus arbitro vado casus aut inflammatio aetas. Traho vergo adinventitias nemo tui tolero sint ab addo.,2024-10-14T06:55:12.235Z,0
670cca76e0941d56b05f22e5,670cca73e0941d56b05ee610,670cca73e0941d56b05ee95f,Bos ullam sollicito texo vomer pax templum contego deprimo carbo. Copiose dignissimos crapula unde cuppedia. Triumphus corona sumo.,2024-10-13T14:06:13.746Z,0
670cca76e0941d56b05f22e6,670cca73e0941d56b05ee48c,670cca73e0941d56b05ee7ad,Catena crur commodi tyrannus statim quam calcar. Vallum clarus depereo antea dapifer amo. Enim quaerat decretum.,2024-10-14T07:06:57.727Z,0
670cca76e0941d56b05f22e7,670cca73e0941d56b05ee652,670cca73e0941d56b05ee9d9,Absconditus sulum ars. Abbas amissio atrocitas termes censura ultio ara stillicidium. Pariatur aspicio caste tergeo decerno delectus sponte truculenter.,2024-10-13T17:27:34.989Z,0
670cca76e0941d56b05f22e8,670cca73e0941d56b05ee618,670cca73e0941d56b05ee8f9,Cauda itaque caute. Adiuvo strenuus caelum certe succurro supra vita. Adhaero deripio valens canonicus adiuvo.,2024-10-13T16:34:41.458Z,0
670cca76e0941d56b05f22e9,670cca73e0941d56b05ee649,670cca73e0941d56b05ee940,Adhuc versus conduco cupressus ratione vos solus quia volubilis ullam. Commodo communis timidus defendo deinde velum amita accusamus curso. Tamen corrumpo victus cumque carcer.,2024-10-13T08:24:14.815Z,0
670cca76e0941d56b05f22ea,670cca73e0941d56b05ee487,670cca73e0941d56b05ee77b,Fuga contego appono reprehenderit. Tempus aedificium vindico exercitationem peccatus. Cicuta careo adstringo amiculum thesis illo suffragium aer.,2024-10-13T13:20:49.714Z,0
670cca76e0941d56b05f22eb,670cca73e0941d56b05ee38f,670cca73e0941d56b05ee95e,Beneficium appello caecus expedita quasi molestias. Adaugeo aggredior verus. Stips blandior adflicto decet cursim verto tepidus tabesco thorax.,2024-10-14T07:17:59.757Z,0
670cca76e0941d56b05f22ec,670cca73e0941d56b05ee299,670cca73e0941d56b05ee94d,Urbanus magni timidus virgo. Accusamus vespillo tabula summopere decerno degusto claustrum annus temporibus volva. Sapiente solvo super.,2024-10-14T03:17:29.714Z,0
670cca76e0941d56b05f22ed,670cca73e0941d56b05ee359,670cca73e0941d56b05ee944,Sequi aggero vilitas. Modi amiculum delectatio itaque addo tenuis agnitio quo esse ciminatio. Carbo colo aqua clarus arca congregatio.,2024-10-13T21:12:40.388Z,0
670cca76e0941d56b05f22ee,670cca73e0941d56b05ee3cc,670cca73e0941d56b05ee746,Triumphus vulnus vae. Commodo culpo eaque tantillus pecco labore demo demens una tandem. Tamquam dolor appono defetiscor.,2024-10-13T19:20:08.376Z,0
670cca76e0941d56b05f22ef,670cca73e0941d56b05ee299,670cca73e0941d56b05eea38,Voluptatem una cohors nobis necessitatibus spectaculum cometes. Dapifer bene omnis vulticulus taceo adipisci. Cum amo contego cibus.,2024-10-13T13:17:54.394Z,0
670cca76e0941d56b05f22f0,670cca73e0941d56b05ee502,670cca73e0941d56b05eea40,Caecus officia eos. Aspicio ascit arceo tenax alveus amor clibanus. Autus vobis atrox.,2024-10-13T19:13:35.139Z,0
670cca76e0941d56b05f22f1,670cca73e0941d56b05ee4ca,670cca73e0941d56b05ee909,Spargo distinctio arbor dolor vir. Soluta vetus atrox esse bellum capto arbitro officiis. Paens mollitia conscendo absorbeo calcar ambulo arx adstringo cena calamitas.,2024-10-13T10:56:57.629Z,0
670cca76e0941d56b05f22f2,670cca73e0941d56b05ee61c,670cca73e0941d56b05ee6be,Tui conitor pecus curia sit cognatus. Cultura nobis arbustum vulgaris accommodo beatae. Asper pecto statua totidem commemoro.,2024-10-13T09:59:52.640Z,0
670cca76e0941d56b05f22f3,670cca73e0941d56b05ee303,670cca73e0941d56b05ee682,Arbor crepusculum cedo vulgaris vox statua. Creo nostrum carmen dedico sursum decet defluo peior harum. Id eum distinctio absconditus doloribus cognomen coniecto demonstro quos calamitas.,2024-10-14T01:45:02.012Z,0
670cca76e0941d56b05f22f4,670cca73e0941d56b05ee5dc,670cca73e0941d56b05ee748,Sub varius spectaculum. Thymum defleo vomica blanditiis labore varietas capto. Provident cibus cenaculum voluntarius corrumpo capillus.,2024-10-13T17:47:12.591Z,0
670cca76e0941d56b05f22f5,670cca73e0941d56b05ee41e,670cca73e0941d56b05ee9be,Caritas tam cui ducimus cruentus caste vomica vigor. Quae spargo quas carmen cubitum utpote crebro. Cum clarus tabella decumbo videlicet suspendo adhuc occaecati titulus.,2024-10-14T05:38:34.962Z,0
670cca76e0941d56b05f22f6,670cca73e0941d56b05ee4cc,670cca73e0941d56b05ee767,Tui aperte comedo assentator cornu. Celer minima antea blandior. Ut tenus at debitis voluptates sapiente vilis.,2024-10-13T11:42:35.882Z,0
670cca76e0941d56b05f22f7,670cca73e0941d56b05ee639,670cca73e0941d56b05ee7a4,Cauda hic vestrum amplitudo votum tum. Thema coaegresco vulariter audio caveo patrocinor velit chirographum virtus summopere. Conforto debeo tamquam coadunatio annus succedo.,2024-10-14T03:09:41.799Z,0
670cca76e0941d56b05f22f8,670cca73e0941d56b05ee51c,670cca73e0941d56b05ee931,Arma corrumpo reprehenderit degero circumvenio accedo spargo vos. Ante curia ultra animus exercitationem tunc termes amita deporto cursus. Vestigium coepi vetus derelinquo vulgaris degero aestivus aegrus inventore architecto.,2024-10-13T19:56:28.196Z,0
670cca76e0941d56b05f22f9,670cca73e0941d56b05ee51a,670cca73e0941d56b05ee689,Inventore tenetur canonicus utroque deduco tempus voluptatibus ea molestiae. Creator cur laudantium nulla quas delectatio ultio spiritus ver. Aperiam aqua suus substantia.,2024-10-14T06:24:41.386Z,0
670cca76e0941d56b05f22fa,670cca73e0941d56b05ee3c8,670cca73e0941d56b05ee6cc,Adulescens cognomen ventito fugiat mollitia assumenda terebro conservo tergeo. Creptio valde dolor barba tres. Cometes comedo tumultus nulla unus.,2024-10-13T20:38:49.927Z,0
670cca76e0941d56b05f22fb,670cca73e0941d56b05ee355,670cca73e0941d56b05ee703,Alveus claro creta acceptus. Incidunt sonitus facilis utique sponte fuga tergo conduco adhuc antiquus. Adficio stips valens triduana talio cur.,2024-10-13T12:41:49.243Z,0
670cca76e0941d56b05f22fc,670cca73e0941d56b05ee52d,670cca73e0941d56b05ee722,Vinum quia sustineo ter sto curso curtus creo crur. Aperio vicissitudo repudiandae decimus abscido. Curatio aqua hic derideo vesco sunt.,2024-10-13T11:06:35.794Z,0
670cca76e0941d56b05f22fd,670cca73e0941d56b05ee2a6,670cca73e0941d56b05ee926,Claro spes abeo iste armarium sordeo taceo. Coniecto aro cruciamentum subito cupressus adfectus. Bellicus alo ut dignissimos.,2024-10-13T11:27:49.505Z,0
