moduleId,title,description,learningMaterialId,moduleKey
670cca73e0941d56b05eed13,Tantillus verbum neque cultellus tumultus cohibeo ara.,Theca avarus quia odit depopulo cognomen. Tenuis turba pel trans compello armarium territo. Tenuis dolorem decipio.,670cca73e0941d56b05ee844,717
670cca73e0941d56b05eed14,Non quia repudiandae patior sollicito pecus conitor.,Cursus cursim attollo vobis. Tutis thalassinus soleo viduo nemo campana delectatio pax delinquo tum. Coadunatio tondeo usus.,670cca73e0941d56b05ee6b3,718
670cca73e0941d56b05eed15,Viduo turpis creber supplanto vigilo aeneus demitto credo.,Reiciendis universe cogito dedico antepono urbs verto quae. Aspernatur cometes theologus cribro tibi. Celer vergo clarus eaque theca desipio dolorum caput pariatur bene.,670cca73e0941d56b05ee7f1,719
670cca73e0941d56b05eed16,In ad spiritus utrimque absconditus tubineus.,Uxor dicta totam quos. Stillicidium caelum amita. Demoror tricesimus viscus conor non strenuus tempus.,670cca73e0941d56b05ee7f1,720
670cca73e0941d56b05eed17,Quae sunt qui supplanto certe vapulus bos voluptatum.,Vitium sordeo vestigium admoneo templum ustilo canis sursum. Tres talus summopere deinde conculco adeo amoveo dolores tergum ullam. Comis crastinus alioqui.,670cca73e0941d56b05ee90d,721
670cca73e0941d56b05eed18,Thermae acer summisse.,Rem verbera curriculum. Pauper animadverto demulceo. Abundans compono traho bellum barba.,670cca73e0941d56b05ee86b,722
670cca73e0941d56b05eed19,Iusto ullus curo ver corroboro vulpes super vulgus.,Solio illum coma articulus arma. Arca appono ago impedit aegrotatio vallum abutor. Crudelis dolores crastinus arx damnatio autus compono.,670cca73e0941d56b05ee7b0,723
670cca73e0941d56b05eed1a,Cometes usque voveo sol.,Alveus caterva amor vulticulus thesis alter conculco audax. Repellendus aranea eius. Utrimque benigne vox tenetur tempus suppellex crepusculum tenus odit.,670cca73e0941d56b05ee6df,724
670cca73e0941d56b05eed1b,Exercitationem sono patruus concido tenuis arca suadeo.,Amicitia acsi curso defungo auctus adversus. Adulatio cedo aestivus aspernatur tener denique. Placeat voro bibo.,670cca73e0941d56b05ee745,725
670cca73e0941d56b05eed1c,Cogo absum suus curto comptus sum venustas.,Ipsa decretum ustulo alo desparatus animus. Teneo pecco defungo contabesco sit vito adamo. Tersus corporis volubilis vulgo soluta.,670cca73e0941d56b05ee94d,726
670cca73e0941d56b05eed1d,Auctus allatus tabula aveho canonicus.,Stultus derelinquo tamen tenuis minus abundans corroboro. Trans thymbra civitas caute suscipio candidus torqueo certus umerus. Veritas tres deserunt combibo coadunatio.,670cca73e0941d56b05ee9bd,727
670cca73e0941d56b05eed1e,Tamdiu casso ventus.,Turba vitium viriliter peccatus. Repudiandae umerus blanditiis demulceo repellat uberrime nemo delectatio. Colligo asporto vaco veritatis rerum vitae alioqui aurum.,670cca73e0941d56b05ee725,728
670cca73e0941d56b05eed1f,Ustilo substantia stipes convoco.,Casus suspendo ago defetiscor tener. Tabgo teres uter supellex cupressus maiores conscendo viridis. Tergeo paens sopor catena ocer sunt aspicio uxor asper voro.,670cca73e0941d56b05eea31,729
670cca73e0941d56b05eed20,Crebro in vulgivagus vilis advenio.,Color expedita alienus sponte voluptatum cur cupiditate. Est tamquam delectatio comburo sit cunae. Thermae supellex terebro tantum vero.,670cca73e0941d56b05ee916,730
670cca73e0941d56b05eed21,Bellicus peior artificiose.,Campana verecundia arbustum dolorum sed vesica strenuus agnitio decretum. Strues sursum candidus abstergo aspernatur depraedor. Suasoria accusantium cavus caute condico celo pectus vulariter cerno.,670cca73e0941d56b05ee927,731
670cca73e0941d56b05eed22,Patrocinor acies tendo depromo trepide laboriosam alveus.,Caute atque deripio. Stipes calcar solvo aestivus canonicus accommodo. Temptatio autus terebro.,670cca73e0941d56b05ee7a0,732
670cca73e0941d56b05eed23,Itaque caelum defero claudeo averto acerbitas taceo assentator deduco.,Mollitia arto molestias coniecto. Undique adeo inflammatio concedo. Demonstro claudeo sunt bene.,670cca73e0941d56b05ee9b3,733
670cca73e0941d56b05eed24,Damno deludo solvo incidunt accedo corrupti creber bene.,Unde assentator aperte aduro vita quasi cruentus similique currus textilis. Culpa sollers stipes tremo thesaurus. Alter adversus desparatus abutor.,670cca73e0941d56b05ee9bf,734
670cca73e0941d56b05eed25,Tubineus iste contego et caterva vinum valeo.,Sapiente teres crebro aliquid celer tutis ullus. Suppellex desino crudelis tracto. Comis temporibus id deorsum sub.,670cca73e0941d56b05ee6d0,735
670cca73e0941d56b05eed26,Attollo patruus adulatio.,Exercitationem consuasor dedecor currus vir delibero conforto necessitatibus. Ut veritas terebro paens verumtamen paulatim tempora. Ultra cohaero toties aeger cupiditas caute crepusculum absum caterva tricesimus.,670cca73e0941d56b05ee851,736
670cca73e0941d56b05eed27,Cunabula urbanus valens magnam illo.,Vulticulus urbs comedo adfectus similique surgo aegre. Ceno armarium tempore usque speciosus adipiscor subnecto. Tripudio abeo vereor templum vesco acerbitas cumque averto vinum.,670cca73e0941d56b05ee7d1,737
670cca73e0941d56b05eed28,Cariosus quo cuius autem beatus eum clamo.,Cinis caste tantum. Solum cattus aperiam absconditus venio. Necessitatibus tergeo coniecto a trans varietas viriliter amplitudo succedo expedita.,670cca73e0941d56b05ee6c7,738
670cca73e0941d56b05eed29,Virgo tres amplexus esse aro placeat et culpa calculus.,Stipes comitatus bellicus defendo summa culpo iusto. Careo testimonium communis carmen cogo. Cogito optio advoco non iure uredo adeo adiuvo tubineus.,670cca73e0941d56b05ee74b,739
670cca73e0941d56b05eed2a,Explicabo creator curriculum.,Curriculum quisquam curia soleo quis ambulo. Undique coepi nulla studio trado demoror. Ducimus minima degenero villa tot vilicus calcar adamo adsidue.,670cca73e0941d56b05ee83a,740
670cca73e0941d56b05eed2b,Odit acerbitas suus cohibeo coadunatio pel uter celebrer cruentus.,Tolero neque atavus tamquam tamquam pecco comburo ocer. Adipiscor deleo commemoro deprecator certus amitto eius eveniet vestigium tubineus. Tenax vestrum ciminatio socius attero despecto peccatus bellicus.,670cca73e0941d56b05ee7d8,741
670cca73e0941d56b05eed2c,Quidem depulso autem abutor voco vobis approbo.,Eos dolores solus succedo cariosus decretum timidus vulticulus desino. Totidem valetudo concedo ciminatio caput ver aequitas artificiose sit voluptatem. Audentia denego arx quasi consuasor comis clamo subiungo volo.,670cca73e0941d56b05ee7c4,742
670cca73e0941d56b05eed2d,Terreo temperantia tum synagoga.,Termes repellat cunabula asporto. Sophismata sequi neque culpa terga tamisium. Debilito ater vir quibusdam toties.,670cca73e0941d56b05ee9ef,743
670cca73e0941d56b05eed2e,Textus summisse callide vulpes caterva aranea expedita.,Coadunatio aegrus sono. Audio celer defaeco sol molestias. Vita capio inventore deleniti aduro dolorum curatio terror corporis super.,670cca73e0941d56b05ee85a,744
670cca73e0941d56b05eed2f,Textor vilitas conduco nemo universe derideo sto maiores aggero.,Carpo comparo sponte demonstro valeo conservo peior tenetur vehemens alveus. Contabesco tot summisse atqui aestas adipiscor dignissimos dicta subvenio. Causa curso adversus custodia tremo defessus tepidus corrigo cogo.,670cca73e0941d56b05ee76c,745
670cca73e0941d56b05eed30,Demens summisse apto communis creber usitas magni deripio cum.,Degusto sol ascisco sequi denuncio umquam talus contigo. Ocer abeo pectus damno tristis. Spectaculum antepono verbum doloremque delectatio quidem ut pax cado.,670cca73e0941d56b05ee8c4,746
670cca73e0941d56b05eed31,Adinventitias vix cernuus.,Tantillus modi delinquo baiulus. Confugo corporis canonicus depulso taceo curtus saepe. Adsidue territo civitas tempora.,670cca73e0941d56b05eea09,747
670cca73e0941d56b05eed32,Decimus consectetur congregatio curis acer.,Censura et adulatio balbus apto solio ago aeternus. Stillicidium celo tunc carpo atqui. Odit territo somniculosus.,670cca73e0941d56b05ee744,748
670cca73e0941d56b05eed33,Argumentum statim tener utrimque.,Sint basium suspendo speculum talio. Timidus amitto cui comminor vindico. Voluptas odit utique vado arcesso solio.,670cca73e0941d56b05ee921,749
670cca73e0941d56b05eed34,Socius balbus nihil uterque assentator quod bestia.,Voro tepidus tribuo. Causa tener dedecor via auxilium. Carmen versus cogito defluo cribro volutabrum dignissimos bellicus consuasor advoco.,670cca73e0941d56b05ee6c1,750
670cca73e0941d56b05eed35,Commodi deprecator vetus suscipio acsi subito alioqui trucido cubo desino.,Compello varius terror cogo vitium calculus. Acerbitas dapifer tenuis at illum. Comburo testimonium cultura sophismata spiritus.,670cca73e0941d56b05ee83b,751
670cca73e0941d56b05eed36,Vestigium aduro dicta terror versus ager cito.,Tyrannus demens deleo nam. Vado desolo labore valde conitor caries usitas. Utrum labore copiose.,670cca73e0941d56b05ee7df,752
670cca73e0941d56b05eed37,Auctor solus colligo clamo tantillus.,Xiphias aeger asperiores iste utilis ambulo pax dolorem tergo. Dignissimos acceptus ustulo casso bellum. Corona viscus tergo.,670cca73e0941d56b05ee9c8,753
670cca73e0941d56b05eed38,Nisi ager ad crebro crepusculum adsuesco substantia derelinquo.,Iure colligo pariatur combibo curso. Caterva tego iusto tabgo concido. Iste bonus cibus vesica conor succedo voveo concedo succurro.,670cca73e0941d56b05ee9d8,754
670cca73e0941d56b05eed39,Acceptus aqua patrocinor vado pariatur maiores derideo a.,Aequus inflammatio aeger vilitas autus vergo cometes. Adeptio voluptate iure vir. Capto veritatis vinum maiores villa suspendo.,670cca73e0941d56b05ee839,755
670cca73e0941d56b05eed3a,Vilis pecto adduco textor admiratio triduana cresco unus aptus.,Volutabrum deserunt dolores calculus. Vulgo quod somnus cui cuppedia currus deinde deficio constans concedo. Comes ventosus sui ad qui defaeco deleniti ullam sed.,670cca73e0941d56b05ee97e,756
670cca73e0941d56b05eed3b,Cavus ea peccatus sint optio vespillo quis claro abeo.,Cilicium apud ullus tredecim. Beatae territo velut avaritia ter eveniet apto sonitus. Vulgo degenero tui.,670cca73e0941d56b05ee96a,757
670cca73e0941d56b05eed3c,Carpo quaerat quibusdam carus addo velum adhaero acquiro.,Verumtamen vado caecus sonitus clamo. Venio charisma conscendo totam conor artificiose solium verbera. Anser dolorem alo.,670cca73e0941d56b05ee95d,758
670cca73e0941d56b05eed3d,Adimpleo nemo eligendi tremo vilicus tero amita tepesco cauda voro.,Cervus conqueror atrocitas vaco ait vetus. Caveo deduco dicta demergo solium sophismata consequatur barba officiis. Tutamen accendo clarus cuius cohibeo vereor arma quaerat vilitas.,670cca73e0941d56b05ee6c3,759
670cca73e0941d56b05eed3e,Nobis sperno civitas.,Vinum venio pel maiores assumenda vapulus sum cohaero sumo civis. Doloribus tandem aggredior. Verecundia vox sapiente tredecim tempore clamo.,670cca73e0941d56b05ee9e7,760
670cca73e0941d56b05eed3f,Adopto caveo ars vulgo subvenio.,Bestia pel sopor vilis hic culpa debeo aduro cognatus vicinus. Conscendo debilito surgo anser. Ulciscor alienus laborum conqueror aequitas admoneo pecco vulnero caritas tener.,670cca73e0941d56b05ee973,761
670cca73e0941d56b05eed40,Patior tyrannus assentator neque talus calamitas.,Varius comptus temptatio sursum coniuratio ventosus. Vesica claustrum vitae suscipit ea vetus ulterius caelestis. Viriliter victus cum curriculum quidem deludo cibus tabesco denique repellendus.,670cca73e0941d56b05ee96a,762
670cca73e0941d56b05eed41,Vita celer succurro denique.,Ante confugo adsidue. Voluptatibus arcesso comptus subseco adhuc optio capto. Eius damnatio ver.,670cca73e0941d56b05ee841,763
670cca73e0941d56b05eed42,Aegrotatio excepturi colligo.,Talus vita denique peccatus cupiditas. Agnosco optio subvenio pauci. Quia adipiscor concedo vulticulus summisse culpo.,670cca73e0941d56b05ee810,764
670cca73e0941d56b05eed43,Adsum vilicus aeternus sonitus totidem.,Sunt terra ventito truculenter patrocinor amiculum arceo. Fuga maiores vespillo quidem amicitia tripudio pel truculenter. Candidus supra id cavus debeo voluptatum vitae.,670cca73e0941d56b05ee927,765
670cca73e0941d56b05eed44,Alii deinde paulatim vis appono spiritus vesica cubicularis amplitudo.,Theologus beatae optio bis baiulus alius. Tergeo terror arbitro magni spiculum celebrer. Suggero aptus verbera candidus vicissitudo.,670cca73e0941d56b05ee8c8,766
670cca73e0941d56b05eed45,Vos triduana depulso explicabo cibo tot.,Voco varietas odit. Denuncio caveo nam valetudo acervus solvo alioqui. Curis pecto tepidus cogo arbor corpus volva.,670cca73e0941d56b05ee690,767
670cca73e0941d56b05eed46,Uxor solio complectus aranea circumvenio adflicto complectus texo torrens suffoco.,Ea deputo uter. Bestia autus illum non patrocinor alveus aestivus. Sortitus peior valde.,670cca73e0941d56b05ee74d,768
670cca73e0941d56b05eed47,Ancilla ventus vulgo benigne bellicus.,Vinum bellicus ullus alveus. Rem decor apparatus. Cupiditas atrocitas sonitus.,670cca73e0941d56b05ee6ff,769
670cca73e0941d56b05eed48,Adeo vulgo adfectus cometes auctus eum.,Capitulus tertius bardus suscipio compono summisse depulso. Stillicidium vita turbo deserunt caries amet aggredior depromo temeritas. Victus sufficio harum.,670cca73e0941d56b05ee968,770
670cca73e0941d56b05eed49,Delectatio creta repellendus vox rerum vorago voro cupiditas minus comparo.,Sub arbor voluptatum cultellus accendo decipio damno convoco. Cumque decumbo cohibeo trucido civitas tantillus amoveo suggero aptus ventosus. Eius somniculosus corpus terga.,670cca73e0941d56b05ee864,771
670cca73e0941d56b05eed4a,Aveho rerum veritatis animus correptius.,Chirographum bellum civitas calamitas centum. Spoliatio cribro apto officia sursum somniculosus tener ventosus quaerat voluptatem. Adeptio voluntarius cena desidero sunt adversus bellum tenetur.,670cca73e0941d56b05ee977,772
670cca73e0941d56b05eed4b,Ultio nostrum succurro occaecati voluntarius conor coepi circumvenio tam usque.,Nisi totidem culpa socius tego debitis theologus carus consequuntur. Adsum necessitatibus carus. Eum solium decor damno cognomen dolorem depromo tendo anser.,670cca73e0941d56b05ee82a,773
670cca73e0941d56b05eed4c,Antepono vir clamo uberrime bardus.,Creber defungo ustulo avaritia adulatio. Approbo impedit iste capio desolo magnam ambitus officiis cicuta. Degenero demergo arbor quasi cubitum advenio absque umbra.,670cca73e0941d56b05ee6a4,774
670cca73e0941d56b05eed4d,Fugit sunt ullus accusamus.,Commodi ducimus suscipio accusantium vapulus. Caste soleo auditor claustrum patruus aperio creptio atque. Tenus vilitas minus corrumpo conduco suffoco termes.,670cca73e0941d56b05ee9a8,775
670cca73e0941d56b05eed4e,Depono cicuta aro amplexus.,Deorsum thymum charisma voveo eveniet. Ante conscendo videlicet amoveo. Tergiversatio vulgus tabesco victus stips impedit vinculum abeo.,670cca73e0941d56b05ee9a3,776
670cca73e0941d56b05eed4f,Carbo paulatim attero nemo contra inflammatio itaque caecus.,Alienus colo comburo unde sursum fugit. Spoliatio auxilium harum casso absque viscus incidunt adamo. Urbs aspernatur voveo solitudo cariosus defetiscor.,670cca73e0941d56b05ee842,777
670cca73e0941d56b05eed50,Ager argentum solvo correptius angustus.,Taedium suffragium inventore error. Curis cupio acer civitas. Adflicto hic deduco.,670cca73e0941d56b05ee6f6,778
670cca73e0941d56b05eed51,Viridis voluptas usus cedo.,Libero artificiose cruentus. Velum amoveo comitatus thermae conculco comes. Nobis agnitio magnam acies vulnero volutabrum infit pauci aetas minus.,670cca73e0941d56b05ee9a7,779
670cca73e0941d56b05eed52,Delectus vito eum.,Theca depopulo ventus autem. Adhaero magni ad aetas. Coepi amicitia totus spiculum solium recusandae ipsum corroboro crur talus.,670cca73e0941d56b05ee9f1,780
670cca73e0941d56b05eed53,Summopere confugo speculum comminor quasi civis circumvenio caterva carbo.,Et vigilo deprimo. Traho adipiscor vicissitudo suus ter suppono agnitio perspiciatis abutor. Patria accusantium inflammatio recusandae repudiandae supplanto comminor capitulus aggero.,670cca73e0941d56b05ee664,781
670cca73e0941d56b05eed54,Sum defluo vinco.,Triduana coruscus maxime nulla umbra vorax ter thesaurus vulgus. Bardus odit aer utroque optio caste thema fugit adfero. Claustrum cresco tempore tardus cuppedia debeo cras ascit aperiam.,670cca73e0941d56b05ee8e5,782
670cca73e0941d56b05eed55,Dedico armarium vomer inventore depraedor aetas sulum cubicularis torqueo.,Vetus cariosus appositus claro curriculum iusto vaco. Somniculosus utrimque aedificium campana vulgo utilis. Aranea tamen vesco surculus alioqui super.,670cca73e0941d56b05ee958,783
670cca73e0941d56b05eed56,Coruscus acer antea assumenda thesaurus paulatim cedo suppellex.,Umbra cui repellat vetus minus varietas tamisium. Cresco vitiosus artificiose capitulus congregatio caput porro. Doloremque vacuus vado creo temperantia communis aliquid.,670cca73e0941d56b05ee8d3,784
670cca73e0941d56b05eed57,Supra alius agnitio vehemens in texo cetera.,Adsuesco adfectus trans adhaero acies vir tergiversatio sponte canto adimpleo. Incidunt vorago coaegresco consequatur tenuis veritas. Conitor iure deporto suffragium praesentium utpote degero contigo.,670cca73e0941d56b05ee835,785
670cca73e0941d56b05eed58,Vobis auctus quas.,Curriculum tempora cupiditate tantum ante annus civis usque vicissitudo. Contra atavus desidero vilitas degenero acerbitas. Validus dedico sub uberrime tonsor ipsum torqueo crudelis tergeo.,670cca73e0941d56b05eea32,786
670cca73e0941d56b05eed59,Adfero suscipit angulus cubicularis volva adinventitias.,Vester torrens animi ventus. Cimentarius decumbo tredecim vel vicinus provident. Amicitia quod eum corrupti antea creator labore tripudio villa pel.,670cca73e0941d56b05ee8be,787
670cca73e0941d56b05eed5a,Abscido concedo curtus sortitus.,Sponte stabilis carpo aegrotatio celo defaeco suus vox. Aer demo aeger cattus tener. Carus vado corrigo una.,670cca73e0941d56b05ee7bd,788
670cca73e0941d56b05eed5b,Natus somnus cariosus totus curtus cavus totidem.,Decumbo saepe campana contego bellum considero termes aveho. Pecto explicabo dolor. Corporis trans acsi amicitia terga adicio.,670cca73e0941d56b05ee8a1,789
670cca73e0941d56b05eed5c,Aeneus laudantium texo alveus volaticus consequatur comminor tametsi ver.,Tandem astrum verbum suspendo aeger ullam vetus verto peior. Articulus canis explicabo fugiat recusandae despecto umbra strenuus. Cunabula coniecto sumptus asper vergo alo.,670cca73e0941d56b05ee8fd,790
670cca73e0941d56b05eed5d,Adversus benigne sperno vinculum victus carpo compono.,Summisse error admoveo attollo attero dolorum aeternus. Capto vomer patruus vir strues. Thesis claustrum eligendi sollicito.,670cca73e0941d56b05ee7de,791
670cca73e0941d56b05eed5e,Dedico copia comptus defero.,Urbanus concedo copia volubilis ceno tremo maiores. Taceo convoco vir timor. Tenax comedo cupiditas uxor succedo audeo.,670cca73e0941d56b05ee92b,792
670cca73e0941d56b05eed5f,Accedo sumo varius arcesso vapulus chirographum.,Curo synagoga aedificium ciminatio temporibus ultio quasi inventore charisma comis. Tredecim bellicus iure tametsi reprehenderit contra averto tabgo. Chirographum vero absque corporis copia.,670cca73e0941d56b05ee814,793
670cca73e0941d56b05eed60,Ademptio velum conservo cibo depopulo virtus copia usitas centum averto.,Substantia absorbeo benigne. Officia delicate armarium. Curo validus quasi.,670cca73e0941d56b05ee7c6,794
670cca73e0941d56b05eed61,Terminatio corona ad canis vulgus soleo.,Sufficio sperno spiritus deorsum soleo custodia asporto conventus. Cumque curiositas allatus conduco usus tolero utique succurro decumbo trucido. Delinquo omnis thesis.,670cca73e0941d56b05ee6bf,795
670cca73e0941d56b05eed62,Impedit aeger abeo confugo thalassinus contra.,Varius umerus super deserunt. Atrox accommodo patrocinor verecundia. Adsuesco tempus canis consequuntur.,670cca73e0941d56b05eea38,796
670cca73e0941d56b05eed63,Deporto tristis carbo veritatis patior validus.,Vester vobis aranea ventosus tamquam capio victoria canonicus vinculum. Audentia illum thema cunabula tener utilis. Nulla basium harum acquiro angulus.,670cca73e0941d56b05ee6a1,797
670cca73e0941d56b05eed64,Atqui bos dolor natus vulnero adfero sui.,Solio delibero patrocinor deorsum corrupti cito speciosus tempus. Dedico depono debilito celer umquam currus. Colligo ullus quo adsuesco amicitia tertius catena apostolus approbo.,670cca73e0941d56b05ee7bb,798
670cca73e0941d56b05eed65,Complectus terebro totam terror.,Basium surculus veritatis subvenio. Defero venio cunae adduco statim. Cattus averto terga delego.,670cca73e0941d56b05ee9bf,799
670cca73e0941d56b05eed66,Alter claustrum damnatio vulariter asper cunctatio.,Adfero arguo sordeo itaque cauda aeternus abbas. Audentia vinco decor carcer ante caute voco universe. Bardus arcus adficio arca.,670cca73e0941d56b05ee7f8,800
670cca73e0941d56b05eed67,Delectus corrupti adstringo comburo vesper vester.,Acsi vulnero vitae caste defaeco. Eveniet cogo conduco crinis tripudio. Bis contigo denuo acerbitas.,670cca73e0941d56b05ee8ec,801
670cca73e0941d56b05eed68,Officiis valetudo circumvenio vir arca condico corpus.,Sit adimpleo catena. Laboriosam canonicus delectatio decimus deficio. Amplus tepidus demulceo turba harum considero aliquid cursus.,670cca73e0941d56b05ee913,802
670cca73e0941d56b05eed69,Sulum viridis ultio aranea error vereor.,Exercitationem viduo vereor tunc aliquam trans eum facilis pectus eos. Coaegresco provident curatio accedo temptatio spero crux attonbitus aspernatur. Venustas ciminatio arcus impedit acies iusto colligo.,670cca73e0941d56b05ee867,803
670cca73e0941d56b05eed6a,Deludo commodi cimentarius laborum trucido candidus casus collum coerceo aranea.,Amplexus vox vulgaris studio cerno succurro ademptio aequitas. Confugo suscipit vix conitor ducimus uberrime avaritia arguo casus. Vulgo sophismata suus cuius combibo paens aestus comis acsi.,670cca73e0941d56b05ee788,804
670cca73e0941d56b05eed6b,Maiores arcus congregatio attero.,Cavus beneficium amiculum talis bos dolores centum contego voluptatem corporis. Facilis thorax non tenetur cribro pecco consequatur. Sonitus aranea benevolentia creo quam.,670cca73e0941d56b05ee88d,805
670cca73e0941d56b05eed6c,Arbitro cito conicio colo iure vulgaris curso contego.,Animadverto decretum iusto sursum. Demergo pectus stultus traho conatus. Aurum tolero acidus conspergo calculus.,670cca73e0941d56b05ee8d1,806
670cca73e0941d56b05eed6d,Delibero ago totam cervus rerum aer caelestis amplexus.,Consectetur varius certe urbs caecus. Desipio cubitum audentia ultra tam demonstro thalassinus. Timor tempore corpus.,670cca73e0941d56b05ee7f8,807
670cca73e0941d56b05eed6e,Vomer curvo brevis.,Averto cattus eum coadunatio a cribro statim cauda temptatio. Auditor eaque assentator vinculum acies aequitas theologus eveniet quis. Voveo spes accedo.,670cca73e0941d56b05ee834,808
670cca73e0941d56b05eed6f,Coepi fugiat tabula balbus ullus statua auxilium acidus.,Sortitus textus claustrum. Aeneus vigor atqui. Aestas amissio cunae creator aer ex curso.,670cca73e0941d56b05ee7c5,809
670cca73e0941d56b05eed70,Tametsi speciosus defero tardus arcus.,Acceptus correptius quibusdam fuga paulatim tersus. Aestus apud confido derideo tempus compello soluta tum. Dens claustrum comminor esse et audio aspicio tenax.,670cca73e0941d56b05ee7e9,810
670cca73e0941d56b05eed71,Conitor magnam sodalitas crur thesaurus creptio curvo.,Arbitro subito carcer suscipit super canis. Ultio tamdiu turbo accedo consequatur chirographum virga ago coniuratio. Sint titulus cena substantia ulciscor.,670cca73e0941d56b05ee95b,811
670cca73e0941d56b05eed72,Voluntarius delibero fugit caste ager vigor veritatis fugiat.,Teneo somnus velit thalassinus earum explicabo comburo. Vos crur decipio curia desolo depulso tepesco aranea usque. Omnis totam odio.,670cca73e0941d56b05eea36,812
670cca73e0941d56b05eed73,Defero delego aer esse ad amicitia tibi.,Tenax verto vobis timidus caelum arcesso. Assentator corporis cogo armarium attero. Considero laudantium basium ait absum carcer.,670cca73e0941d56b05ee9b0,813
670cca73e0941d56b05eed74,Tyrannus careo auditor coniecto studio suspendo repellat brevis.,Asper volup quos alveus. Aetas tenax spero thymbra bardus catena conspergo apparatus incidunt accusamus. Dedecor voro venio tonsor tertius attonbitus ver nemo.,670cca73e0941d56b05ee7f7,814
670cca73e0941d56b05eed75,Victus demum comis cibus antiquus commodi caste addo.,Anser pauper utilis sustineo tametsi summopere consuasor colo demens. Via cubicularis cursim terra. Iure nulla depromo cornu combibo clamo cohibeo tametsi vindico.,670cca73e0941d56b05ee9ab,815
670cca73e0941d56b05eed76,Video thalassinus explicabo strenuus.,Trepide adaugeo cibus tandem. Celebrer desino tabella speciosus defetiscor solium. Urbs animus terreo strenuus ante condico.,670cca73e0941d56b05ee770,816
670cca73e0941d56b05eed77,Tui id decens.,Ut culpo vindico aveho abbas. Angulus usitas dens laudantium termes varius consequatur valde catena. Varius ducimus aegre.,670cca73e0941d56b05ee957,817
670cca73e0941d56b05eed78,Caelum comprehendo vix coepi delicate.,Amaritudo aurum asperiores studio talio necessitatibus tibi. Distinctio ex tero triduana claudeo cresco amoveo sollicito cognomen absens. Acquiro volaticus deprimo canonicus quos.,670cca73e0941d56b05ee9f8,818
670cca73e0941d56b05eed79,Apto vado comburo impedit celer animi.,Caritas degenero commemoro. Cotidie vobis cattus timor sit acies paulatim verecundia accendo. Contigo adimpleo curis campana dolore.,670cca73e0941d56b05ee6d3,819
670cca73e0941d56b05eed7a,Vorago facere creptio conqueror ambulo.,Cubo auditor supra utpote candidus neque comedo. Triduana cerno terreo talio carus contabesco vado. Alveus nesciunt totam copiose.,670cca73e0941d56b05ee78c,820
670cca73e0941d56b05eed7b,Undique omnis armarium stillicidium.,Ultio coadunatio custodia cubo sumptus sufficio. Deinde totam cavus valde alter amicitia alias confido. Cursus vulnus teres aedificium comminor patruus carus eum umquam repellat.,670cca73e0941d56b05ee762,821
