moduleId,title,description,learningMaterialId,moduleKey
670cca73e0941d56b05eeb13,Ducimus ter tripudio necessitatibus sumptus pecco tabula.,Surgo adflicto libero alius damnatio paens confero. Agnosco baiulus tolero ultra ultio canonicus vulgivagus sustineo. Sulum celo vigor creo amitto desino auctus ratione.,670cca73e0941d56b05ee91b,205
670cca73e0941d56b05eeb14,Synagoga error vobis adeptio quam aetas.,Ceno annus nemo. Hic placeat deleo beatus deprimo nemo sortitus comedo tutamen. Vehemens vesco atrocitas possimus cuius clamo vitiosus terreo assentator cunabula.,670cca73e0941d56b05ee69e,206
670cca73e0941d56b05eeb15,Cena pecto celebrer ultra spectaculum.,Demens brevis aspicio. Magnam auctor atque adsidue quod deorsum delectatio labore sodalitas. Vel nisi contego cotidie.,670cca73e0941d56b05ee8ee,207
670cca73e0941d56b05eeb16,Ancilla correptius cornu ultra.,Cenaculum decor audio consequatur aegrotatio spargo. Cubo socius admoneo talio officiis arcus sui acquiro vero. Carbo speciosus minima vox depereo.,670cca73e0941d56b05ee9b5,208
670cca73e0941d56b05eeb17,Derideo conitor pecus agnitio tum non vir terminatio.,Tolero sophismata decimus defetiscor explicabo conscendo altus magni. Velociter ipsam cultura cribro architecto. Libero spoliatio solutio attollo vulgo.,670cca73e0941d56b05ee935,209
670cca73e0941d56b05eeb18,Versus incidunt ulciscor argumentum eius.,Cunabula pel correptius verus aeger dens animi aurum. Calamitas caritas distinctio vester. Careo vomica vulgo accusantium ultio.,670cca73e0941d56b05ee7e3,210
670cca73e0941d56b05eeb19,Beneficium absum cui triumphus timidus aegrotatio.,Adnuo corona color tamisium textilis anser autus. Dolor tenetur tardus decretum alius. Bellicus theca demo trado vetus desino compello doloremque.,670cca73e0941d56b05ee8c6,211
670cca73e0941d56b05eeb1a,Corrigo tandem callide antea possimus tredecim fuga.,Explicabo amor agnitio concido quasi velut adficio. Deleniti molestiae ullus commodo aro deduco. Abutor trans tutamen.,670cca73e0941d56b05ee9dc,212
670cca73e0941d56b05eeb1b,Sono solium cruentus delicate cometes attero ago virga vespillo aestas.,Speculum carpo arx ducimus admoveo tubineus defaeco sapiente vilis. Amiculum tabella consuasor suscipit antepono sustineo adsidue temptatio demergo. Curatio aliquid ascit demitto vespillo dolor atque.,670cca73e0941d56b05ee8c0,213
670cca73e0941d56b05eeb1c,Alienus deripio credo claustrum surculus decretum clamo testimonium.,Viriliter advenio defungo conforto statim verecundia sui utrimque debitis velut. Vespillo aperte sufficio deprimo tumultus expedita. Absque cohibeo curvo degenero temeritas tonsor creber.,670cca73e0941d56b05ee9ad,214
670cca73e0941d56b05eeb1d,Considero deserunt aut desolo tardus audentia tenuis suus absens.,Xiphias stella desino deorsum. Canonicus distinctio triumphus aer calco nam creator. Cedo tametsi apostolus quidem.,670cca73e0941d56b05ee9b4,215
670cca73e0941d56b05eeb1e,Caveo totidem adnuo apparatus ab cibus desolo.,Confido mollitia accusamus. Incidunt thema distinctio subvenio tametsi mollitia delectus. Bis volva temeritas anser arca capto.,670cca73e0941d56b05ee708,216
670cca73e0941d56b05eeb1f,Comburo repudiandae depraedor sto argumentum tenax voluptas tonsor.,Vulpes turbo cognatus usque vallum ipsa. Depono depromo tamquam reprehenderit tot curto. Vero suffragium una comparo adstringo atavus sulum vestigium.,670cca73e0941d56b05ee6b5,217
670cca73e0941d56b05eeb20,Casus claro corona solitudo tot tener basium carus.,Vaco arbor absum decipio atqui harum thesaurus constans tenus impedit. Via custodia benigne ultra solium vicinus usque vorago. Arbor capio vesper compono iusto cunctatio volo.,670cca73e0941d56b05ee6d9,218
670cca73e0941d56b05eeb21,Quis spargo sopor angelus accendo tumultus verto aestas fugit delectus.,Umbra omnis speciosus. Maiores adstringo decet depereo cervus vix corporis benevolentia defessus antiquus. Sublime depraedor congregatio bestia.,670cca73e0941d56b05ee905,219
670cca73e0941d56b05eeb22,Bibo templum delectus calamitas bestia venia vereor beatus convoco in.,Adstringo uterque acies coepi tandem territo despecto dolore adstringo. Auxilium theatrum addo adficio summa bardus vesco tunc laborum voro. Tergum cohibeo cenaculum.,670cca73e0941d56b05ee7c5,220
670cca73e0941d56b05eeb23,Curatio calcar confugo accusantium solvo.,Arbitro thorax recusandae veniam acer suspendo. Aperiam aequitas delectatio. Astrum deficio adhuc.,670cca73e0941d56b05ee9e5,221
670cca73e0941d56b05eeb24,Stipes deludo expedita tersus.,Cognatus deludo ventosus ultio pectus et denuo stella tantum deripio. Concido valeo accusamus soleo varius vergo vorago surculus bos. Rem ager soleo carmen sonitus.,670cca73e0941d56b05ee7fe,222
670cca73e0941d56b05eeb25,Vaco ulciscor spiritus quisquam.,Clamo sol amicitia vapulus voro dignissimos assumenda cornu. Pax adsuesco bonus thymum cum arcus adaugeo deludo vorax tubineus. Spargo eaque pecto dolores vicinus venia.,670cca73e0941d56b05ee91f,223
670cca73e0941d56b05eeb26,Amoveo consectetur curriculum celo spectaculum tripudio architecto tempore inventore.,Defetiscor conqueror bonus tendo ulterius pectus. Virgo suscipio tredecim tres stella. Nisi caries antea recusandae deinde absens.,670cca73e0941d56b05ee80c,224
670cca73e0941d56b05eeb27,Officia vesco dolor talis.,Sulum tyrannus velit vae laborum thymum pariatur. Conor apostolus neque thema surgo vallum teneo charisma traho tabula. Caput pectus circumvenio.,670cca73e0941d56b05ee6ef,225
670cca73e0941d56b05eeb28,Theca caelum cunae hic.,Aduro pecco denique. Aeternus theatrum volubilis solium deprimo despecto appositus conventus dedecor. Audio somnus bestia.,670cca73e0941d56b05ee9c4,226
670cca73e0941d56b05eeb29,Taceo beneficium coruscus ipsum audio callide solutio.,Articulus crinis aiunt decipio ambitus error vapulus suscipit calco. Despecto delicate excepturi terra tristis solium cras. Quo accommodo similique deripio sui beatus sortitus.,670cca73e0941d56b05ee8dc,227
670cca73e0941d56b05eeb2a,Studio arguo artificiose venustas bis sumptus.,Solutio tergum ultra cibo vito dignissimos. Canonicus temperantia crepusculum sum trepide cerno aureus creator tripudio colligo. Conventus sufficio defessus vito chirographum constans supellex acidus porro.,670cca73e0941d56b05ee7b8,228
670cca73e0941d56b05eeb2b,Stillicidium vaco molestias quas eveniet suffragium.,Fugit crapula curvo crinis. Sodalitas ancilla nobis tres barba. Textilis quidem bellum vitium texo tero curis corrigo acies talus.,670cca73e0941d56b05ee77a,229
670cca73e0941d56b05eeb2c,Bis cariosus subnecto cunabula acceptus audeo angulus atrocitas.,Amicitia vulnus tabernus. Pauci considero suppellex vito adfectus. Excepturi corpus amiculum corroboro vinculum inflammatio ancilla vereor.,670cca73e0941d56b05ee898,230
670cca73e0941d56b05eeb2d,Decimus solvo vomito clementia circumvenio caelum arcesso.,Cunabula audacia clarus. Inventore spectaculum vulgaris altus timidus odit ventito curso colligo. Audacia color artificiose torqueo fugiat aperte utique.,670cca73e0941d56b05ee71e,231
670cca73e0941d56b05eeb2e,Corrigo maiores suggero doloribus demum credo.,Odio facilis stultus ventito vel speculum qui. Suggero adamo audio. Valde caput spes ventosus vallum.,670cca73e0941d56b05ee881,232
670cca73e0941d56b05eeb2f,Ocer creber suggero.,Adversus quaerat creator sustineo nihil cohors. Aptus tabesco terebro deludo spargo. Autus sursum cuius studio claustrum vita acer tempore.,670cca73e0941d56b05ee82a,233
670cca73e0941d56b05eeb30,Vos ver depono colligo.,Voro corpus decimus acidus cogito confero venustas vacuus. Fugiat conscendo tametsi cicuta soluta solum atrox trepide omnis. Volo tabgo statua versus tendo rerum.,670cca73e0941d56b05eea0e,234
670cca73e0941d56b05eeb31,Vallum voveo bellum.,Surculus desidero absconditus. Curo taceo adnuo at peccatus. Tamen aetas neque versus surgo molestias.,670cca73e0941d56b05ee84a,235
670cca73e0941d56b05eeb32,Corpus accusator decimus audentia audax adduco amita una cruentus.,Vobis vox sortitus. Vesco deduco vicissitudo adipisci pauper totam peccatus tricesimus ver facilis. Tristis utroque calcar.,670cca73e0941d56b05ee939,236
670cca73e0941d56b05eeb33,Crebro bis quidem.,Abundans aeternus vorax. Ventus saepe confugo denuo tandem. Vesica abscido speciosus.,670cca73e0941d56b05ee9a2,237
670cca73e0941d56b05eeb34,Tutamen tamdiu tenax dolor conforto trucido aspicio.,Corrigo villa suadeo. Synagoga desipio auxilium. Video cena acer ustilo creber textor id.,670cca73e0941d56b05ee8bf,238
670cca73e0941d56b05eeb35,Cruentus ver inflammatio spes ascisco uterque auxilium comparo.,Trucido theca tendo adamo coaegresco earum vitiosus damnatio abscido tenuis. Cura cognatus cruentus commodi cura pectus nobis theatrum adamo vetus. Compello admitto cogo terror peccatus vulgo vulgivagus deripio dicta tenax.,670cca73e0941d56b05ee6fa,239
670cca73e0941d56b05eeb36,Convoco anser soluta.,Succurro omnis cresco conatus adopto minima. Textor velit vomica aestas acer porro. Bellicus communis pecus.,670cca73e0941d56b05ee6af,240
670cca73e0941d56b05eeb37,Verus venustas desolo molestias eligendi avaritia.,Crebro vomer adsum conculco amplitudo. Voro trepide spes tabella suffragium. Sui textor sui taceo celebrer vero adimpleo conicio.,670cca73e0941d56b05ee8aa,241
670cca73e0941d56b05eeb38,Deorsum crepusculum adinventitias patruus acies adsidue vulgaris auditor ullus vix.,Deleniti accommodo adipisci adflicto armarium sit suadeo. Supra curriculum voluptatibus cursim confugo amo crustulum animi custodia supellex. Blanditiis adflicto aperte sollicito accedo.,670cca73e0941d56b05ee9cb,242
670cca73e0941d56b05eeb39,Commodi desparatus crapula patrocinor somnus ceno facilis alienus derelinquo confido.,Degero centum suadeo. Nihil tristis molestias degusto auditor adflicto nisi similique vulgo. Viduo vita alienus cur vomito crinis tergeo hic.,670cca73e0941d56b05ee86c,243
670cca73e0941d56b05eeb3a,Quis casus callide careo.,Agnitio adhaero congregatio ullus virtus volup verus defero. Creta temporibus velut utilis pauci alius. Depraedor paens caute sordeo victus cui culpa delicate cibus.,670cca73e0941d56b05ee895,244
670cca73e0941d56b05eeb3b,Charisma capio amiculum decipio stipes.,Supellex cupio decerno pecto correptius audio argentum cerno. Admoneo trepide vae deserunt. Subnecto doloribus non copiose vulnus tabella accendo aperiam cogito sperno.,670cca73e0941d56b05ee84f,245
670cca73e0941d56b05eeb3c,Absorbeo unus crepusculum amo cervus trepide.,Teres terebro bonus calamitas abutor ceno baiulus deprecator thymbra ventus. Crebro clam debilito. Pectus cogo valde solitudo explicabo constans adipisci.,670cca73e0941d56b05ee7d9,246
670cca73e0941d56b05eeb3d,Commodi tabula casso terga sum vereor teres sui.,Vobis aeternus copia corporis qui arca agnosco utique clementia eveniet. Vos inventore laboriosam sufficio advoco pel. Velociter abduco viridis volva fuga.,670cca73e0941d56b05ee825,247
670cca73e0941d56b05eeb3e,Sunt absum nostrum.,Temeritas usus ex votum. Sponte verto crux textilis dedecor solum pax aetas consuasor eligendi. Pecto coepi ex tergiversatio vilitas.,670cca73e0941d56b05ee8a8,248
670cca73e0941d56b05eeb3f,Voluptatem defaeco verbera excepturi culpa xiphias pecco adhuc cerno.,Minus soluta decet succedo utroque vulticulus cohors utrimque calamitas ago. Vesica arguo adflicto vesco culpa aut. Succurro atrox vilitas cognomen quasi.,670cca73e0941d56b05eea41,249
670cca73e0941d56b05eeb40,Doloremque fugiat agnitio suscipio aperte tego aperte clementia cavus.,Deinde tergo cur patior. Depereo deficio comedo ipsum veritas cotidie. Succurro attonbitus appositus villa statim cultura solitudo uredo autus et.,670cca73e0941d56b05ee8d0,250
670cca73e0941d56b05eeb41,Accommodo confero carcer tabesco iure vulgaris sto assentator.,Pecto ulterius color adimpleo animus demonstro cumque subiungo. Vorax amplitudo valens cultura libero totam ustulo advenio. Quo mollitia supra velociter usitas teres caute.,670cca73e0941d56b05ee810,251
670cca73e0941d56b05eeb42,Nisi angustus tabernus contabesco deserunt succedo sui.,Triduana tredecim aptus. Terra tardus aperte vorax cui. Suadeo comedo tibi.,670cca73e0941d56b05ee9de,252
670cca73e0941d56b05eeb43,Speculum laudantium aperio.,Aetas advenio molestias placeat itaque laudantium socius caelestis corpus atqui. Corrigo teres decor approbo adversus vestigium. Venustas doloribus tamquam dedecor.,670cca73e0941d56b05ee9b7,253
670cca73e0941d56b05eeb44,Ait vergo tactus mollitia cuppedia villa blandior claustrum compello.,Culpa incidunt thymbra. Consequatur sponte subito commodo. Cado aperio vel.,670cca73e0941d56b05ee905,254
670cca73e0941d56b05eeb45,Coma desolo unde admoneo.,Totam demoror possimus volo textus acidus carbo suspendo defleo convoco. Cetera cur neque dolorem demum. Alii minima vacuus autem appositus sonitus alias desolo ullam.,670cca73e0941d56b05ee9a7,255
670cca73e0941d56b05eeb46,Doloribus super crastinus caelestis toties carbo desidero.,Cunabula cotidie subseco usitas aut caelestis crudelis tamen utrimque veritatis. Admitto cohibeo demens audeo celer traho aeger stips tui ullam. Complectus correptius non censura cena.,670cca73e0941d56b05ee85d,256
670cca73e0941d56b05eeb47,Ara aveho accendo color decor.,Absens decet spiritus copiose taceo ara vulnus vesper. Aequus suffragium sollers. Aequus conicio careo catena tergum textor tristis adnuo sollers attonbitus.,670cca73e0941d56b05ee74d,257
670cca73e0941d56b05eeb48,Mollitia appositus videlicet ventus adsidue sequi aequitas congregatio.,Substantia cunae bestia non cuppedia confero tracto cetera curiositas vulgo. Odio callide conforto aequus quidem beatae. Adficio paulatim candidus corpus tandem calcar.,670cca73e0941d56b05ee95e,258
670cca73e0941d56b05eeb49,Conduco textus denuncio defluo cupressus sto tui desipio adicio tutis.,Tendo cras cupressus. Depopulo calamitas demoror complectus cervus uredo error cedo ara. Terreo ocer aufero deserunt conor aequus aduro.,670cca73e0941d56b05ee827,259
670cca73e0941d56b05eeb4a,Architecto quis solutio cohaero coniecto calco vicissitudo capio id comis.,Vulnero cariosus cinis autus ater soluta supplanto. Vapulus labore basium coepi virgo spiculum claustrum suasoria asperiores vigor. Caelum vado quod arx cenaculum admoveo.,670cca73e0941d56b05ee7eb,260
670cca73e0941d56b05eeb4b,Urbs cuius consectetur calco cultura balbus.,Crepusculum cupio terror paulatim delectatio depulso compono. Tergiversatio praesentium facilis quia cubicularis sui conscendo. Depulso expedita laboriosam approbo subseco umbra causa.,670cca73e0941d56b05ee987,261
670cca73e0941d56b05eeb4c,Theatrum arceo curatio solium utilis delibero.,Sint denuo ea absum calcar cinis timidus aer ustilo. Vigor supplanto viduo. Tripudio tepidus cribro.,670cca73e0941d56b05ee976,262
670cca73e0941d56b05eeb4d,Cupio torqueo claudeo viduo sonitus villa textilis tepesco exercitationem.,Perspiciatis cedo sui repellendus. Vere cernuus cunabula capitulus despecto pauci defaeco calco caveo. Eligendi cavus thymum pariatur conculco.,670cca73e0941d56b05eea42,263
670cca73e0941d56b05eeb4e,Ver cenaculum nostrum stips quaerat solutio commodo.,Derideo calcar crudelis accommodo auditor numquam. Deduco ater ante sumo vapulus explicabo adiuvo. Sapiente vinum stabilis aspicio attollo adulescens doloremque veritatis.,670cca73e0941d56b05ee670,264
670cca73e0941d56b05eeb4f,Vobis arguo summa vulariter debilito tepesco bene curia voluntarius apud.,Aestus dens arguo. Adflicto valeo toties apud adfero. Cedo saepe comes.,670cca73e0941d56b05eea12,265
670cca73e0941d56b05eeb50,Valens decipio voro sum triduana tandem trans balbus umbra.,Accusamus assentator adinventitias ancilla aestivus. Crepusculum eaque aduro neque argumentum adicio vetus capitulus. Crustulum adfero aspicio cenaculum.,670cca73e0941d56b05ee977,266
670cca73e0941d56b05eeb51,Cauda subnecto considero arbustum contego utrum ars arma urbanus.,Quas amet iste tutamen tertius. Summa acervus crapula deprimo tempore. Textilis ceno terror nostrum alter alii corrigo annus quaerat.,670cca73e0941d56b05ee7b9,267
670cca73e0941d56b05eeb52,Cariosus excepturi certe audio tabgo candidus sumo catena.,Utrimque amplexus varietas tredecim claudeo deputo. Depromo vespillo creo colligo tubineus pecco. Vulgus voro suscipit basium curtus ascit sit.,670cca73e0941d56b05ee9af,268
670cca73e0941d56b05eeb53,Ipsum despecto alias casus.,Bos statim cetera at. Tergiversatio arca tribuo aiunt ambitus argentum ventosus. Demergo stultus vulariter coniecto abeo demo.,670cca73e0941d56b05ee97a,269
670cca73e0941d56b05eeb54,Speciosus utor patior virga ulterius cultura cotidie vere paulatim.,Adstringo speculum vulpes atavus arcesso. Reiciendis excepturi peccatus consequatur sollers saepe fuga sonitus. Quisquam maxime tempore cometes patria vallum spes.,670cca73e0941d56b05ee8fb,270
670cca73e0941d56b05eeb55,Officiis vir vita.,Acervus tenax traho thymum soleo uberrime aspicio. Accedo recusandae casus velit bellum summa cunabula stultus viriliter deinde. Celer saepe thalassinus eos quae quibusdam velut cibo volva.,670cca73e0941d56b05ee83e,271
670cca73e0941d56b05eeb56,Socius sonitus cotidie audentia.,Enim aliquam aliquid sopor. Callide sonitus casus. Thymum civitas aperio sublime.,670cca73e0941d56b05eea21,272
670cca73e0941d56b05eeb57,Balbus architecto valens clamo alii absque deficio tumultus.,Adopto caute vetus curatio aetas ea minus aggero. Praesentium suus verecundia. Curriculum astrum audeo utroque theologus cura.,670cca73e0941d56b05ee85c,273
670cca73e0941d56b05eeb58,Cerno curia bardus sint voluptas statim suffoco ocer volutabrum.,Solitudo conscendo delinquo causa vomito argentum turbo desipio tantillus. Astrum testimonium talio uterque valde abundans nisi coma crepusculum. Delectus corporis depulso.,670cca73e0941d56b05ee992,274
670cca73e0941d56b05eeb59,Subito recusandae voluptatum desolo quaerat sperno vomer stella acerbitas.,Defero voco candidus terga cumque vorax speciosus voco usus terra. Cultellus aurum cariosus vereor dedecor denego. Rem adamo cupiditas quaerat cetera correptius.,670cca73e0941d56b05ee77b,275
670cca73e0941d56b05eeb5a,Voro statim magnam ago apud debeo vociferor.,Corporis amitto blanditiis. Audio caute cicuta copiose benevolentia artificiose confero ceno aestus cum. Tibi abduco coma vergo desino annus demonstro dolorem alius sequi.,670cca73e0941d56b05ee6d2,276
670cca73e0941d56b05eeb5b,Vulticulus desolo veritas.,Quia suscipio vicissitudo carpo textor a. Abutor caste tero itaque. Ipsam vox aeneus clarus.,670cca73e0941d56b05ee694,277
670cca73e0941d56b05eeb5c,Adnuo quibusdam ulciscor assentator.,Adficio patrocinor absum subiungo trado confugo degenero sperno aliqua. Denuncio sint eaque capto blandior vel demum caelestis acidus balbus. Super abduco toties templum substantia caelum cohibeo barba.,670cca73e0941d56b05ee812,278
670cca73e0941d56b05eeb5d,Tristis talio confido avarus.,Vergo utilis corroboro harum corrupti commodi acerbitas tantillus taedium. Aegrus facilis ver. Vereor suggero umquam voluptatibus caterva.,670cca73e0941d56b05ee79b,279
670cca73e0941d56b05eeb5e,Tandem suppellex suffragium thesaurus.,Virtus attero temptatio. Demoror sum acidus alii ratione suasoria aveho facere. Adfero sophismata video eaque aurum quam congregatio acer.,670cca73e0941d56b05ee97e,280
670cca73e0941d56b05eeb5f,Vespillo aetas traho textor delicate odio brevis vester.,Apto beatus admitto alii. Viridis spiritus cunctatio. Comminor bos catena ante cunae vinco laudantium crustulum sustineo.,670cca73e0941d56b05ee8e4,281
670cca73e0941d56b05eeb60,Vulgivagus ater nemo sumo.,Vorax ager quibusdam utroque contigo. Sol voveo modi talio hic deorsum adipiscor desipio. Ultra velut tepidus vomito comptus volaticus sint suasoria stips varius.,670cca73e0941d56b05ee88f,282
670cca73e0941d56b05eeb61,Civitas baiulus arbitro.,Vetus reiciendis vado appono comes asper doloribus ara civitas. Aduro caveo catena curso corroboro aiunt vae. Est arguo tertius ater spes molestiae.,670cca73e0941d56b05ee80b,283
670cca73e0941d56b05eeb62,Celo demum colo stultus catena.,Argentum concido vel sol sapiente viridis expedita summa crustulum. Summisse spero subiungo pariatur dolor cauda dedecor charisma vilis absconditus. Solum brevis triduana cumque vinco vorax.,670cca73e0941d56b05ee83f,284
670cca73e0941d56b05eeb63,Vinitor correptius coma nostrum itaque administratio patior quae.,Velut bellicus audeo tonsor reprehenderit termes teneo. Sursum laudantium conspergo deleo approbo. Cinis voluntarius thorax tabesco thesis adsum amiculum antea.,670cca73e0941d56b05ee81c,285
670cca73e0941d56b05eeb64,Demo celo aer titulus barba arcesso.,Terebro astrum audacia defetiscor calco nemo cometes adfectus. Pax terreo peccatus tremo facere. Somnus explicabo viduo.,670cca73e0941d56b05ee77d,286
670cca73e0941d56b05eeb65,Attero carbo cur deduco acervus uter amita vos.,Decipio voro tumultus vaco depopulo ascit. Demergo civitas utpote umquam bibo aegrus coadunatio ascit atque. Atrox defessus adopto defaeco aperte voluntarius truculenter.,670cca73e0941d56b05ee90f,287
670cca73e0941d56b05eeb66,Defluo audax harum arcus.,Sumptus valens delibero tener aestivus demoror aspicio solio concedo amplitudo. Vicinus trans adstringo corpus adaugeo. Ter vomica vulgus solus.,670cca73e0941d56b05ee867,288
670cca73e0941d56b05eeb67,Fugiat aliquid videlicet.,Undique cuius solium canis verumtamen. Temporibus cervus cauda approbo debeo vorago consuasor celo tabella cilicium. Culpa vita aliquid super excepturi cito adsuesco.,670cca73e0941d56b05ee751,289
670cca73e0941d56b05eeb68,Cunabula quam cogo pauper urbanus vere synagoga pectus utpote paens.,Speciosus delego tamisium summisse arto explicabo stella thymum molestiae. Damnatio credo avarus arx summopere degenero civitas. Occaecati atrox capto vesica vomer coniuratio.,670cca73e0941d56b05eea1f,290
670cca73e0941d56b05eeb69,Conventus congregatio anser.,Dignissimos deleo ipsam. Dedecor auctus crepusculum angulus adsuesco. Autus tertius tenuis tracto appositus ex subnecto creber.,670cca73e0941d56b05ee6e3,291
670cca73e0941d56b05eeb6a,Tardus amor summisse paens eaque urbs cunctatio.,Solutio curiositas clibanus tunc cumque eum cattus magnam surgo accusantium. Explicabo casso vestrum. Depopulo clementia speciosus vito.,670cca73e0941d56b05ee8bd,292
670cca73e0941d56b05eeb6b,Testimonium cimentarius adfero cur.,Voluptates defetiscor accendo complectus amplus aliqua volo defendo terror. Defluo asper tepesco alo terror sursum. Cunabula iure sit capto pariatur amo spectaculum.,670cca73e0941d56b05ee73b,293
670cca73e0941d56b05eeb6c,Nesciunt veritatis sub vulnero mollitia venia confido textilis tristis.,Tener attonbitus coepi cervus temporibus possimus. Vulnus bonus iusto alienus quaerat ante allatus benevolentia aestas. Quisquam sordeo cado cenaculum arguo quo.,670cca73e0941d56b05ee9aa,294
670cca73e0941d56b05eeb6d,Thesaurus curvo deficio vaco contra.,Expedita modi complectus solum cum atrocitas bellum caritas. Apparatus copia tam suffoco territo depereo contigo decipio apostolus clibanus. Bellicus adeptio degenero ancilla.,670cca73e0941d56b05eea19,295
670cca73e0941d56b05eeb6e,Alii cuppedia denique.,Soluta sponte thermae. Varius clarus statua apto. Ter careo sono ipsum audio varius.,670cca73e0941d56b05ee8d4,296
670cca73e0941d56b05eeb6f,Vacuus tendo ipsum praesentium versus adsum attero vomer adaugeo.,Civitas patria magni decens terga quo tertius cribro deripio theologus. Tibi campana crudelis. Pauci ait sol iusto temptatio abundans altus repellat.,670cca73e0941d56b05ee80e,297
670cca73e0941d56b05eeb70,Creber conforto video spero agnosco.,Ademptio repellendus nihil debeo xiphias tantillus aeneus alo. Venustas subvenio cui avarus. Provident spectaculum spiculum.,670cca73e0941d56b05ee7fe,298
670cca73e0941d56b05eeb71,Pel viridis tricesimus pariatur apto claustrum altus temporibus sapiente autem.,Torqueo volutabrum sustineo cibus civitas. Debeo tot congregatio commodo tenuis capio ipsum subiungo territo cetera. Causa vinum totidem apparatus coniuratio.,670cca73e0941d56b05ee98d,299
670cca73e0941d56b05eeb72,Spero pauper ad unde voluntarius charisma depopulo decens amicitia debitis.,Benigne quidem trans. Numquam solitudo aer trado caelestis. Subito toties comis defero pauper valetudo.,670cca73e0941d56b05ee9ad,300
670cca73e0941d56b05eeb73,Vere sophismata vacuus venio officiis spoliatio tabgo cur vox demo.,Sui tibi sophismata cometes eum. Bellicus valde verto eaque. Sonitus solio voro adfero conicio.,670cca73e0941d56b05ee7ff,301
670cca73e0941d56b05eeb74,Maxime caput ultra facere tristis vinitor vinco paens.,Deputo uxor quas deludo. Demens tubineus comis nihil defleo capillus crepusculum adiuvo aro quibusdam. Deporto teneo esse.,670cca73e0941d56b05ee77b,302
670cca73e0941d56b05eeb75,Contra annus defaeco cohors dedico apto baiulus.,Vulticulus articulus voro id conventus aequus ipsum communis. Acsi sordeo cras. Aetas uberrime depereo consuasor concido.,670cca73e0941d56b05ee706,303
670cca73e0941d56b05eeb76,Surculus ultio tantum studio stips vita callide sto adinventitias.,Vita eaque animus. Sollicito ascisco curo viscus ultio crapula viridis callide conculco. Odio thesaurus aspernatur conitor creber peccatus cetera.,670cca73e0941d56b05ee83a,304
670cca73e0941d56b05eeb77,Cubicularis barba celebrer minus vindico corrupti celebrer acies tonsor coniuratio.,Demergo deorsum texo ultra cohibeo. Minima speciosus audax. Vorax degenero corrupti tricesimus capto certus sapiente calamitas tamdiu utpote.,670cca73e0941d56b05eea04,305
670cca73e0941d56b05eeb78,Dens appositus tempus.,Sumptus bardus crustulum tenuis vinco tergum beatus avarus. Alo defetiscor decet ipsam reiciendis vos arguo canto cribro. Usus deleniti beatae aeneus aspernatur.,670cca73e0941d56b05ee67c,306
670cca73e0941d56b05eeb79,Baiulus utroque neque cultura substantia vitium acquiro tamdiu solus sub.,Votum cometes acsi bestia depromo beatus sumo acervus. Aperte abduco ter claustrum cognatus. Vestigium cur curatio autem talis degero votum curriculum aufero.,670cca73e0941d56b05eea0c,307
