moduleId,title,description,learningMaterialId,moduleKey
670cca73e0941d56b05eebe0,Amitto decerno supplanto verbum.,Coepi tribuo valde acer celer angulus fugit clarus. Conturbo repudiandae natus defluo ater audacia argentum damno. Sol deprimo statua arcus adficio bestia quaerat comitatus.,670cca73e0941d56b05ee978,410
670cca73e0941d56b05eebe1,Abutor usus labore vulgivagus adaugeo eveniet verecundia via appello.,Vereor timidus voveo accusantium commodi appositus verbum ars deserunt. Harum suppellex vero ea civis repellendus spoliatio. Subvenio contigo supellex adinventitias solum.,670cca73e0941d56b05ee6d9,411
670cca73e0941d56b05eebe2,Assentator carmen cognatus ara harum decretum ipsa ara cariosus ducimus.,Tabella aequitas appositus adaugeo alter. Universe ver beatus uter truculenter xiphias desipio rerum denuo. Ex cumque vulpes aggero comparo copiose taedium uterque vorax.,670cca73e0941d56b05ee7e9,412
670cca73e0941d56b05eebe3,Odio adulatio conor tertius adsum bis constans defluo utilis texo.,Censura crepusculum assumenda culpo accusantium adnuo tamquam dolores fugiat. Acervus copia recusandae cognatus acervus adipiscor vobis vulgivagus qui denego. Molestiae strues voluptas beatae.,670cca73e0941d56b05ee856,413
670cca73e0941d56b05eebe4,Deorsum amor eaque audio aliqua talio.,Averto condico admoveo centum aspicio depulso odio iure. Supellex triduana cariosus vitium. Infit quod excepturi acerbitas angelus.,670cca73e0941d56b05ee7cd,414
670cca73e0941d56b05eebe5,Cunctatio delectatio asperiores correptius.,Abundans tempus ipsam nesciunt stillicidium audio vulnero cursim deludo utilis. Sum damno rem. Solitudo vae defero demonstro.,670cca73e0941d56b05ee7ba,415
670cca73e0941d56b05eebe6,Magnam aegrotatio temperantia tabernus delego.,Umquam viscus admoneo. Est vereor toties illo uredo deorsum viridis desidero. Aranea celer curvo asperiores tamdiu.,670cca73e0941d56b05ee70c,416
670cca73e0941d56b05eebe7,Architecto summa cubicularis sto vaco solvo laborum aduro.,Damnatio tutis aliqua carpo adiuvo cenaculum aperiam benigne. Stella surculus porro maxime peior templum sequi aqua fugiat. Canto aperte tumultus consuasor soluta desipio in amicitia patria sui.,670cca73e0941d56b05ee8f8,417
670cca73e0941d56b05eebe8,Victoria autus victus ipsum audax veritatis cunae.,Cubo conspergo depulso sustineo supra totus. Vivo placeat quod aliquid arca arca urbanus. Appositus vesica adsuesco condico.,670cca73e0941d56b05ee936,418
670cca73e0941d56b05eebe9,Autus ventus uberrime.,Tenuis viduo dolor defluo vomer dedico annus apto defaeco sodalitas. Cresco cur atavus adipisci peccatus amissio. Cohibeo harum denego.,670cca73e0941d56b05ee892,419
670cca73e0941d56b05eebea,Culpa currus adfero vobis victoria.,Abeo vicissitudo cruciamentum caput tandem vereor deludo denego. Curo delego admitto clibanus cinis vesco. Tactus auditor coma.,670cca73e0941d56b05ee75f,420
670cca73e0941d56b05eebeb,Dicta delicate numquam sol beatus tergeo vomer adhuc.,Earum accendo denego campana vero solum vulticulus tempus. Teneo vel contego damnatio consequuntur delectatio demo conqueror capio. Cometes confero ars natus vinculum laboriosam dignissimos.,670cca73e0941d56b05ee9d5,421
670cca73e0941d56b05eebec,Comminor theologus apud ad artificiose arbitro arceo.,Vel decens censura. Cilicium cunabula temptatio pax degusto perferendis. Convoco tondeo quo studio stillicidium ustilo eos.,670cca73e0941d56b05ee9f4,422
670cca73e0941d56b05eebed,Venustas cursus balbus doloremque balbus alius triumphus.,Vulnero itaque ago rem temperantia vestigium peccatus nemo atavus. Delicate pectus pariatur varius valde vitiosus consequuntur cribro sit avarus. Desipio compono subiungo non.,670cca73e0941d56b05eea25,423
670cca73e0941d56b05eebee,Valde votum atque abbas.,Abduco thymbra voveo demoror quisquam sufficio. Venia atque claudeo ustulo vacuus tum vulgo. Decens dignissimos addo amissio.,670cca73e0941d56b05ee743,424
670cca73e0941d56b05eebef,Clarus vehemens auditor valens verumtamen eius.,Cresco vindico labore curatio contra reprehenderit adhuc ustulo. Et vitae venia. Depulso blandior aliquid volutabrum canis ubi.,670cca73e0941d56b05ee7ea,425
670cca73e0941d56b05eebf0,Virgo officia vae alioqui ratione patior aperte natus culpa.,Subito spes asperiores cornu abduco solitudo. Subvenio uter vorax arto adflicto. Suppono arguo decipio damnatio.,670cca73e0941d56b05ee793,426
670cca73e0941d56b05eebf1,Aurum alioqui cumque comparo nemo terminatio crapula alioqui.,Depopulo averto bis numquam turpis rem conor debeo asperiores sublime. Bardus appello consequuntur sed. Canto ustilo brevis vilis virgo confido decipio.,670cca73e0941d56b05ee8f8,427
670cca73e0941d56b05eebf2,Strenuus cultura angustus minus reprehenderit tempora caveo.,Cibo alter comptus perferendis antea cura cedo tabesco. Pel audentia cibo adhuc confugo. Somniculosus utpote voluptatem cura quod apostolus.,670cca73e0941d56b05ee9ae,428
670cca73e0941d56b05eebf3,Tamen deinde placeat esse.,Amet sperno acer. Sublime cibus a. Sonitus callide tempus tollo tamdiu aegrus sursum cimentarius absum id.,670cca73e0941d56b05ee6fe,429
670cca73e0941d56b05eebf4,Tabgo centum curiositas ascisco amoveo termes.,Cattus claro repellendus arguo amo somniculosus stipes. Aperio denuo aurum. Ater harum similique.,670cca73e0941d56b05ee748,430
670cca73e0941d56b05eebf5,Unus thymbra cattus argumentum in causa absum calamitas umerus.,Pauper admoveo teres crur ademptio caterva uter veniam ater consequuntur. Vitium denego triumphus degero excepturi cito aequus nisi admitto. Adeo aduro stipes corpus magni solvo aduro blandior peccatus.,670cca73e0941d56b05ee6dc,431
670cca73e0941d56b05eebf6,Clarus deputo adipiscor considero tremo defleo tantum terebro.,Minus ipsam auxilium amplexus coadunatio magnam. Celo crapula tutamen terebro demulceo conscendo. Fugit explicabo argumentum video solus.,670cca73e0941d56b05ee89e,432
670cca73e0941d56b05eebf7,Tabula solvo depulso consuasor calco amaritudo anser.,Infit ipsam vergo. Stultus cribro ulciscor alo decet calamitas utrum. Earum aegre enim appono dicta voco sustineo tui coruscus tamdiu.,670cca73e0941d56b05ee678,433
670cca73e0941d56b05eebf8,Decens via contabesco cibus creo solium autus.,Celer tepidus suscipio somniculosus victoria. Ante denuncio sufficio doloribus vero comes cohaero titulus. Ipsam comminor bonus suppellex valens.,670cca73e0941d56b05ee8f9,434
670cca73e0941d56b05eebf9,Benevolentia vicissitudo conservo nam.,Concido deserunt absum cetera accusamus. Solium alias corrupti theatrum. Varietas alias spoliatio villa balbus calculus.,670cca73e0941d56b05ee6be,435
670cca73e0941d56b05eebfa,Stipes alienus tergum adficio pauper adsum acervus.,Decerno absorbeo adipisci. Deprecator casus attero. Tutis teneo astrum valde pariatur.,670cca73e0941d56b05ee861,436
670cca73e0941d56b05eebfb,Admoveo denuncio suspendo amor voluptatibus voro statim defaeco cognomen veritatis.,Ubi corona baiulus textus voveo cur dapifer voluptatum. Aggero combibo usitas caries conscendo eligendi curatio. Cibus consectetur dedecor cultellus totam canis.,670cca73e0941d56b05ee84b,437
670cca73e0941d56b05eebfc,Carpo sol tubineus suasoria.,Facilis desparatus cado numquam vere tenax. Vindico strenuus stella tollo. Adfero cogito copiose earum.,670cca73e0941d56b05ee9bd,438
670cca73e0941d56b05eebfd,Spiculum pel eos amor stipes terga.,Uberrime suus denuncio. Ipsam depereo absorbeo utroque blanditiis. Taceo cornu creator cetera.,670cca73e0941d56b05ee9f7,439
670cca73e0941d56b05eebfe,Statua delectus aduro coaegresco arto.,Defaeco utroque doloremque tristis ipsum peior abutor sequi ipsum. Ultio argumentum totam desidero antea ultra velum inflammatio. Quia super deludo spero reprehenderit comparo adversus amaritudo.,670cca73e0941d56b05ee876,440
670cca73e0941d56b05eebff,Stillicidium decipio iusto demo sollicito cupiditate admitto antiquus comburo.,Reiciendis aer sum iure deleo velociter adversus cuppedia super mollitia. Quibusdam chirographum crudelis templum. Campana vomito audeo tollo amicitia terga soleo deporto.,670cca73e0941d56b05ee779,441
670cca73e0941d56b05eec00,Vinum decretum tabgo reiciendis conor adfectus adipisci.,Substantia deputo acerbitas bellum aliquid artificiose cattus via. Dolorum terminatio caute laborum conturbo utrum traho. Cometes textor deleo adeo vulnero.,670cca73e0941d56b05ee854,442
670cca73e0941d56b05eec01,Vitae turba valeo.,Uredo considero aggredior pectus. Auctor stultus aro sollers vivo vulnero. Appono tot reprehenderit admiratio cattus.,670cca73e0941d56b05ee9d8,443
670cca73e0941d56b05eec02,Amiculum spectaculum vesper virgo voluptate cum angulus articulus tabula.,Abscido decor aro thorax. Temptatio decerno absum. Ascisco ter cruentus conqueror.,670cca73e0941d56b05ee7dd,444
670cca73e0941d56b05eec03,Verecundia iure theca conventus decerno.,Bis at stips dicta vel clam appello victoria vicissitudo culpa. Rerum delicate cometes voluptatibus admoneo dapifer nam tutamen deleniti clam. Nam compello templum praesentium odio avaritia.,670cca73e0941d56b05ee819,445
670cca73e0941d56b05eec04,Ter acerbitas delectatio conscendo centum eligendi absum.,Tot nobis universe. Apparatus deputo vicissitudo quod vespillo inventore conor. Adficio deduco arcesso adflicto tollo ceno patior confero contabesco.,670cca73e0941d56b05ee8f0,446
670cca73e0941d56b05eec05,Totus capillus angulus speciosus vehemens.,Spiculum talis videlicet thymbra combibo utroque balbus arcus alter. Careo adamo sustineo aperio degero veniam appono conatus decet. Acervus repellat denique architecto tui.,670cca73e0941d56b05ee754,447
670cca73e0941d56b05eec06,Tui tabesco curso tabernus certe articulus contabesco autem depromo.,Accedo acquiro cinis. Complectus dolorum spero villa omnis tabula fuga. Vesco delectatio cultellus terra.,670cca73e0941d56b05ee8c8,448
670cca73e0941d56b05eec07,Vel esse similique suffoco debitis.,Summa beatae stella vitiosus. Accusantium arbor antepono urbs dolor. Totidem unde consequuntur sperno.,670cca73e0941d56b05ee98e,449
670cca73e0941d56b05eec08,Denuncio similique adhaero compono tabgo sub arca causa ventus.,Celer supellex coniecto. Velum doloremque balbus aspicio. Benevolentia decimus ullam officiis harum amplitudo ante.,670cca73e0941d56b05ee812,450
670cca73e0941d56b05eec09,Ullus acquiro recusandae avarus paulatim vorago tantillus temeritas corona veritatis.,Subnecto cunae arbustum comptus depereo. Comptus sunt adicio sequi. Sopor surculus vilicus texo cito depereo aveho civitas cotidie adhuc.,670cca73e0941d56b05ee6f2,451
670cca73e0941d56b05eec0a,Eligendi socius termes decens triumphus campana supra.,Suasoria communis suspendo. Conatus ocer distinctio et quidem debilito acidus. Comitatus voluptatem convoco aeneus amitto bestia.,670cca73e0941d56b05ee994,452
670cca73e0941d56b05eec0b,Contego cupiditas nulla.,Incidunt tametsi defleo brevis corroboro cohors certe uter. Molestias currus virgo auditor paulatim in decipio beneficium correptius. Adsuesco celebrer cervus nesciunt.,670cca73e0941d56b05ee758,453
670cca73e0941d56b05eec0c,Ultio cito aliqua coniecto usitas.,Cotidie conatus tripudio vergo valde temporibus canis cohors. Adversus abstergo ventosus claudeo solitudo. Appono bestia delinquo curto.,670cca73e0941d56b05ee7da,454
670cca73e0941d56b05eec0d,Ater despecto fuga temptatio strenuus.,Comprehendo apud vitae vaco vae adicio conscendo valetudo. Sollers cognatus contabesco vix. Sed tyrannus vulariter collum votum auditor aptus adversus iure cetera.,670cca73e0941d56b05ee7ae,455
670cca73e0941d56b05eec0e,Ventito cunae spargo acies aperio allatus audax occaecati arca doloremque.,Optio acerbitas cariosus cura taedium. Callide sordeo crastinus curso copiose non bestia infit. Cultura cresco deludo adduco deludo tabella.,670cca73e0941d56b05ee71e,456
670cca73e0941d56b05eec0f,Depono corroboro crustulum acervus perferendis agnosco speculum amplexus.,Appono tutamen deripio tardus velit color templum stella credo pecto. Ademptio vulgaris vobis peccatus eos arca nisi tonsor cunabula. Cogo varietas conventus benigne aliqua.,670cca73e0941d56b05ee93f,457
670cca73e0941d56b05eec10,Aiunt vitium desino compono supellex stella doloremque carbo.,Vae cibo administratio uter itaque defero astrum. Administratio voluntarius incidunt addo crinis caste provident expedita. Credo amitto trepide despecto ut trepide crastinus.,670cca73e0941d56b05ee765,458
670cca73e0941d56b05eec11,Carcer termes comprehendo corpus clam deserunt amiculum crudelis atavus conduco.,Ventus cavus iusto audio spiculum cuppedia sufficio veritatis. Amiculum demergo vos super bos. Vestrum titulus sollicito.,670cca73e0941d56b05eea28,459
670cca73e0941d56b05eec12,Centum tenuis alii volaticus substantia vado decor adicio artificiose.,Aranea dolorum sponte baiulus ultio. Cornu voro ait quo voluntarius. Saepe cetera corrumpo accommodo unus non curriculum decipio.,670cca73e0941d56b05ee6ff,460
670cca73e0941d56b05eec13,Coma animi tot denique quidem tendo necessitatibus demulceo.,Strues nostrum depono fuga defleo cerno vulgo. Paulatim voluptates aureus correptius ter denuo. Versus doloribus audio laudantium compono.,670cca73e0941d56b05ee76c,461
670cca73e0941d56b05eec14,Cetera bellicus thalassinus cogo cupio decens cohaero.,Correptius creo tempus collum appello. Callide ventito vester aedificium tandem solvo compono. Sortitus ait calco totus quod cornu complectus surgo solio.,670cca73e0941d56b05ee6ec,462
670cca73e0941d56b05eec15,Crur at bestia confero centum absque clamo acies inventore.,Subnecto veritatis bellum decerno depereo tergiversatio degero. Umquam commodo vociferor. Contabesco beatae usus.,670cca73e0941d56b05ee9dd,463
670cca73e0941d56b05eec16,Abscido conitor ascit.,Cupiditate incidunt curto civitas. Nobis tamquam verbera amet tripudio dolorum supra. Depulso adflicto subseco sint calculus carmen claudeo quam id.,670cca73e0941d56b05ee6e4,464
670cca73e0941d56b05eec17,Terreo vere antepono absconditus benevolentia aureus amiculum aspernatur cubicularis volaticus.,Vito suffragium torqueo advoco degenero incidunt uredo. Averto eaque ad vulgaris consequatur ademptio pectus. Comis explicabo currus solus acer colo arx solvo aranea.,670cca73e0941d56b05ee759,465
670cca73e0941d56b05eec18,Attollo soleo surgo pel altus.,Cavus ex non sponte timidus conscendo calamitas carcer studio depraedor. Desino ventosus taedium at. Velit tabgo sol.,670cca73e0941d56b05ee6dd,466
670cca73e0941d56b05eec19,Una vilitas ut abundans artificiose vigilo.,Accedo averto vulgivagus tollo currus tres. Thymum ciminatio eligendi tametsi alius adhuc a torrens. Arbor quo victoria cribro.,670cca73e0941d56b05ee9f5,467
670cca73e0941d56b05eec1a,Cerno supplanto annus adipiscor autem doloremque territo tergum.,Talis suffoco villa molestias candidus facere terga sustineo blanditiis. Temporibus claustrum aggero. Cur accusamus tristis aeneus uterque cupiditate.,670cca73e0941d56b05ee77a,468
670cca73e0941d56b05eec1b,Tabgo corona creber ducimus viridis stillicidium caste caelestis soleo.,Caute coerceo repudiandae amiculum. Dolorum vesco amplitudo eius pecto sint advoco triduana colo viridis. Contabesco damno capillus concedo defero virga.,670cca73e0941d56b05ee812,469
670cca73e0941d56b05eec1c,Vir attollo ait chirographum censura tibi fugiat tactus adulatio.,Cras assentator reiciendis tabgo xiphias subito voluptate debeo. Ait velum voluptate. Ducimus cunctatio sortitus aqua sonitus voveo adiuvo aro somnus.,670cca73e0941d56b05ee9fd,470
670cca73e0941d56b05eec1d,Suggero virtus undique vapulus similique non vomer.,Deputo aegre aggero ventito capto bellum consequatur a aspicio cetera. Amplexus ante velit tener tabula ascisco corona. Magnam varietas viridis peior delinquo cruciamentum minus caveo.,670cca73e0941d56b05ee9d9,471
670cca73e0941d56b05eec1e,Curis eaque curriculum somniculosus undique optio sol.,Creber rem deduco valetudo culpa acceptus corrumpo cervus ea adsum. Deleo sumo theca abundans spectaculum verecundia eum. Angustus voveo demum facilis.,670cca73e0941d56b05ee78e,472
670cca73e0941d56b05eec1f,Supplanto turba aureus in tergiversatio deduco substantia baiulus.,Carmen avarus vinculum utilis. Beneficium theologus annus strues tardus. Aspernatur carpo arbitro soluta.,670cca73e0941d56b05eea0b,473
670cca73e0941d56b05eec20,Accendo distinctio temporibus vestrum adulescens terebro talis tenetur.,Cado animadverto tutis ubi tutis trans occaecati deputo ultio. Universe virgo attonbitus usitas tabula delibero asper natus arx. Adsuesco suggero iste veritatis tyrannus amplus.,670cca73e0941d56b05ee85a,474
670cca73e0941d56b05eec21,Conspergo attollo amet substantia.,Explicabo tantum alius amplitudo angustus velum contego. Civis aegre viduo decimus admitto appono antepono. Thermae umbra canto.,670cca73e0941d56b05eea00,475
670cca73e0941d56b05eec22,Conduco claustrum adversus succurro strues acervus.,Quam aufero spero creptio depono demitto in utilis. Strues auxilium campana claustrum consectetur inflammatio uxor. Approbo solitudo vespillo auctor talio dolor.,670cca73e0941d56b05ee909,476
670cca73e0941d56b05eec23,Usus dolores quis officia vespillo.,Concido videlicet abeo acidus perferendis. Vitiosus aetas candidus vilicus coaegresco decor adimpleo decerno titulus vulariter. Valde textilis crinis dicta sum denique.,670cca73e0941d56b05ee6c7,477
670cca73e0941d56b05eec24,Tantum defetiscor mollitia audeo animus vociferor tenuis ducimus comparo.,Cognomen aro triumphus laborum credo celer vitiosus umquam culpa. Cupiditas absorbeo solio capitulus cinis tenetur suscipio. Inflammatio iste depereo.,670cca73e0941d56b05ee912,478
670cca73e0941d56b05eec25,Vespillo amicitia ipsa demum totus amplitudo.,Utrum condico aeger. Cresco thalassinus ancilla. Ratione tamquam currus demoror.,670cca73e0941d56b05ee76e,479
670cca73e0941d56b05eec26,Sordeo adversus aegrus.,Xiphias ter voro pauci alias sublime crastinus acidus. Verto compello magni video cibo molestias coniecto comis tandem tabula. Alioqui bardus tempore.,670cca73e0941d56b05ee7d8,480
670cca73e0941d56b05eec27,Angustus sed amita derelinquo textilis asper quibusdam vulpes cubo id.,Deficio defungo curiositas angulus crur volubilis quas stultus. Addo cunctatio velut curia. Paulatim vergo damnatio certus sui thermae barba talio.,670cca73e0941d56b05ee66f,481
670cca73e0941d56b05eec28,Absque abduco defero admitto rem.,Carpo adstringo cubicularis studio talis cognomen cunae. Tyrannus acervus clamo sint voluptas supellex deporto carmen ascit supellex. Venustas ventito corporis convoco amicitia.,670cca73e0941d56b05ee6dd,482
670cca73e0941d56b05eec29,Vix decimus arto exercitationem cruentus commemoro qui abutor cum.,Omnis excepturi curvo concedo ancilla cotidie acsi. Dicta desino trucido tantum vigor vulgaris. Verto pauci absorbeo textilis.,670cca73e0941d56b05eea0e,483
670cca73e0941d56b05eec2a,Rem vallum ultio perferendis cedo despecto.,Aperiam patrocinor varius demonstro. Comburo eveniet calamitas abundans sto angelus demo combibo. Valens valde tristis carbo tam.,670cca73e0941d56b05ee87e,484
670cca73e0941d56b05eec2b,Comprehendo decretum degero thermae cito acquiro capitulus vero torrens abscido.,Cuppedia sequi cimentarius capto unde. Alienus adamo sustineo ciminatio somniculosus constans spoliatio. Contabesco vigilo adicio volutabrum voveo tricesimus patrocinor autem.,670cca73e0941d56b05ee693,485
670cca73e0941d56b05eec2c,Crastinus depono colligo audeo depulso.,Sordeo spoliatio voco totidem. Tener sub vorago statim viriliter thema. Cupio careo corroboro conturbo.,670cca73e0941d56b05ee837,486
670cca73e0941d56b05eec2d,Temperantia veritas addo desidero turpis taedium calcar defleo tero.,Terreo coruscus vigilo beatae stella nemo bos. Volaticus laborum viriliter ver carus. Accusantium adimpleo averto.,670cca73e0941d56b05ee9ac,487
670cca73e0941d56b05eec2e,Voluptatum eos barba.,Creptio solutio benevolentia porro acidus. Vacuus attero suppono alter vomer vulgus est. Utrimque denuncio aiunt.,670cca73e0941d56b05ee827,488
670cca73e0941d56b05eec2f,Totam coaegresco triumphus arx.,Crustulum condico ocer vitae vero aureus viridis. Tersus stips carus aeternus quia totidem ustilo cernuus crudelis hic. Velut ager triumphus universe.,670cca73e0941d56b05ee6b7,489
670cca73e0941d56b05eec30,Adimpleo thymbra labore demergo conculco bis suscipit et utor certus.,Adhaero uter solio totus vergo creo auctor suffragium. Convoco catena commodi victoria tabernus vero. Coepi constans temptatio certe ut cur terminatio.,670cca73e0941d56b05ee6b4,490
670cca73e0941d56b05eec31,Truculenter adopto clibanus tabesco creptio.,Amoveo nam comitatus veniam. Culpa vestrum aeternus officiis uredo dapifer. Vespillo denuncio antea vitium deputo cedo solio.,670cca73e0941d56b05ee6bd,491
670cca73e0941d56b05eec32,Sint doloremque defaeco bellum abstergo suscipit cinis virga.,Sumptus bestia adsidue eum casso curvo amiculum defero communis tener. Cotidie abutor valens comprehendo verecundia vis amoveo. Tabgo cavus abstergo quisquam cohors deinde vilitas.,670cca73e0941d56b05ee6aa,492
670cca73e0941d56b05eec33,Ait callide veniam beatus temeritas voro vulnus tersus tendo.,Ulterius magnam atrox derideo creptio patria inventore. Pauci ascit verto agnitio corporis color beatus arbor argentum. Depulso bardus vulgus cupressus vitium comis.,670cca73e0941d56b05ee81c,493
670cca73e0941d56b05eec34,Demulceo vilis optio tenax amo atrox tenetur uberrime tolero.,Nisi totidem depereo artificiose. Cruentus depraedor corpus speciosus ut deporto asperiores perferendis. Tum ultio coaegresco.,670cca73e0941d56b05ee9dc,494
670cca73e0941d56b05eec35,Amo sodalitas clam comburo.,Surculus vix sint arca alias. Suscipit fugit vestrum tricesimus campana turbo patruus absens comedo. Color amissio deduco decerno admitto dedecor conservo hic vobis.,670cca73e0941d56b05ee8c7,495
670cca73e0941d56b05eec36,Copiose cauda ipsum aedificium.,Curtus tribuo venustas cetera peior voluptas validus adipisci terra vesper. Patruus alveus addo. Coadunatio calcar vulgaris aestus.,670cca73e0941d56b05ee878,496
670cca73e0941d56b05eec37,Contra ducimus cicuta abscido.,Alii quis solium tibi textus. Magni error voluptate. Dolore uberrime creptio abscido vinum vivo acies tero.,670cca73e0941d56b05ee753,497
670cca73e0941d56b05eec38,Crastinus charisma traho virgo demoror volaticus arcesso supellex cognatus curso.,Adulescens nisi auctor vindico. Praesentium viduo totam cognatus. Demonstro assentator demo ea certus ambulo.,670cca73e0941d56b05ee95c,498
670cca73e0941d56b05eec39,Dolores tui natus valens stabilis brevis ducimus atavus.,Creator autem capillus pecus decumbo. Suspendo cur abeo conor. Autem eveniet speciosus odio trans tabula vere ceno.,670cca73e0941d56b05ee9d6,499
670cca73e0941d56b05eec3a,Armarium sordeo volaticus suspendo acervus contabesco.,Patria conitor explicabo acerbitas cribro amor vomica barba ambitus. Asperiores universe delibero apostolus dolorem. Debilito viriliter capio carbo magnam sumptus.,670cca73e0941d56b05ee928,500
670cca73e0941d56b05eec3b,Sapiente textor thymum calco terebro voluntarius baiulus verto colligo succedo.,Sub magnam animi libero nesciunt comedo. Facilis audeo apto validus cur combibo temporibus. Maxime demergo advoco ventito sortitus contego spargo volup apparatus.,670cca73e0941d56b05ee8c6,501
670cca73e0941d56b05eec3c,Vinum voluptatum corrigo totus aqua eligendi.,Cruciamentum arbor vinitor. Creator tollo sperno. Modi incidunt maiores suppellex vomer.,670cca73e0941d56b05ee8bb,502
670cca73e0941d56b05eec3d,Thermae armarium cernuus.,Cibo atque apud thermae benevolentia celebrer solutio deleniti stella. Tener ulterius cuius. Demergo vulgus calcar tot subiungo consuasor cibus.,670cca73e0941d56b05ee9d1,503
670cca73e0941d56b05eec3e,Copiose tenetur adamo suppono torrens adicio vesica.,Verbum aptus acidus crux calcar varietas sperno necessitatibus ipsa. Damno clibanus caritas eligendi acsi angustus. Chirographum aut dedico contabesco statim cultellus torqueo hic.,670cca73e0941d56b05ee96e,504
670cca73e0941d56b05eec3f,Vesco amoveo explicabo aestus voveo maxime claro volup tamen odit.,Nisi universe cultellus. Eum quasi curatio paulatim hic veritas ara comprehendo. Provident vero vilicus timor aranea.,670cca73e0941d56b05eea2f,505
670cca73e0941d56b05eec40,Deprimo aeternus arto crux curriculum atavus deleniti viriliter.,Vicinus brevis eius agnitio volubilis ademptio somniculosus deporto. Pauper arguo sursum absorbeo. Ullam viridis angelus.,670cca73e0941d56b05ee9f6,506
670cca73e0941d56b05eec41,Arguo temeritas blandior convoco conservo alias.,Comburo sumo tricesimus. Damnatio alius cetera videlicet subito conscendo. Bellicus contego coma cohibeo vehemens sequi stultus nesciunt tumultus censura.,670cca73e0941d56b05eea13,507
670cca73e0941d56b05eec42,Caries sursum appositus tres undique casso bellicus.,Acidus alo candidus decor adiuvo vilicus astrum creta. Calco pectus cupressus campana ascisco vere. Ea quam communis tondeo deripio vilitas debitis suppono tamquam et.,670cca73e0941d56b05ee9ed,508
670cca73e0941d56b05eec43,Cumque aiunt ultra.,Sed stillicidium laborum consuasor colo alius curis una vesica caecus. Solium veritatis vis. Demo carcer beatus.,670cca73e0941d56b05ee6ae,509
670cca73e0941d56b05eec44,Voluptatum claudeo caveo defaeco.,Valeo soluta quia derideo vulariter. Tubineus usus quidem delibero vis aurum cariosus calco temeritas. Aduro surculus verto harum.,670cca73e0941d56b05ee707,510
670cca73e0941d56b05eec45,Compono decimus ceno vapulus.,Tardus certe apostolus tepidus tergum. Tabesco tollo aegrotatio. Approbo coma quasi colo mollitia caecus.,670cca73e0941d56b05ee7ed,511
670cca73e0941d56b05eec46,Asper adsidue brevis tui aestas comminor animadverto nam tondeo cuppedia.,Curvo voluntarius calco decens appono umerus caelum. Aegrus carmen aperiam. Tersus carmen deduco ademptio delibero officiis absque xiphias beatus expedita.,670cca73e0941d56b05ee80b,512
670cca73e0941d56b05eec47,Itaque ait validus teneo ullam iusto harum saepe nulla viriliter.,Arca victoria molestias tredecim voluptatibus paulatim temptatio tonsor defungo decipio. Adopto ante aestas alveus allatus uredo conqueror paens. Summa necessitatibus amaritudo vulticulus urbanus.,670cca73e0941d56b05ee8a3,513
