moduleId,title,description,learningMaterialId,moduleKey
670cca73e0941d56b05eea47,Absconditus civitas tamisium speculum cito arto cohibeo cupressus.,Voro benigne suffoco laboriosam succedo terreo tamisium depraedor. Absorbeo ea valetudo contego labore cribro cubo. Valetudo decet correptius nisi cunabula arcus vinculum valens consuasor.,670cca73e0941d56b05ee90c,1
670cca73e0941d56b05eea48,Terebro cuppedia pax ustulo xiphias tamen corpus.,Tui acquiro nemo auxilium vel aequitas repudiandae. Sub vivo suus tui tot delectus saepe. Antiquus tergo arto delego causa modi.,670cca73e0941d56b05ee948,2
670cca73e0941d56b05eea49,Amaritudo appello urbanus acidus iure ultra.,Defleo quisquam ara ater substantia atrox tricesimus. Angustus iusto accendo acsi suspendo rerum defluo titulus traho. Tenetur minus quo acer causa accommodo carus audax solus aliqua.,670cca73e0941d56b05ee7aa,3
670cca73e0941d56b05eea4a,Tyrannus debilito amo auctor victus alter solitudo ut.,Undique clibanus creta tempore usitas vacuus canto quasi. Bellum dolor enim. Despecto atque voluntarius taceo solus appositus peccatus aveho absens demulceo.,670cca73e0941d56b05ee7c0,4
670cca73e0941d56b05eea4b,Teneo abduco cui.,Vulpes suscipio arbustum eos absum deripio. Compello facilis contego auctor talus amet perspiciatis tracto. Suspendo absconditus vicinus amplitudo adflicto tersus rerum ter soluta.,670cca73e0941d56b05ee6c5,5
670cca73e0941d56b05eea4c,Comprehendo suus audeo comprehendo adaugeo carbo ut voco.,Contabesco summa tutis admitto baiulus cubitum adsidue. Stips terra cunabula. Certe vitiosus decimus tabgo claustrum recusandae.,670cca73e0941d56b05ee7a2,6
670cca73e0941d56b05eea4d,Vel cui ter usus utor cras terra adficio artificiose.,Truculenter calculus quam deripio. Doloremque terreo audeo volaticus audio candidus vinum. Commemoro arca sunt sono pecto adinventitias ustilo sustineo copia vomer.,670cca73e0941d56b05ee92b,7
670cca73e0941d56b05eea4e,Vobis speciosus verbera.,Trucido balbus tubineus. Error socius viriliter alienus caelum aurum aequitas adeo viriliter. Quas eaque verto carbo consectetur agnosco tubineus quam animus debeo.,670cca73e0941d56b05ee666,8
670cca73e0941d56b05eea4f,Cervus angulus decet.,Spiculum ara decimus crapula alter adopto. Villa aequus corpus arbitro eveniet vindico possimus aequus constans atavus. Subnecto condico tubineus.,670cca73e0941d56b05ee6c1,9
670cca73e0941d56b05eea50,Spectaculum video adipisci magni valens acies deleniti tabgo.,Exercitationem arma aperte statua catena videlicet coadunatio. Administratio voco vilis cauda. Sit vos vivo conventus adamo ab decipio defluo suscipio tergum.,670cca73e0941d56b05ee78c,10
670cca73e0941d56b05eea51,Altus undique cauda super tonsor titulus alias.,Capto pecto tabernus studio celebrer arbitro demergo quod solum. Strenuus cribro baiulus pecto. Casus vis temptatio.,670cca73e0941d56b05ee6ce,11
670cca73e0941d56b05eea52,Animadverto tego inventore spes vesper solio veniam valde cura una.,Angulus deleo taceo balbus contego cedo contra acquiro administratio. Pariatur arca animus cado tenus adinventitias thesaurus cimentarius molestiae. Censura accommodo arbor molestias carpo.,670cca73e0941d56b05ee7f8,12
670cca73e0941d56b05eea53,Sortitus voveo abeo terebro acies claro tametsi suus teneo.,Vox cetera abscido color caste ratione verecundia maxime volo tenus. Adfero turpis cornu adimpleo volaticus vicissitudo. Degusto cinis arceo absque acer ab aspicio non pecco quod.,670cca73e0941d56b05ee7bf,13
670cca73e0941d56b05eea54,Valens benigne aegrus.,Appositus unde spectaculum. Bardus thymbra vergo decimus adduco quisquam concedo. Capillus asporto curo temptatio suasoria atque undique.,670cca73e0941d56b05ee9eb,14
670cca73e0941d56b05eea55,Viduo in desolo comes animadverto conor saepe tutamen fugit conitor.,Spiritus vespillo peior valeo. Tutis comminor tepesco exercitationem animus. Nam velum cibus pecto unde.,670cca73e0941d56b05ee675,15
670cca73e0941d56b05eea56,Causa delinquo stillicidium vobis dapifer.,Centum porro vix perspiciatis. Avarus cariosus umerus cetera beatae somniculosus supplanto denuo. Careo est sonitus adstringo torqueo.,670cca73e0941d56b05ee8d1,16
670cca73e0941d56b05eea57,Creptio tum adfero subiungo conforto autus.,Officia venio temptatio aegrotatio subvenio damno solio in nulla. Arceo deleo cunabula arcus adsuesco. Congregatio aureus tamen comminor aeternus uxor bibo suscipio umerus veritatis.,670cca73e0941d56b05ee843,17
670cca73e0941d56b05eea58,Ars super uredo delibero ascisco calcar adnuo quaerat cattus solvo.,Depereo subito adfectus constans blandior ratione. Circumvenio sollers causa adflicto vivo. Ceno cattus approbo alter deprecator adopto.,670cca73e0941d56b05eea0b,18
670cca73e0941d56b05eea59,Torrens blandior tergeo caveo acsi adflicto sub.,Deorsum demo laudantium. Cursim canto antiquus canonicus thesaurus. Sol contego accendo capitulus delectus defetiscor suppellex claustrum victoria summa.,670cca73e0941d56b05ee9a4,19
670cca73e0941d56b05eea5a,Absens curriculum ante delego inflammatio cum totus cursus absconditus.,Amplitudo ustulo abbas arcus vapulus. Utique territo ademptio temporibus. Vos cicuta carpo verto atque antiquus conduco distinctio.,670cca73e0941d56b05ee883,20
670cca73e0941d56b05eea5b,Commodi deficio canis.,Blanditiis vaco tredecim vesper. Delinquo blanditiis totus vado verbum ventito. Cunctatio textilis talis appono dedecor.,670cca73e0941d56b05ee7d4,21
670cca73e0941d56b05eea5c,Ad curiositas vicinus tabesco deserunt facilis conforto vos.,Tabgo amitto territo aequus derideo coruscus totam congregatio. Annus conculco pectus cogito. Truculenter vicissitudo utpote vomito capillus ventito creator maxime.,670cca73e0941d56b05ee69b,22
670cca73e0941d56b05eea5d,Audeo vir valeo cum.,Demo altus color nam architecto cuppedia tracto. Crepusculum appositus ipsa tempus cura. Textus facilis defetiscor.,670cca73e0941d56b05ee678,23
670cca73e0941d56b05eea5e,Color demonstro tui.,Ulterius triumphus decumbo villa pax umerus sufficio. Solitudo utrimque concido tollo tripudio defaeco solitudo summopere. Delectus tabernus voveo.,670cca73e0941d56b05ee7d3,24
670cca73e0941d56b05eea5f,Sequi aggredior nobis adiuvo utrimque.,Coadunatio stillicidium traho colligo verbera porro vetus. Censura canonicus sumo sumptus cras aeternus arma. Patria vinco comptus absens similique contego vigilo.,670cca73e0941d56b05ee7a1,25
670cca73e0941d56b05eea60,Uterque vis defleo paulatim cunabula aliquid.,Eveniet teres exercitationem. Titulus cunae desolo ea speciosus comes cognomen arto. Adhaero tempora turbo verbum.,670cca73e0941d56b05ee93f,26
670cca73e0941d56b05eea61,Ago adamo bonus cibo curo tabernus.,Perferendis amicitia aiunt libero. Aduro earum caelum patruus. Sed cicuta tredecim terebro vitium vomer terminatio.,670cca73e0941d56b05ee9c9,27
670cca73e0941d56b05eea62,Vel antea amaritudo.,Accusator veritas odio sonitus amo. Aveho deinde caries via temperantia mollitia. Texo accendo tergeo cubitum desino pecto.,670cca73e0941d56b05ee85c,28
670cca73e0941d56b05eea63,Atque abundans utroque nesciunt adfero auctor aut nihil ait astrum.,Dedico crur cohibeo altus sophismata theca talio substantia versus. Tener autus confero asperiores textor. Deinde ancilla tum accusator aegrus.,670cca73e0941d56b05ee7ac,29
670cca73e0941d56b05eea64,Spes summa crux testimonium nobis doloremque.,Tondeo timor tricesimus pecco eos inflammatio. Vulnus vobis verto sint. Ustilo veritatis cetera contra cupiditas spoliatio antiquus thesaurus decor sopor.,670cca73e0941d56b05ee8ad,30
670cca73e0941d56b05eea65,Subiungo corrupti allatus cunctatio vesper abundans optio.,Porro succedo deserunt. Quasi accendo pariatur neque denuo. Derelinquo cito ullam suggero pariatur adeptio occaecati sublime.,670cca73e0941d56b05ee86a,31
670cca73e0941d56b05eea66,Corporis acervus denego surgo trepide atrox.,Benevolentia cotidie suasoria. Defetiscor solutio agnosco super videlicet suggero. Talis sufficio theca creber curtus tandem verumtamen amoveo tabula depono.,670cca73e0941d56b05ee927,32
670cca73e0941d56b05eea67,Bardus cotidie constans tyrannus infit templum assumenda.,Cubicularis vobis pecus vetus custodia amissio. Ipsum dolor deprimo delectatio tutis exercitationem voluntarius utrimque deleniti. Sursum dedecor ver.,670cca73e0941d56b05ee783,33
670cca73e0941d56b05eea68,Sursum averto utrimque minima cohors pecco.,Vilitas quasi sperno vos calculus. Caritas vicinus admoveo vehemens testimonium tamen celer degenero incidunt. Civitas tondeo comptus.,670cca73e0941d56b05ee65f,34
670cca73e0941d56b05eea69,Nostrum suspendo delicate.,Tantum tardus sollers vulgaris. Denego degusto compello tredecim. Angulus adsum decet villa admitto terga reiciendis super.,670cca73e0941d56b05ee94f,35
670cca73e0941d56b05eea6a,Carmen comitatus callide perferendis arbitro delicate theatrum animadverto vestigium dedico.,Temperantia color quod. Conitor tener sapiente. Culpa vicinus conatus.,670cca73e0941d56b05ee950,36
670cca73e0941d56b05eea6b,Suffoco saepe stipes crapula.,Perferendis terga thermae sint crastinus tersus vaco via denego adfectus. Corpus venustas subseco. Viridis ventito credo acer sequi.,670cca73e0941d56b05ee6a3,37
670cca73e0941d56b05eea6c,Vitae arx architecto.,Vitae acsi cupiditas utrimque calamitas tempus attonbitus texo. Ex tristis addo quo adeo adicio adaugeo. Amita aperte clam theologus facere condico vado vivo provident.,670cca73e0941d56b05ee688,38
670cca73e0941d56b05eea6d,Conduco admoveo defungo valens vacuus conitor.,Iste articulus asporto cito torqueo cruentus nisi dolores vesco territo. Appositus stillicidium decens beneficium summisse creta verus. Distinctio tero nulla cui ars.,670cca73e0941d56b05ee897,39
670cca73e0941d56b05eea6e,Tandem voluptas torrens curso sodalitas.,Ad vilicus dolore. Circumvenio sonitus speciosus volo sustineo umquam accedo minus. Cruciamentum tyrannus demonstro.,670cca73e0941d56b05ee698,40
670cca73e0941d56b05eea6f,Tepidus auxilium desipio termes arceo.,Contra tamen conduco vindico color sub crepusculum. Dolorum deleniti antepono voluptate stella ipsum placeat commemoro caterva ex. Averto corroboro capio sapiente vivo est ratione angulus.,670cca73e0941d56b05ee86f,41
670cca73e0941d56b05eea70,Decretum cultellus valetudo patria verbera sophismata comburo venustas hic.,Vacuus autus apud ipsa ancilla conduco sunt titulus. Arto fugiat vindico suffoco thermae voveo color. Cernuus aeger terebro venio.,670cca73e0941d56b05ee8f8,42
670cca73e0941d56b05eea71,Traho temeritas aduro atavus.,Volo sed labore est tabernus. Aliquid ut succedo tabesco animus conqueror delego voco sodalitas. Ut consectetur bardus culpa aedificium trepide.,670cca73e0941d56b05ee986,43
670cca73e0941d56b05eea72,Demitto consequatur spero alias verto.,Thorax canonicus laudantium cupio. Videlicet vomito arbitro. Talio similique vulgo trucido velum tandem tolero sono.,670cca73e0941d56b05ee6f0,44
670cca73e0941d56b05eea73,Causa thermae carmen denuncio cuius.,Carmen accusamus subnecto deleniti commodi veniam creta subnecto. Tenetur stabilis teres hic pecco vacuus. Ciminatio crebro communis tergum alias.,670cca73e0941d56b05eea2b,45
670cca73e0941d56b05eea74,Degenero vilicus mollitia pauper cenaculum suffoco.,Contego saepe baiulus at similique acquiro autem. Vos votum calculus cenaculum cubitum. Volva carpo aeger capio asperiores accusantium.,670cca73e0941d56b05ee8ac,46
670cca73e0941d56b05eea75,Aetas quisquam vester curo summa similique thymbra vomito corrigo.,Via viscus antea sordeo. Ascit carcer auctor strues cohors solum tenax alias accendo. Vulgivagus ait arto annus volaticus tumultus magnam bardus.,670cca73e0941d56b05ee9fe,47
670cca73e0941d56b05eea76,Spes asperiores tricesimus.,Vulnero comparo vulticulus conicio conor atqui taedium avarus. Stabilis totam vulgaris. Tot sono eos amoveo vitae asper textilis depulso.,670cca73e0941d56b05ee739,48
670cca73e0941d56b05eea77,Comburo adhuc sperno arbustum suppellex assumenda abduco crur.,Amaritudo contigo sopor cenaculum sono. Debitis antepono cornu volo. Turba ullam tribuo quisquam.,670cca73e0941d56b05ee986,49
670cca73e0941d56b05eea78,Demo complectus fuga depulso cometes.,Peior tergum vado vestigium cupressus adaugeo. Artificiose volup angelus conatus sollers vox. Vado sto astrum.,670cca73e0941d56b05ee97a,50
670cca73e0941d56b05eea79,Explicabo audentia creber.,Defluo aiunt cribro denego aut esse curis. Sum complectus conatus torrens subvenio abeo astrum crustulum vicissitudo. Iusto consuasor rerum beneficium a.,670cca73e0941d56b05ee889,51
670cca73e0941d56b05eea7a,Coruscus tibi arto vobis cultura armarium carcer.,Unde valens accendo abduco. Terga infit velit debeo valens stabilis. Tamisium considero adimpleo vobis.,670cca73e0941d56b05ee8ab,52
670cca73e0941d56b05eea7b,Clibanus cunabula crinis sumo ago.,Aggero at tabgo complectus stabilis cauda. Tumultus substantia videlicet atque nihil tergo despecto absorbeo. Currus appositus subvenio tum coerceo utpote defero molestiae vulariter comedo.,670cca73e0941d56b05ee77c,53
670cca73e0941d56b05eea7c,Degenero crudelis sui.,Cogito caveo caput charisma vestigium tero suscipit timor vociferor. Demoror ad textilis mollitia dedico copiose cometes abscido cubitum. Peccatus templum ustilo minus deleo aufero crastinus cogito dedico bene.,670cca73e0941d56b05ee896,54
670cca73e0941d56b05eea7d,Tricesimus cohors consequuntur ademptio tripudio vehemens hic occaecati appositus super.,Turbo tepidus aspernatur carcer benevolentia aer. Aegre totam adeo conicio. Curatio temptatio succedo thema tam vulticulus demum.,670cca73e0941d56b05ee9ce,55
670cca73e0941d56b05eea7e,Veritas totam beatae vergo tardus delinquo.,Demens pauci tabula aggero cibo tondeo vix. Conor subseco aspernatur tantillus advoco solum vos. Tendo tantum acceptus tristis dignissimos coepi collum.,670cca73e0941d56b05ee8d3,56
670cca73e0941d56b05eea7f,Adnuo acceptus acerbitas caute.,Circumvenio dens tutis creo cedo atavus eum sed aliquid aliqua. Nam sopor ipsam bestia. Temperantia neque subseco.,670cca73e0941d56b05ee6ca,57
670cca73e0941d56b05eea80,Iure blanditiis solum deleo aedificium decens verbera campana valeo.,Terror comprehendo statim baiulus. Admoveo verecundia altus audacia vitiosus incidunt curtus vestigium et xiphias. Temporibus uredo incidunt aranea sum.,670cca73e0941d56b05ee759,58
670cca73e0941d56b05eea81,Circumvenio calamitas adversus contigo commemoro condico.,Curriculum turpis canonicus alo conitor amplexus cunctatio sapiente talio. Solus ulciscor decretum strues angulus. Tamdiu carus audeo bis speciosus non teneo.,670cca73e0941d56b05ee9d0,59
670cca73e0941d56b05eea82,Tersus despecto contra optio claudeo appositus sufficio.,Avarus molestias patior constans. Solitudo blandior auditor. Vacuus vel succedo ago.,670cca73e0941d56b05ee670,60
670cca73e0941d56b05eea83,Conicio nulla censura teres sordeo eligendi vomito.,Articulus illo sublime subseco victoria taceo cruciamentum sophismata quasi tandem. Absorbeo ubi corrupti. Cito ambulo accusamus degenero alias vehemens summisse in alii.,670cca73e0941d56b05ee968,61
670cca73e0941d56b05eea84,Ater caterva statua vos desolo campana.,Pariatur conatus antea statua. Dedecor viridis succedo sonitus depopulo curriculum thalassinus. Demitto arx vinum infit.,670cca73e0941d56b05ee961,62
670cca73e0941d56b05eea85,Suscipio utrimque delectus suscipio amoveo nisi adhaero.,Blandior tamisium depromo comptus voco ulterius textor. Delinquo repellendus crur commodo degusto tricesimus audio audacia trans adhuc. Cimentarius tui trado tabgo ex caste summisse utor curto degero.,670cca73e0941d56b05eea30,63
670cca73e0941d56b05eea86,Crinis totam victoria terra.,Cognatus cribro adduco libero dolorum ciminatio. Cogito eius adeptio volva considero enim deleniti. Ter cupiditate amplus abundans similique.,670cca73e0941d56b05ee834,64
670cca73e0941d56b05eea87,Deporto capto coadunatio torrens celo accusantium alias autem.,Conor ager adstringo viriliter possimus. Quam credo sed attonbitus avarus ver admitto. Occaecati complectus deludo corpus cogo impedit sumptus deporto clam voco.,670cca73e0941d56b05ee978,65
670cca73e0941d56b05eea88,Abutor cursus expedita campana tripudio sol viridis auditor cunabula.,Sollers careo capto denego considero. Acies volaticus bardus congregatio tamen vilicus. Caelum carus odio terra carbo.,670cca73e0941d56b05ee9a5,66
670cca73e0941d56b05eea89,Calco autus socius.,Tumultus facere derideo constans demo dolore truculenter vester denique suppono. Sed tripudio bellicus. Curia suadeo arcesso ait cedo tracto eveniet tricesimus temeritas.,670cca73e0941d56b05ee8a3,67
670cca73e0941d56b05eea8a,Valens alveus decens voluptates.,Subseco tubineus turbo vel. Vulgaris appello est comedo damno statua. Volup vitium dolorum.,670cca73e0941d56b05ee7ea,68
670cca73e0941d56b05eea8b,Quos quo averto talio vero eius atque tergeo.,Commemoro aperio validus desolo sui. Apostolus urbanus spectaculum considero. Defetiscor viduo mollitia reprehenderit sollicito cito cattus adamo.,670cca73e0941d56b05ee8b6,69
670cca73e0941d56b05eea8c,Vociferor tergeo vulnus chirographum possimus in astrum.,Tam calculus artificiose conduco corona aequus sapiente clamo. Umbra comes concido illo urbanus thorax carmen canis deripio. Asperiores quod tibi aufero atque amicitia summopere.,670cca73e0941d56b05ee6da,70
670cca73e0941d56b05eea8d,Apparatus pecus occaecati aetas toties eos abundans antepono nemo toties.,Ocer corona ulciscor. Admoveo sequi statim toties earum aliqua. Voco umerus urbanus acies centum minima.,670cca73e0941d56b05ee98e,71
670cca73e0941d56b05eea8e,Cognomen tantum administratio vinco blanditiis tergeo natus carpo pauci attero.,Beatae conor triumphus theatrum suscipit curatio. Versus virtus aperte tertius culpa vilicus taedium pauci pel arto. Adulatio adhaero adficio autus saepe deporto peccatus incidunt cribro bellum.,670cca73e0941d56b05ee86c,72
670cca73e0941d56b05eea8f,Soleo infit subvenio perferendis solio ceno attero cibus tristis.,Dedecor conservo vulgus talis dapifer vociferor consequatur usque. Demo conor volva vindico dolorum. Tripudio vado demoror.,670cca73e0941d56b05ee7b9,73
670cca73e0941d56b05eea90,Arcus curis curatio.,Tenus demoror sono usus templum. Trepide debeo vitiosus vulgus studio. Tergeo alias astrum virtus textor aliquam quia provident crinis qui.,670cca73e0941d56b05ee9d1,74
670cca73e0941d56b05eea91,Delibero subiungo cursim confero colligo.,Voro decens video verbera bardus ambulo. Ventito taceo deleniti eaque administratio cerno aurum demo. Voluntarius adficio alo adversus eaque auxilium cattus utor suppellex.,670cca73e0941d56b05ee8cc,75
670cca73e0941d56b05eea92,Curso ventosus aegrus umerus audacia beneficium depulso tertius cibo circumvenio.,Aegrotatio cattus cattus usus defaeco. Bardus video dolorum victus turbo. Accendo deorsum stabilis currus vigilo acerbitas uter cinis.,670cca73e0941d56b05ee902,76
670cca73e0941d56b05eea93,Venia valeo ars crur suffoco coma aut apparatus.,Verecundia veritas tristis ducimus conculco incidunt tabella uxor. Studio atavus magnam bardus commodo. Arbitro aeneus caput vero comparo careo conturbo arbor.,670cca73e0941d56b05ee7b2,77
670cca73e0941d56b05eea94,Denique thymum aliqua consectetur uxor.,Quaerat viridis capillus. Aer nesciunt vesco toties patrocinor pecto absens id. Convoco arbor appositus aliqua substantia nam ante turba.,670cca73e0941d56b05ee67f,78
670cca73e0941d56b05eea95,Talis tergeo patior nostrum tametsi vito infit.,Comminor audacia undique suus amplus creptio earum substantia. Temperantia debilito totam vacuus territo caelum paulatim pecco. Ago ambulo cursus voluptates dolorum terreo eveniet.,670cca73e0941d56b05ee86d,79
670cca73e0941d56b05eea96,Caelestis caelum pauper suspendo celo deporto laboriosam strenuus patria.,Apud ab damnatio administratio a. Civitas addo adficio vulgaris artificiose comedo. Antea stultus pauper amiculum clibanus creptio voro succurro aegrotatio.,670cca73e0941d56b05ee776,80
670cca73e0941d56b05eea97,Arceo absorbeo hic vulgivagus.,Subseco cursim ducimus tollo vilicus depono tunc suasoria tandem. Clamo copiose tergeo. Subito tego textus curatio esse nostrum.,670cca73e0941d56b05ee9b8,81
670cca73e0941d56b05eea98,Doloremque adstringo dicta.,Amaritudo demo capio allatus distinctio civitas. Civis collum ver aperio optio abbas deputo crinis nam. Textor commemoro apostolus bellum creptio venio cruentus cogo.,670cca73e0941d56b05ee736,82
670cca73e0941d56b05eea99,Consectetur damnatio adulescens avarus alii.,Suus aurum corpus casus. Comparo defero qui umquam. Ocer sub calcar altus aequus super demulceo saepe.,670cca73e0941d56b05ee94f,83
670cca73e0941d56b05eea9a,Sonitus facilis tabernus ars atque accusator teneo.,Spoliatio aiunt itaque abeo demum consectetur sursum tracto amo. Sustineo terreo alo basium tredecim alii minus curo tactus. Tripudio tantillus vulgo autus illo super thesis sufficio.,670cca73e0941d56b05ee991,84
670cca73e0941d56b05eea9b,Crur terra curia vinum basium.,Vobis decerno uredo ab centum tredecim saepe. Unde videlicet votum conitor casus arbor. Comptus conspergo vetus sequi adfectus eos vox strues versus socius.,670cca73e0941d56b05ee6ab,85
670cca73e0941d56b05eea9c,Creber numquam teres.,Deleo villa tero cubicularis audax. Laborum credo aeger amplitudo auctor utpote voco solio vobis culpo. Teres cervus labore talis aveho quod nostrum alioqui crur sortitus.,670cca73e0941d56b05ee7f6,86
670cca73e0941d56b05eea9d,Ultra accusantium taceo.,Minus succurro minus caute adeo summa deripio tolero. Cavus cultura cetera. Desidero argumentum aestas subvenio cubitum comburo copiose aer subseco.,670cca73e0941d56b05ee88a,87
670cca73e0941d56b05eea9e,Accommodo comes solitudo praesentium sono adsum quo.,Deleo convoco studio temporibus impedit timidus aeger arca. Tamen acer creta conforto culpa. Aranea umerus commemoro beneficium nesciunt iusto aut unus.,670cca73e0941d56b05ee983,88
670cca73e0941d56b05eea9f,Cunae acer basium tergo bis placeat in caveo.,Patruus cum conduco censura autem voluntarius tutis conatus. Veritatis canonicus adeptio cura. Sonitus venio tergum provident vallum cornu suppellex.,670cca73e0941d56b05ee918,89
670cca73e0941d56b05eeaa0,Ars acidus centum patior.,At vomer aliqua ea terga. Amoveo sed suscipio volutabrum asporto summa modi testimonium id. Esse cavus aureus.,670cca73e0941d56b05ee71e,90
670cca73e0941d56b05eeaa1,Acerbitas deprecator cibus bonus culpo capto.,Denuncio ventus iste anser. Quibusdam ad velit aureus tergiversatio ultra a. Advenio cogo avarus maiores suppellex strues.,670cca73e0941d56b05ee801,91
670cca73e0941d56b05eeaa2,Civis calamitas utrimque sponte.,Arx valeo abstergo spargo taceo super. Viscus decet timidus et enim. Studio eligendi abduco exercitationem soleo.,670cca73e0941d56b05eea3b,92
670cca73e0941d56b05eeaa3,Debilito vapulus undique ascisco.,Teres tener sonitus clam caput altus ascit. Optio minima eligendi ascisco. Curatio vulariter incidunt blandior stillicidium enim absum.,670cca73e0941d56b05ee766,93
670cca73e0941d56b05eeaa4,Perferendis terra patrocinor quos reprehenderit curto laborum tametsi uxor sumptus.,Aegrotatio correptius vestigium surgo error. Strues ars cenaculum tubineus demum conor velut. Sumo coma virgo aliquid aufero suscipio desparatus culpa deinde.,670cca73e0941d56b05ee6d7,94
670cca73e0941d56b05eeaa5,Adaugeo tenuis cetera comis pecco arcesso arcus veritatis cohors.,Adeo expedita cilicium. Doloribus admiratio statua vulnus decens voluptate bibo thymbra earum. Socius voluptate tamdiu reprehenderit tredecim.,670cca73e0941d56b05ee7b8,95
670cca73e0941d56b05eeaa6,Infit spargo voco ater volubilis armarium vigilo.,Curvo somniculosus antea aspicio aggero vobis. Sordeo casus cultura. Vitae corpus virga cubicularis aequus subvenio amet cunabula suscipit.,670cca73e0941d56b05ee8e3,96
670cca73e0941d56b05eeaa7,Cultellus velum termes.,Ustilo terreo alius aufero solus eveniet tepesco statua argentum corrigo. Fugit tabgo adicio non turpis decumbo cinis deleo caritas. Vinculum decumbo baiulus cultellus sit eveniet adversus sophismata iste atavus.,670cca73e0941d56b05ee9a0,97
670cca73e0941d56b05eeaa8,Conitor tepesco comptus cunctatio adopto.,Balbus coaegresco eveniet crux audacia administratio vinco dapifer abutor. Aedificium vomica laborum defungo amor alioqui acidus repellat. Aequus tertius ullam alius ullam claro teres.,670cca73e0941d56b05ee7a8,98
670cca73e0941d56b05eeaa9,Denego quisquam contra terga suus adaugeo.,Cuppedia laudantium absum audeo cras testimonium pax theca deleniti. Audentia quasi demens abundans. Copia ducimus confugo vallum.,670cca73e0941d56b05ee72e,99
670cca73e0941d56b05eeaaa,Vita creptio velut communis consequatur adaugeo ducimus comedo vestrum.,Peior defluo curso suscipio crur accusamus terror vomito. Deorsum suffragium vis deduco urbanus volutabrum confido. Corpus peccatus eaque.,670cca73e0941d56b05ee91e,100
670cca73e0941d56b05eeaab,Asperiores aggero solitudo solvo ciminatio communis urbs vulgivagus timor canonicus.,Sint vigilo animi usitas itaque dicta considero angulus. Textilis amaritudo torqueo. Temporibus depopulo cras tempus verbera deporto atrox.,670cca73e0941d56b05ee6be,101
670cca73e0941d56b05eeaac,Usus dapifer qui volup caelestis caute.,Caterva utique quas solus aptus torqueo benevolentia. Sed conduco qui turpis supra traho capitulus delibero damno. Perspiciatis ambitus vita absum celebrer.,670cca73e0941d56b05ee965,102
670cca73e0941d56b05eeaad,Sordeo vere cariosus turba.,Autem quo contego. Una officiis desparatus arceo sto patrocinor. Beatae aegre delinquo textilis vicissitudo delinquo animadverto audax.,670cca73e0941d56b05ee6e6,103
670cca73e0941d56b05eeaae,Vesper decretum degusto cimentarius versus inflammatio delibero ustulo adinventitias.,Itaque terror libero caecus verto. Cunabula concedo nostrum terreo ex. Supplanto vitiosus adstringo optio sordeo sulum vita arma.,670cca73e0941d56b05ee73e,104
670cca73e0941d56b05eeaaf,Atavus approbo vaco pauci fuga vae certus.,Basium amplitudo cupressus curvo aegre tamdiu coniecto ea ars ducimus. Dolorem colo arca eos comburo adiuvo corrumpo soleo vesper amiculum. Vinculum conscendo tollo pecus arca avaritia.,670cca73e0941d56b05eea3b,105
