_id,userId,learningMaterialId,feedback,rating,createdAt,__v
670cca76e0941d56b05f1fb5,670cca73e0941d56b05ee57e,670cca73e0941d56b05ee8fc,Calcar desipio appositus administratio.,2,2024-10-13T13:00:43.122Z,0
670cca76e0941d56b05f1fb6,670cca73e0941d56b05ee3f2,670cca73e0941d56b05ee8d1,Vel sub vinitor dolores.,4,2024-10-14T01:18:01.808Z,0
670cca76e0941d56b05f1fb7,670cca73e0941d56b05ee524,670cca73e0941d56b05ee7f5,Aequus approbo vociferor sursum adficio admiratio sol conventus acies.,2,2024-10-14T06:12:55.243Z,0
670cca76e0941d56b05f1fb8,670cca73e0941d56b05ee5d4,670cca73e0941d56b05ee99f,Ceno creta casso ante volva arceo denuo.,2,2024-10-13T16:04:14.152Z,0
670cca76e0941d56b05f1fb9,670cca73e0941d56b05ee562,670cca73e0941d56b05ee9ab,Valeo viduo tonsor auditor ipsam patria usque vulnero reprehenderit.,2,2024-10-13T14:52:06.614Z,0
670cca76e0941d56b05f1fba,670cca73e0941d56b05ee654,670cca73e0941d56b05ee716,Adsidue defetiscor aggero utilis ascit suggero suadeo.,2,2024-10-13T22:32:40.230Z,0
670cca76e0941d56b05f1fbb,670cca73e0941d56b05ee292,670cca73e0941d56b05ee8c0,Tum viriliter decumbo nostrum depromo corrupti verecundia.,4,2024-10-14T07:07:33.713Z,0
670cca76e0941d56b05f1fbc,670cca73e0941d56b05ee45a,670cca73e0941d56b05ee9b2,Cur veritatis cotidie audacia.,3,2024-10-13T15:14:37.492Z,0
670cca76e0941d56b05f1fbd,670cca73e0941d56b05ee556,670cca73e0941d56b05ee8aa,Velit dolore vos distinctio carus temperantia umquam stipes.,2,2024-10-13T21:54:10.124Z,0
670cca76e0941d56b05f1fbe,670cca73e0941d56b05ee3cb,670cca73e0941d56b05ee966,Vitae vestrum reprehenderit sponte addo.,4,2024-10-13T08:25:28.681Z,0
670cca76e0941d56b05f1fbf,670cca73e0941d56b05ee52a,670cca73e0941d56b05eea31,Credo tutamen antiquus aliqua vulticulus adopto capillus.,2,2024-10-13T13:57:46.237Z,0
670cca76e0941d56b05f1fc0,670cca73e0941d56b05ee63d,670cca73e0941d56b05ee9ff,Tam tergiversatio conitor nostrum expedita bellicus comedo asporto asporto.,5,2024-10-13T19:34:15.663Z,0
670cca76e0941d56b05f1fc1,670cca73e0941d56b05ee3a4,670cca73e0941d56b05ee79f,Colligo via unde demo defluo ab cupio.,5,2024-10-14T06:34:45.490Z,0
670cca76e0941d56b05f1fc2,670cca73e0941d56b05ee4fb,670cca73e0941d56b05ee9e2,Repellendus careo avarus conduco tertius terminatio allatus aegrus libero.,3,2024-10-13T17:03:05.511Z,0
670cca76e0941d56b05f1fc3,670cca73e0941d56b05ee2d0,670cca73e0941d56b05ee8f9,Vulgo aer creber amplitudo videlicet verto cohors tempus aestivus pecus.,1,2024-10-13T23:12:12.971Z,0
670cca76e0941d56b05f1fc4,670cca73e0941d56b05ee517,670cca73e0941d56b05ee74a,Solutio capitulus amplitudo abbas.,5,2024-10-13T09:55:13.822Z,0
670cca76e0941d56b05f1fc5,670cca73e0941d56b05ee3a3,670cca73e0941d56b05ee9cc,Defluo conatus degusto coma conicio debilito vinitor quos vox.,4,2024-10-13T19:53:56.473Z,0
670cca76e0941d56b05f1fc6,670cca73e0941d56b05ee4b5,670cca73e0941d56b05ee7c4,Clarus acervus consequatur teres subito soleo ustilo.,2,2024-10-13T10:20:31.585Z,0
670cca76e0941d56b05f1fc7,670cca73e0941d56b05ee3e7,670cca73e0941d56b05ee90a,Saepe valde decimus campana.,2,2024-10-14T07:26:46.788Z,0
670cca76e0941d56b05f1fc8,670cca73e0941d56b05ee523,670cca73e0941d56b05ee82f,Ancilla umbra clamo.,4,2024-10-14T04:44:16.380Z,0
670cca76e0941d56b05f1fc9,670cca73e0941d56b05ee4ed,670cca73e0941d56b05ee9a4,Creber verumtamen amissio tenax dens aegre.,1,2024-10-14T05:27:29.230Z,0
670cca76e0941d56b05f1fca,670cca73e0941d56b05ee580,670cca73e0941d56b05ee8f4,Calcar textus alienus tunc ex cultellus cursus ea triumphus.,3,2024-10-13T12:02:02.536Z,0
670cca76e0941d56b05f1fcb,670cca73e0941d56b05ee560,670cca73e0941d56b05eea12,Teneo trepide utilis.,1,2024-10-14T03:55:52.036Z,0
670cca76e0941d56b05f1fcc,670cca73e0941d56b05ee65c,670cca73e0941d56b05ee9f0,Altus tutamen adeptio.,4,2024-10-13T11:32:13.018Z,0
670cca76e0941d56b05f1fcd,670cca73e0941d56b05ee568,670cca73e0941d56b05ee9f1,Thesis cervus est tamen demonstro cohibeo curatio ducimus voco cometes.,4,2024-10-13T08:26:14.414Z,0
670cca76e0941d56b05f1fce,670cca73e0941d56b05ee5e1,670cca73e0941d56b05ee70f,Ancilla volutabrum charisma.,5,2024-10-13T18:02:15.381Z,0
670cca76e0941d56b05f1fcf,670cca73e0941d56b05ee50b,670cca73e0941d56b05ee7da,Amita delicate vulariter depono tunc.,1,2024-10-14T02:14:47.088Z,0
670cca76e0941d56b05f1fd0,670cca73e0941d56b05ee27b,670cca73e0941d56b05ee793,Totam confugo vitium adduco animi coniuratio teres repellat venio inflammatio.,1,2024-10-14T06:55:43.899Z,0
670cca76e0941d56b05f1fd1,670cca73e0941d56b05ee391,670cca73e0941d56b05ee95f,Adicio valens adflicto tergeo aggero argumentum facilis vulgaris ater.,3,2024-10-13T08:09:36.680Z,0
670cca76e0941d56b05f1fd2,670cca73e0941d56b05ee529,670cca73e0941d56b05ee81a,Trepide vorax stipes explicabo conatus accendo verbum adaugeo ratione caput.,1,2024-10-13T13:15:05.174Z,0
670cca76e0941d56b05f1fd3,670cca73e0941d56b05ee41f,670cca73e0941d56b05eea3a,Dapifer cubo thorax commodi succurro torrens nisi aegrus benigne.,3,2024-10-13T14:00:11.898Z,0
670cca76e0941d56b05f1fd4,670cca73e0941d56b05ee319,670cca73e0941d56b05ee725,Decerno vigilo spoliatio bestia canto aut similique territo.,5,2024-10-13T17:24:47.067Z,0
670cca76e0941d56b05f1fd5,670cca73e0941d56b05ee326,670cca73e0941d56b05ee83c,Conforto totam curvo tabgo comitatus curatio adulatio.,1,2024-10-14T00:06:45.415Z,0
670cca76e0941d56b05f1fd6,670cca73e0941d56b05ee607,670cca73e0941d56b05ee8c9,Vorax voveo maxime.,2,2024-10-14T02:16:05.953Z,0
670cca76e0941d56b05f1fd7,670cca73e0941d56b05ee46d,670cca73e0941d56b05ee6c3,Agnitio termes facilis cado amplexus.,4,2024-10-13T12:11:21.469Z,0
670cca76e0941d56b05f1fd8,670cca73e0941d56b05ee63c,670cca73e0941d56b05ee7f4,Aqua delectus amoveo vulnus cursim celebrer tempore.,4,2024-10-13T20:05:55.606Z,0
670cca76e0941d56b05f1fd9,670cca73e0941d56b05ee4c5,670cca73e0941d56b05eea01,Cultellus depromo ver tutis.,2,2024-10-14T05:23:22.857Z,0
670cca76e0941d56b05f1fda,670cca73e0941d56b05ee5b1,670cca73e0941d56b05ee975,Repudiandae veritas tardus cado vester curia aestas solvo volutabrum.,5,2024-10-13T19:11:46.372Z,0
670cca76e0941d56b05f1fdb,670cca73e0941d56b05ee4b2,670cca73e0941d56b05ee7ed,Denuncio ipsa delectatio aeger tempore atqui fugit.,1,2024-10-14T04:36:16.727Z,0
670cca76e0941d56b05f1fdc,670cca73e0941d56b05ee558,670cca73e0941d56b05ee885,Reprehenderit convoco coadunatio vicissitudo congregatio comminor tamquam.,1,2024-10-13T21:59:36.855Z,0
670cca76e0941d56b05f1fdd,670cca73e0941d56b05ee299,670cca73e0941d56b05ee94b,Arma thema verbera triduana tertius amplexus administratio.,3,2024-10-13T21:49:11.413Z,0
670cca76e0941d56b05f1fde,670cca73e0941d56b05ee581,670cca73e0941d56b05ee71a,Tego caelum admoveo bibo video.,5,2024-10-13T14:32:55.616Z,0
670cca76e0941d56b05f1fdf,670cca73e0941d56b05ee2d4,670cca73e0941d56b05ee83c,Beatae usus tutis.,5,2024-10-14T04:56:34.908Z,0
670cca76e0941d56b05f1fe0,670cca73e0941d56b05ee45b,670cca73e0941d56b05ee854,Delectatio auxilium deludo.,1,2024-10-13T08:51:41.962Z,0
670cca76e0941d56b05f1fe1,670cca73e0941d56b05ee413,670cca73e0941d56b05ee94b,Subvenio correptius aspicio.,2,2024-10-13T08:44:20.424Z,0
670cca76e0941d56b05f1fe2,670cca73e0941d56b05ee43f,670cca73e0941d56b05ee72e,A vulgus tero.,4,2024-10-14T02:28:05.839Z,0
670cca76e0941d56b05f1fe3,670cca73e0941d56b05ee621,670cca73e0941d56b05ee6c1,Vulgus denuncio video coniecto cura nam creber.,1,2024-10-13T11:20:54.017Z,0
670cca76e0941d56b05f1fe4,670cca73e0941d56b05ee2b5,670cca73e0941d56b05ee7ee,Voluptates acies unus facilis earum collum incidunt sequi spargo coadunatio.,3,2024-10-13T09:54:41.175Z,0
670cca76e0941d56b05f1fe5,670cca73e0941d56b05ee470,670cca73e0941d56b05ee9f8,Bonus surculus eligendi.,4,2024-10-13T23:22:55.096Z,0
670cca76e0941d56b05f1fe6,670cca73e0941d56b05ee357,670cca73e0941d56b05ee7b3,Adaugeo ratione callide summa.,4,2024-10-13T10:32:51.108Z,0
670cca76e0941d56b05f1fe7,670cca73e0941d56b05ee485,670cca73e0941d56b05ee872,Abduco trucido conventus capitulus quaerat crepusculum vergo.,5,2024-10-13T12:30:05.270Z,0
670cca76e0941d56b05f1fe8,670cca73e0941d56b05ee2c9,670cca73e0941d56b05ee7a2,Stillicidium adficio umbra est stella laborum.,3,2024-10-14T01:15:29.464Z,0
670cca76e0941d56b05f1fe9,670cca73e0941d56b05ee3b1,670cca73e0941d56b05ee8f8,Aetas caste ubi compello dicta versus alter expedita strues.,1,2024-10-13T18:51:36.579Z,0
670cca76e0941d56b05f1fea,670cca73e0941d56b05ee584,670cca73e0941d56b05ee6a5,Non suscipit cruciamentum.,3,2024-10-14T06:29:29.480Z,0
670cca76e0941d56b05f1feb,670cca73e0941d56b05ee55f,670cca73e0941d56b05ee7ca,Chirographum clamo minima.,3,2024-10-14T00:35:56.424Z,0
670cca76e0941d56b05f1fec,670cca73e0941d56b05ee397,670cca73e0941d56b05ee86d,Dolor coadunatio demens undique spargo.,2,2024-10-14T01:46:47.061Z,0
670cca76e0941d56b05f1fed,670cca73e0941d56b05ee424,670cca73e0941d56b05ee8d4,Autus sponte centum sordeo laudantium autus capitulus demoror cibo artificiose.,4,2024-10-14T06:12:33.601Z,0
670cca76e0941d56b05f1fee,670cca73e0941d56b05ee654,670cca73e0941d56b05ee76e,Tabernus optio strues molestias.,5,2024-10-13T15:00:24.925Z,0
670cca76e0941d56b05f1fef,670cca73e0941d56b05ee33e,670cca73e0941d56b05ee7e6,Sublime supplanto bis tui utilis curiositas aestas vitiosus totidem.,1,2024-10-14T06:43:02.943Z,0
670cca76e0941d56b05f1ff0,670cca73e0941d56b05ee3fe,670cca73e0941d56b05ee858,Damno acies sonitus.,1,2024-10-13T20:36:24.050Z,0
670cca76e0941d56b05f1ff1,670cca73e0941d56b05ee622,670cca73e0941d56b05ee850,Canis texo enim carbo artificiose cursus.,5,2024-10-14T06:40:08.729Z,0
670cca76e0941d56b05f1ff2,670cca73e0941d56b05ee4df,670cca73e0941d56b05ee9d8,Vita aer appono adsum defendo eaque calculus contabesco.,2,2024-10-13T21:50:52.409Z,0
670cca76e0941d56b05f1ff3,670cca73e0941d56b05ee49e,670cca73e0941d56b05ee8a4,Cui abduco tumultus vacuus amet cultura.,4,2024-10-14T04:18:22.616Z,0
670cca76e0941d56b05f1ff4,670cca73e0941d56b05ee47c,670cca73e0941d56b05ee97d,Coniecto voluptatum deludo uredo cresco ab statim alius.,3,2024-10-13T20:29:25.146Z,0
670cca76e0941d56b05f1ff5,670cca73e0941d56b05ee52b,670cca73e0941d56b05eea04,Strues contego suffoco utpote vir succedo celo.,4,2024-10-14T07:20:56.965Z,0
670cca76e0941d56b05f1ff6,670cca73e0941d56b05ee48e,670cca73e0941d56b05ee6c3,Demoror amita vester beatae ciminatio.,5,2024-10-13T15:03:08.668Z,0
670cca76e0941d56b05f1ff7,670cca73e0941d56b05ee62c,670cca73e0941d56b05eea40,Cumque neque suffragium aggredior consequatur.,4,2024-10-13T12:10:27.355Z,0
670cca76e0941d56b05f1ff8,670cca73e0941d56b05ee33d,670cca73e0941d56b05ee7d3,Subseco debilito suffoco statua.,5,2024-10-14T05:20:35.528Z,0
670cca76e0941d56b05f1ff9,670cca73e0941d56b05ee5d7,670cca73e0941d56b05ee72f,Cupiditas bos vestigium sponte vespillo tollo cenaculum color.,2,2024-10-13T16:53:11.063Z,0
670cca76e0941d56b05f1ffa,670cca73e0941d56b05ee506,670cca73e0941d56b05ee95f,Approbo antea arx succedo veniam conatus tempus coepi.,1,2024-10-14T00:57:25.728Z,0
670cca76e0941d56b05f1ffb,670cca73e0941d56b05ee4c3,670cca73e0941d56b05ee9a5,Accedo sperno valeo tempore sit.,4,2024-10-14T00:47:27.798Z,0
670cca76e0941d56b05f1ffc,670cca73e0941d56b05ee2bf,670cca73e0941d56b05ee855,Adiuvo uberrime aveho surgo comminor commodo adsum viridis.,3,2024-10-13T19:35:55.785Z,0
670cca76e0941d56b05f1ffd,670cca73e0941d56b05ee5fd,670cca73e0941d56b05ee903,Voveo victus vetus comptus virgo.,1,2024-10-14T03:49:13.480Z,0
670cca76e0941d56b05f1ffe,670cca73e0941d56b05ee641,670cca73e0941d56b05ee9c0,Surculus alienus stips speculum suppono.,3,2024-10-13T13:29:41.403Z,0
670cca76e0941d56b05f1fff,670cca73e0941d56b05ee297,670cca73e0941d56b05ee6d6,Uter audentia arma cauda accusamus.,2,2024-10-14T04:41:18.433Z,0
670cca76e0941d56b05f2000,670cca73e0941d56b05ee2b4,670cca73e0941d56b05ee9bb,Inventore ver desipio valetudo vulgo alias cur arcus.,3,2024-10-13T13:09:43.731Z,0
670cca76e0941d56b05f2001,670cca73e0941d56b05ee35a,670cca73e0941d56b05eea0f,Caput calamitas sophismata crudelis desidero terga.,1,2024-10-13T11:01:05.299Z,0
670cca76e0941d56b05f2002,670cca73e0941d56b05ee37d,670cca73e0941d56b05ee70e,Tubineus aestas beatus ambulo clementia corroboro viscus super spiculum.,5,2024-10-14T02:13:43.559Z,0
670cca76e0941d56b05f2003,670cca73e0941d56b05ee3b8,670cca73e0941d56b05ee9c0,Strenuus dolore statua vilitas arguo reiciendis adfero utroque coaegresco.,1,2024-10-13T23:52:00.912Z,0
670cca76e0941d56b05f2004,670cca73e0941d56b05ee63f,670cca73e0941d56b05ee80a,Cruciamentum tenax spectaculum canonicus pel vulgivagus decumbo bellicus speculum.,3,2024-10-14T00:46:48.113Z,0
670cca76e0941d56b05f2005,670cca73e0941d56b05ee5d9,670cca73e0941d56b05ee9e4,Amita attollo copiose clarus utor aufero ter.,1,2024-10-13T22:48:27.573Z,0
670cca76e0941d56b05f2006,670cca73e0941d56b05ee5c0,670cca73e0941d56b05ee810,Quia accedo soleo bardus tunc.,5,2024-10-13T10:46:26.211Z,0
670cca76e0941d56b05f2007,670cca73e0941d56b05ee51c,670cca73e0941d56b05ee6b6,Omnis certe beatus defleo nulla vergo debeo sodalitas.,5,2024-10-13T16:55:44.674Z,0
670cca76e0941d56b05f2008,670cca73e0941d56b05ee3b9,670cca73e0941d56b05ee6d0,Apostolus decimus demoror careo tabernus validus uberrime.,3,2024-10-13T22:36:45.037Z,0
670cca76e0941d56b05f2009,670cca73e0941d56b05ee52e,670cca73e0941d56b05ee7b0,Ademptio ciminatio volup demonstro triumphus territo universe a curis.,2,2024-10-13T14:31:33.972Z,0
670cca76e0941d56b05f200a,670cca73e0941d56b05ee467,670cca73e0941d56b05eea04,Angustus cedo tero.,5,2024-10-14T05:01:23.671Z,0
670cca76e0941d56b05f200b,670cca73e0941d56b05ee5bb,670cca73e0941d56b05ee896,Beatae ademptio consectetur deporto cupiditas.,4,2024-10-14T02:30:17.771Z,0
670cca76e0941d56b05f200c,670cca73e0941d56b05ee575,670cca73e0941d56b05ee8c5,Supra corrumpo calamitas aeger aranea crapula ad aequitas vorax.,2,2024-10-13T19:01:15.197Z,0
670cca76e0941d56b05f200d,670cca73e0941d56b05ee2f5,670cca73e0941d56b05ee692,Desidero triumphus advoco aperiam custodia dolorum vitae subseco.,5,2024-10-14T06:09:28.746Z,0
670cca76e0941d56b05f200e,670cca73e0941d56b05ee308,670cca73e0941d56b05ee84c,Uxor strues deserunt crudelis caelestis.,5,2024-10-13T16:24:51.787Z,0
670cca76e0941d56b05f200f,670cca73e0941d56b05ee51a,670cca73e0941d56b05ee9d1,Tergeo dignissimos aperio itaque tergum.,1,2024-10-13T16:21:07.082Z,0
670cca76e0941d56b05f2010,670cca73e0941d56b05ee29f,670cca73e0941d56b05eea3f,Vesica talus averto.,5,2024-10-14T00:06:20.766Z,0
670cca76e0941d56b05f2011,670cca73e0941d56b05ee381,670cca73e0941d56b05ee6ab,Tribuo arca tenuis comis comitatus confero tactus abscido.,2,2024-10-13T12:35:28.424Z,0
670cca76e0941d56b05f2012,670cca73e0941d56b05ee2ac,670cca73e0941d56b05ee756,Temperantia comburo solvo conor.,3,2024-10-13T18:54:34.546Z,0
670cca76e0941d56b05f2013,670cca73e0941d56b05ee352,670cca73e0941d56b05ee946,Solitudo beatus caecus utrimque.,3,2024-10-13T18:53:18.719Z,0
670cca76e0941d56b05f2014,670cca73e0941d56b05ee395,670cca73e0941d56b05ee6c2,Cilicium comptus conor verto velit.,4,2024-10-13T07:57:16.258Z,0
670cca76e0941d56b05f2015,670cca73e0941d56b05ee46e,670cca73e0941d56b05eea2f,Coepi tum esse cicuta delibero eos ea quos aegrus delectus.,2,2024-10-13T10:42:47.299Z,0
670cca76e0941d56b05f2016,670cca73e0941d56b05ee404,670cca73e0941d56b05ee909,Complectus curto curia aliqua utroque tenax.,2,2024-10-13T08:02:12.610Z,0
670cca76e0941d56b05f2017,670cca73e0941d56b05ee29d,670cca73e0941d56b05ee91b,Tumultus attonbitus spectaculum uter curtus tubineus tergeo.,5,2024-10-13T12:00:16.565Z,0
670cca76e0941d56b05f2018,670cca73e0941d56b05ee3f2,670cca73e0941d56b05ee9cb,Taceo ancilla ambulo ventito.,3,2024-10-13T21:40:39.851Z,0
670cca76e0941d56b05f2019,670cca73e0941d56b05ee644,670cca73e0941d56b05ee771,Contra minima vestrum uberrime sit clam cenaculum nulla.,3,2024-10-13T12:27:02.385Z,0
670cca76e0941d56b05f201a,670cca73e0941d56b05ee56d,670cca73e0941d56b05ee7f8,Venia vesper catena sollers anser.,5,2024-10-13T19:10:02.255Z,0
670cca76e0941d56b05f201b,670cca73e0941d56b05ee539,670cca73e0941d56b05ee8ab,Verbum vulticulus repellendus commodo patruus amet conscendo solus desino terreo.,1,2024-10-13T23:38:46.697Z,0
670cca76e0941d56b05f201c,670cca73e0941d56b05ee37a,670cca73e0941d56b05ee9b5,Cernuus cotidie tempora amoveo ciminatio dignissimos.,3,2024-10-13T09:32:32.674Z,0
670cca76e0941d56b05f201d,670cca73e0941d56b05ee31f,670cca73e0941d56b05ee9d8,Tempora canto socius calculus videlicet suscipit ventus astrum.,2,2024-10-13T08:39:55.108Z,0
670cca76e0941d56b05f201e,670cca73e0941d56b05ee2a7,670cca73e0941d56b05ee7f1,Cursim cena incidunt eum.,1,2024-10-13T12:09:00.678Z,0
670cca76e0941d56b05f201f,670cca73e0941d56b05ee462,670cca73e0941d56b05ee821,Campana enim clamo viscus aiunt amplus deduco maiores.,5,2024-10-13T12:22:47.955Z,0
670cca76e0941d56b05f2020,670cca73e0941d56b05ee36d,670cca73e0941d56b05ee68b,Spargo abscido officiis.,2,2024-10-14T07:31:21.126Z,0
670cca76e0941d56b05f2021,670cca73e0941d56b05ee5f2,670cca73e0941d56b05ee8ec,Voluptatum auxilium alias theatrum quos trepide cognatus.,1,2024-10-13T08:11:49.747Z,0
670cca76e0941d56b05f2022,670cca73e0941d56b05ee296,670cca73e0941d56b05ee763,Contra contigo adnuo.,1,2024-10-14T07:36:32.571Z,0
670cca76e0941d56b05f2023,670cca73e0941d56b05ee3b7,670cca73e0941d56b05ee9f2,Colligo adeptio canonicus cibus ater velociter volo.,4,2024-10-14T03:22:54.686Z,0
670cca76e0941d56b05f2024,670cca73e0941d56b05ee595,670cca73e0941d56b05ee712,Somniculosus vel infit alter atque.,2,2024-10-13T22:02:14.762Z,0
670cca76e0941d56b05f2025,670cca73e0941d56b05ee4cc,670cca73e0941d56b05ee6f4,Apud coepi tyrannus corpus.,2,2024-10-14T07:14:49.420Z,0
670cca76e0941d56b05f2026,670cca73e0941d56b05ee598,670cca73e0941d56b05ee6f2,Cohors velum amplus tego vaco stillicidium attollo venia.,5,2024-10-13T23:17:51.735Z,0
670cca76e0941d56b05f2027,670cca73e0941d56b05ee494,670cca73e0941d56b05eea39,Tamdiu argentum corporis umquam minima vero tristis.,3,2024-10-13T07:56:59.193Z,0
670cca76e0941d56b05f2028,670cca73e0941d56b05ee4c0,670cca73e0941d56b05ee8a8,Absque amissio benevolentia unde bardus.,1,2024-10-14T06:20:52.274Z,0
670cca76e0941d56b05f2029,670cca73e0941d56b05ee4aa,670cca73e0941d56b05ee70d,Cavus deprecator cimentarius defendo cupio hic apto vorax accusamus.,3,2024-10-13T12:53:02.897Z,0
670cca76e0941d56b05f202a,670cca73e0941d56b05ee2fe,670cca73e0941d56b05ee76e,Aperio cenaculum baiulus.,4,2024-10-14T03:42:24.337Z,0
670cca76e0941d56b05f202b,670cca73e0941d56b05ee4ab,670cca73e0941d56b05eea36,Apto audeo cotidie suscipit decimus decumbo.,3,2024-10-13T16:34:23.368Z,0
670cca76e0941d56b05f202c,670cca73e0941d56b05ee295,670cca73e0941d56b05ee689,Delectatio sub rem thesis non ipsa.,5,2024-10-13T19:04:00.014Z,0
670cca76e0941d56b05f202d,670cca73e0941d56b05ee314,670cca73e0941d56b05ee741,Cinis torqueo facere caute credo.,2,2024-10-13T22:27:11.381Z,0
670cca76e0941d56b05f202e,670cca73e0941d56b05ee34e,670cca73e0941d56b05ee756,Tamisium velum vociferor.,2,2024-10-13T17:36:41.927Z,0
670cca76e0941d56b05f202f,670cca73e0941d56b05ee561,670cca73e0941d56b05ee78e,Corrupti sui magni id dolor facilis minus triduana atqui et.,5,2024-10-13T17:32:50.457Z,0
670cca76e0941d56b05f2030,670cca73e0941d56b05ee5e4,670cca73e0941d56b05ee827,Conturbo cohors facere.,2,2024-10-13T20:05:00.888Z,0
670cca76e0941d56b05f2031,670cca73e0941d56b05ee578,670cca73e0941d56b05ee6c4,Terreo cunabula saepe non torrens vorago aqua veritatis vulgus.,3,2024-10-14T05:44:45.149Z,0
670cca76e0941d56b05f2032,670cca73e0941d56b05ee45c,670cca73e0941d56b05ee78b,Via dolorem subnecto coniecto cometes tunc.,3,2024-10-13T23:31:07.212Z,0
670cca76e0941d56b05f2033,670cca73e0941d56b05ee4b1,670cca73e0941d56b05ee9b1,Ciminatio verto campana.,5,2024-10-14T03:35:48.407Z,0
670cca76e0941d56b05f2034,670cca73e0941d56b05ee65b,670cca73e0941d56b05ee741,Tamen accusantium conturbo.,5,2024-10-13T14:40:44.975Z,0
670cca76e0941d56b05f2035,670cca73e0941d56b05ee329,670cca73e0941d56b05ee7a2,Verto tego talus voluptas ter confido cernuus.,5,2024-10-13T13:00:00.081Z,0
670cca76e0941d56b05f2036,670cca73e0941d56b05ee615,670cca73e0941d56b05ee760,Beneficium nemo defleo ustilo cunctatio sufficio tondeo asper.,5,2024-10-13T19:06:50.010Z,0
670cca76e0941d56b05f2037,670cca73e0941d56b05ee5e4,670cca73e0941d56b05eea3f,Vero tamen suscipit ipsa sollicito damno absconditus earum tepesco.,5,2024-10-13T23:10:41.909Z,0
670cca76e0941d56b05f2038,670cca73e0941d56b05ee52d,670cca73e0941d56b05ee9ae,Cognomen absorbeo assumenda adipisci utique.,5,2024-10-13T10:59:07.756Z,0
670cca76e0941d56b05f2039,670cca73e0941d56b05ee4b7,670cca73e0941d56b05eea07,Tot arx vado eius.,1,2024-10-13T08:23:39.151Z,0
670cca76e0941d56b05f203a,670cca73e0941d56b05ee52d,670cca73e0941d56b05ee752,Abeo cohaero amoveo atque audio.,2,2024-10-13T10:29:45.620Z,0
670cca76e0941d56b05f203b,670cca73e0941d56b05ee2b8,670cca73e0941d56b05ee843,Comis veritatis cito adeptio appono.,5,2024-10-14T03:26:04.340Z,0
670cca76e0941d56b05f203c,670cca73e0941d56b05ee562,670cca73e0941d56b05ee96f,Depono tantum repellat vesica impedit.,2,2024-10-13T19:15:44.364Z,0
670cca76e0941d56b05f203d,670cca73e0941d56b05ee375,670cca73e0941d56b05ee98f,Vulariter cursus vestigium deinde tergum iste sustineo.,3,2024-10-13T18:36:03.118Z,0
670cca76e0941d56b05f203e,670cca73e0941d56b05ee279,670cca73e0941d56b05ee6b7,Tabella temporibus centum arbitro desparatus.,5,2024-10-14T02:53:53.877Z,0
670cca76e0941d56b05f203f,670cca73e0941d56b05ee3ac,670cca73e0941d56b05eea18,Peior optio voluptatum utique.,5,2024-10-14T00:21:46.908Z,0
670cca76e0941d56b05f2040,670cca73e0941d56b05ee5b0,670cca73e0941d56b05ee897,Tot virgo consuasor vulnus basium auxilium.,4,2024-10-13T23:13:26.938Z,0
670cca76e0941d56b05f2041,670cca73e0941d56b05ee2b0,670cca73e0941d56b05ee87d,Cinis cornu aestas.,2,2024-10-14T05:51:02.988Z,0
670cca76e0941d56b05f2042,670cca73e0941d56b05ee435,670cca73e0941d56b05ee9f6,Vociferor abscido terra tenetur.,2,2024-10-13T17:34:48.598Z,0
670cca76e0941d56b05f2043,670cca73e0941d56b05ee4e5,670cca73e0941d56b05ee8df,Versus claro conturbo arguo.,5,2024-10-13T17:17:17.994Z,0
670cca76e0941d56b05f2044,670cca73e0941d56b05ee2d6,670cca73e0941d56b05ee771,Repellat alter subnecto audeo soluta decretum acer tardus.,3,2024-10-13T15:54:18.344Z,0
670cca76e0941d56b05f2045,670cca73e0941d56b05ee5e6,670cca73e0941d56b05ee722,Decipio barba paulatim tergo.,2,2024-10-13T23:58:09.070Z,0
670cca76e0941d56b05f2046,670cca73e0941d56b05ee63e,670cca73e0941d56b05ee855,Spectaculum vere veritas adimpleo amiculum soleo coadunatio qui aveho sed.,4,2024-10-14T07:11:14.400Z,0
670cca76e0941d56b05f2047,670cca73e0941d56b05ee3a6,670cca73e0941d56b05ee70d,Esse absque turbo.,4,2024-10-13T19:18:26.121Z,0
670cca76e0941d56b05f2048,670cca73e0941d56b05ee5f0,670cca73e0941d56b05eea11,Tutis valens ipsam amicitia tempore bestia titulus sublime.,1,2024-10-13T17:44:56.620Z,0
670cca76e0941d56b05f2049,670cca73e0941d56b05ee5b8,670cca73e0941d56b05ee8ba,Attonbitus tredecim sono vero vulgo quibusdam complectus.,4,2024-10-13T22:04:44.640Z,0
670cca76e0941d56b05f204a,670cca73e0941d56b05ee430,670cca73e0941d56b05ee9cf,Brevis comptus suffoco demo.,1,2024-10-14T01:44:30.259Z,0
670cca76e0941d56b05f204b,670cca73e0941d56b05ee2c8,670cca73e0941d56b05ee89e,Colligo conservo traho alienus ipsum ascisco.,1,2024-10-13T14:05:21.182Z,0
670cca76e0941d56b05f204c,670cca73e0941d56b05ee49e,670cca73e0941d56b05ee974,Dolorem validus vae curriculum viridis.,5,2024-10-13T11:15:25.593Z,0
670cca76e0941d56b05f204d,670cca73e0941d56b05ee592,670cca73e0941d56b05ee6bf,Socius dedico caveo vilis blanditiis cubicularis.,5,2024-10-13T09:15:42.157Z,0
670cca76e0941d56b05f204e,670cca73e0941d56b05ee3f2,670cca73e0941d56b05eea14,Animi temperantia vicissitudo earum.,3,2024-10-13T11:40:09.120Z,0
670cca76e0941d56b05f204f,670cca73e0941d56b05ee555,670cca73e0941d56b05ee915,Vigor atrocitas veritatis cunabula trucido vulgivagus corpus aestus.,3,2024-10-13T15:33:02.755Z,0
670cca76e0941d56b05f2050,670cca73e0941d56b05ee3d3,670cca73e0941d56b05ee82d,Adinventitias pauper perferendis valde curatio tabesco teneo.,2,2024-10-14T01:26:46.588Z,0
670cca76e0941d56b05f2051,670cca73e0941d56b05ee2b9,670cca73e0941d56b05ee724,Deprecator denuo atrox.,5,2024-10-14T02:07:50.699Z,0
670cca76e0941d56b05f2052,670cca73e0941d56b05ee2c1,670cca73e0941d56b05ee9bb,Sol illo sol arcus decor.,2,2024-10-13T18:58:10.662Z,0
670cca76e0941d56b05f2053,670cca73e0941d56b05ee4b1,670cca73e0941d56b05ee922,Cohibeo arx desparatus texo subvenio tactus.,4,2024-10-13T21:22:44.619Z,0
670cca76e0941d56b05f2054,670cca73e0941d56b05ee353,670cca73e0941d56b05ee97b,Candidus communis amitto.,3,2024-10-13T14:11:18.806Z,0
670cca76e0941d56b05f2055,670cca73e0941d56b05ee5af,670cca73e0941d56b05ee6f8,Sed tendo saepe via vestigium dignissimos suadeo.,5,2024-10-13T20:33:55.374Z,0
670cca76e0941d56b05f2056,670cca73e0941d56b05ee353,670cca73e0941d56b05ee972,Venio coerceo attollo attonbitus curriculum vesper dignissimos quas canis.,4,2024-10-13T19:53:01.490Z,0
670cca76e0941d56b05f2057,670cca73e0941d56b05ee2ee,670cca73e0941d56b05ee8fa,Auctor defluo tabgo.,5,2024-10-13T08:46:07.628Z,0
670cca76e0941d56b05f2058,670cca73e0941d56b05ee53f,670cca73e0941d56b05ee92b,Alo deporto adipisci summisse cerno arto cetera.,1,2024-10-13T20:46:38.789Z,0
670cca76e0941d56b05f2059,670cca73e0941d56b05ee337,670cca73e0941d56b05ee704,Ad terebro universe speciosus ater amet desidero totam custodia.,1,2024-10-13T19:57:52.193Z,0
670cca76e0941d56b05f205a,670cca73e0941d56b05ee502,670cca73e0941d56b05ee7cd,A sortitus volaticus corporis.,2,2024-10-13T14:19:23.539Z,0
670cca76e0941d56b05f205b,670cca73e0941d56b05ee3ae,670cca73e0941d56b05ee99c,Quas degusto condico sufficio culpo varius totidem cresco quae.,4,2024-10-13T11:58:15.602Z,0
670cca76e0941d56b05f205c,670cca73e0941d56b05ee279,670cca73e0941d56b05ee94a,Altus tardus utrum nobis sequi thesis altus.,1,2024-10-14T01:59:49.034Z,0
670cca76e0941d56b05f205d,670cca73e0941d56b05ee3b0,670cca73e0941d56b05ee6ff,Asper minus adipisci venustas.,4,2024-10-14T03:09:25.921Z,0
670cca76e0941d56b05f205e,670cca73e0941d56b05ee4b0,670cca73e0941d56b05ee7d5,Adficio demonstro coepi coniuratio quaerat.,5,2024-10-13T17:47:57.321Z,0
670cca76e0941d56b05f205f,670cca73e0941d56b05ee61b,670cca73e0941d56b05ee84c,Asperiores perspiciatis sumptus amplus cognomen vindico inflammatio tertius celebrer.,4,2024-10-14T05:18:29.745Z,0
670cca76e0941d56b05f2060,670cca73e0941d56b05ee54f,670cca73e0941d56b05ee9c6,Creator corrumpo credo.,1,2024-10-13T17:17:58.588Z,0
