_id,userId,learningMaterialId,feedback,rating,createdAt,__v
670cca76e0941d56b05f1d15,670cca73e0941d56b05ee499,670cca73e0941d56b05eea40,Desino arto supplanto advoco urbs colo harum rerum.,4,2024-10-13T17:42:04.199Z,0
670cca76e0941d56b05f1d16,670cca73e0941d56b05ee4d7,670cca73e0941d56b05ee68a,Arbor delectatio arbor avaritia umbra tactus.,4,2024-10-14T00:52:16.400Z,0
670cca76e0941d56b05f1d17,670cca73e0941d56b05ee29e,670cca73e0941d56b05ee887,Admitto impedit cohibeo thema caput.,4,2024-10-14T03:05:53.960Z,0
670cca76e0941d56b05f1d18,670cca73e0941d56b05ee3ff,670cca73e0941d56b05ee9c0,Cuius ut ventus sui cibus uter aureus angelus.,3,2024-10-13T10:13:08.660Z,0
670cca76e0941d56b05f1d19,670cca73e0941d56b05ee5d0,670cca73e0941d56b05ee96f,Confero suus minima fugit currus capio.,2,2024-10-13T08:01:50.616Z,0
670cca76e0941d56b05f1d1a,670cca73e0941d56b05ee63e,670cca73e0941d56b05ee787,Sopor temperantia ratione theatrum nihil somniculosus.,4,2024-10-13T17:53:23.241Z,0
670cca76e0941d56b05f1d1b,670cca73e0941d56b05ee3a3,670cca73e0941d56b05ee8fc,Votum sapiente adhaero.,3,2024-10-13T14:27:32.433Z,0
670cca76e0941d56b05f1d1c,670cca73e0941d56b05ee65d,670cca73e0941d56b05ee7ec,Depopulo vita apto aetas canonicus arbustum bonus denique terror in.,1,2024-10-14T07:28:12.791Z,0
670cca76e0941d56b05f1d1d,670cca73e0941d56b05ee4fa,670cca73e0941d56b05eea20,Velit cohibeo tempore ater alo videlicet thema teneo.,4,2024-10-13T15:09:29.136Z,0
670cca76e0941d56b05f1d1e,670cca73e0941d56b05ee293,670cca73e0941d56b05ee6f0,Cenaculum absum verumtamen tergum tardus voluntarius.,3,2024-10-13T11:46:54.128Z,0
670cca76e0941d56b05f1d1f,670cca73e0941d56b05ee60d,670cca73e0941d56b05ee6ab,Quasi caelestis molestiae caput vero cognomen volaticus eveniet conventus.,1,2024-10-13T14:14:15.068Z,0
670cca76e0941d56b05f1d20,670cca73e0941d56b05ee4c7,670cca73e0941d56b05ee885,Torrens stipes cuppedia volup villa turbo sulum aeger ambitus traho.,2,2024-10-14T02:25:27.692Z,0
670cca76e0941d56b05f1d21,670cca73e0941d56b05ee4f0,670cca73e0941d56b05ee952,Calculus cupio synagoga addo conculco admoneo valde excepturi provident.,2,2024-10-13T09:16:02.199Z,0
670cca76e0941d56b05f1d22,670cca73e0941d56b05ee608,670cca73e0941d56b05ee754,Spectaculum voluptas aufero deleo utilis auditor.,5,2024-10-13T13:17:16.260Z,0
670cca76e0941d56b05f1d23,670cca73e0941d56b05ee5eb,670cca73e0941d56b05eea2e,Despecto sortitus iste.,5,2024-10-13T08:06:17.735Z,0
670cca76e0941d56b05f1d24,670cca73e0941d56b05ee2c6,670cca73e0941d56b05ee750,Placeat tergeo comptus desidero totam velum.,3,2024-10-13T13:35:29.347Z,0
670cca76e0941d56b05f1d25,670cca73e0941d56b05ee516,670cca73e0941d56b05ee7b9,Deprimo amoveo sponte celer adsum statim nam theatrum mollitia.,3,2024-10-14T03:30:22.108Z,0
670cca76e0941d56b05f1d26,670cca73e0941d56b05ee2ca,670cca73e0941d56b05ee6f0,Stella illum vivo comes tergeo video animus.,3,2024-10-14T07:04:47.496Z,0
670cca76e0941d56b05f1d27,670cca73e0941d56b05ee478,670cca73e0941d56b05ee85c,Tremo stella sum cunabula vitiosus deleniti.,1,2024-10-14T05:27:48.986Z,0
670cca76e0941d56b05f1d28,670cca73e0941d56b05ee58a,670cca73e0941d56b05ee7b7,Depulso canto delinquo officiis virgo.,2,2024-10-13T12:16:27.198Z,0
670cca76e0941d56b05f1d29,670cca73e0941d56b05ee2dd,670cca73e0941d56b05ee74f,Ascit caelum tumultus approbo suffragium clibanus vulticulus decor.,3,2024-10-14T04:22:37.124Z,0
670cca76e0941d56b05f1d2a,670cca73e0941d56b05ee569,670cca73e0941d56b05ee6ab,Turbo coniecto vicinus commemoro barba quasi curis constans stillicidium cruentus.,1,2024-10-13T14:50:32.298Z,0
670cca76e0941d56b05f1d2b,670cca73e0941d56b05ee378,670cca73e0941d56b05ee7bc,Odio sumptus delectatio conicio animus in cruciamentum denique coadunatio.,1,2024-10-14T06:06:51.293Z,0
670cca76e0941d56b05f1d2c,670cca73e0941d56b05ee2ad,670cca73e0941d56b05ee83d,Agnitio crur quis bellicus tepidus torqueo anser.,1,2024-10-13T15:14:39.823Z,0
670cca76e0941d56b05f1d2d,670cca73e0941d56b05ee592,670cca73e0941d56b05ee94e,Clarus sonitus provident.,2,2024-10-13T19:44:39.149Z,0
670cca76e0941d56b05f1d2e,670cca73e0941d56b05ee424,670cca73e0941d56b05ee87a,Tenax optio vigilo viriliter teres viridis teneo verbum combibo trepide.,4,2024-10-13T11:47:38.648Z,0
670cca76e0941d56b05f1d2f,670cca73e0941d56b05ee4d4,670cca73e0941d56b05ee9bb,Baiulus cunctatio compello sapiente ustilo unus confugo conatus virga convoco.,4,2024-10-14T06:10:40.510Z,0
670cca76e0941d56b05f1d30,670cca73e0941d56b05ee5cd,670cca73e0941d56b05ee7c5,Somnus celebrer curto tamquam benevolentia claudeo quisquam iure defleo.,4,2024-10-14T04:59:54.772Z,0
670cca76e0941d56b05f1d31,670cca73e0941d56b05ee385,670cca73e0941d56b05ee742,Defessus creator sumo villa dapifer audacia vitium sol.,2,2024-10-13T13:51:36.930Z,0
670cca76e0941d56b05f1d32,670cca73e0941d56b05ee386,670cca73e0941d56b05ee66f,Stabilis uredo sortitus conitor adipisci spiritus collum denuncio blandior.,5,2024-10-14T00:04:55.908Z,0
670cca76e0941d56b05f1d33,670cca73e0941d56b05ee4ba,670cca73e0941d56b05ee9c6,Dignissimos deduco angelus molestias vaco tepesco minima denique.,1,2024-10-13T17:54:53.948Z,0
670cca76e0941d56b05f1d34,670cca73e0941d56b05ee3e5,670cca73e0941d56b05ee6fa,Contra thesaurus atqui uter carcer titulus.,5,2024-10-13T23:03:08.175Z,0
670cca76e0941d56b05f1d35,670cca73e0941d56b05ee2d2,670cca73e0941d56b05ee979,Atrocitas argumentum corrigo angelus aureus dapifer tutis.,2,2024-10-14T00:59:32.127Z,0
670cca76e0941d56b05f1d36,670cca73e0941d56b05ee2d6,670cca73e0941d56b05eea18,Urbanus corona atrocitas.,5,2024-10-13T13:03:47.245Z,0
670cca76e0941d56b05f1d37,670cca73e0941d56b05ee3bd,670cca73e0941d56b05ee92d,Theca sunt defluo omnis.,2,2024-10-14T05:42:40.347Z,0
670cca76e0941d56b05f1d38,670cca73e0941d56b05ee462,670cca73e0941d56b05ee74b,Aeger sui absque.,4,2024-10-13T09:51:58.529Z,0
670cca76e0941d56b05f1d39,670cca73e0941d56b05ee3ba,670cca73e0941d56b05ee7ee,Tandem cur eligendi.,3,2024-10-13T12:09:37.762Z,0
670cca76e0941d56b05f1d3a,670cca73e0941d56b05ee46a,670cca73e0941d56b05ee7b4,Vilicus enim votum caveo usus adhuc utrimque.,4,2024-10-13T22:34:00.109Z,0
670cca76e0941d56b05f1d3b,670cca73e0941d56b05ee4b4,670cca73e0941d56b05ee9c1,Pecco deputo aqua tergeo utor ut autem suppellex thalassinus comes.,3,2024-10-13T14:06:17.205Z,0
670cca76e0941d56b05f1d3c,670cca73e0941d56b05ee5bd,670cca73e0941d56b05ee72a,Terminatio cura angelus denique.,3,2024-10-13T13:22:04.296Z,0
670cca76e0941d56b05f1d3d,670cca73e0941d56b05ee529,670cca73e0941d56b05ee797,Terra abstergo aequitas.,2,2024-10-14T07:17:36.524Z,0
670cca76e0941d56b05f1d3e,670cca73e0941d56b05ee47f,670cca73e0941d56b05ee89a,Tum vitiosus arbor.,3,2024-10-13T15:10:38.295Z,0
670cca76e0941d56b05f1d3f,670cca73e0941d56b05ee286,670cca73e0941d56b05ee90e,Celer cubitum villa nisi aro suffragium cogito aliquid paulatim.,1,2024-10-13T15:59:57.569Z,0
670cca76e0941d56b05f1d40,670cca73e0941d56b05ee2ee,670cca73e0941d56b05ee786,Ventito derelinquo alioqui amor vinculum deduco sui.,5,2024-10-13T13:13:55.546Z,0
670cca76e0941d56b05f1d41,670cca73e0941d56b05ee449,670cca73e0941d56b05ee8f0,Vae canto deficio adulescens cuius.,5,2024-10-13T23:39:40.905Z,0
670cca76e0941d56b05f1d42,670cca73e0941d56b05ee34f,670cca73e0941d56b05ee87e,Sui vilitas taceo commemoro argumentum tenus infit angustus calamitas beneficium.,3,2024-10-14T04:02:20.296Z,0
670cca76e0941d56b05f1d43,670cca73e0941d56b05ee305,670cca73e0941d56b05ee6c3,Absconditus aegre fugiat avarus tabula dens ad suppellex.,2,2024-10-13T23:18:53.158Z,0
670cca76e0941d56b05f1d44,670cca73e0941d56b05ee417,670cca73e0941d56b05ee6e0,Terminatio ultio debeo.,1,2024-10-13T17:48:32.640Z,0
670cca76e0941d56b05f1d45,670cca73e0941d56b05ee27e,670cca73e0941d56b05ee8f8,Tenax nemo cerno volup praesentium comedo.,1,2024-10-13T17:04:42.185Z,0
670cca76e0941d56b05f1d46,670cca73e0941d56b05ee46c,670cca73e0941d56b05ee986,Blandior tollo acsi ago thalassinus clam desino triumphus.,5,2024-10-13T14:21:41.762Z,0
670cca76e0941d56b05f1d47,670cca73e0941d56b05ee3f1,670cca73e0941d56b05ee959,Vobis depono vereor aperiam cribro defendo appello eos vorax paulatim.,5,2024-10-14T06:52:20.491Z,0
670cca76e0941d56b05f1d48,670cca73e0941d56b05ee638,670cca73e0941d56b05ee7ee,Teres tyrannus arbor cado arguo.,3,2024-10-13T15:41:59.300Z,0
670cca76e0941d56b05f1d49,670cca73e0941d56b05ee465,670cca73e0941d56b05ee9eb,Strenuus quod vestrum.,5,2024-10-13T19:53:40.607Z,0
670cca76e0941d56b05f1d4a,670cca73e0941d56b05ee402,670cca73e0941d56b05ee777,Cetera cometes deduco abstergo vobis confero averto crur.,1,2024-10-13T21:05:21.110Z,0
670cca76e0941d56b05f1d4b,670cca73e0941d56b05ee3a9,670cca73e0941d56b05ee8a1,Tantillus subseco inventore.,2,2024-10-14T04:05:01.433Z,0
670cca76e0941d56b05f1d4c,670cca73e0941d56b05ee2e1,670cca73e0941d56b05ee899,Absorbeo vulnus labore quod maiores adficio cohaero.,3,2024-10-13T16:49:37.287Z,0
670cca76e0941d56b05f1d4d,670cca73e0941d56b05ee5a6,670cca73e0941d56b05ee7af,Cultellus corrigo amaritudo nam carus absque audentia utrimque cogo.,4,2024-10-14T06:34:02.411Z,0
670cca76e0941d56b05f1d4e,670cca73e0941d56b05ee348,670cca73e0941d56b05ee9cb,Alo cibus absque tempore valde.,4,2024-10-13T13:55:09.853Z,0
670cca76e0941d56b05f1d4f,670cca73e0941d56b05ee311,670cca73e0941d56b05eea43,Aliqua tandem defetiscor facere.,4,2024-10-13T22:13:49.866Z,0
670cca76e0941d56b05f1d50,670cca73e0941d56b05ee367,670cca73e0941d56b05ee88f,Theca ver carmen tandem theatrum aestivus thema aeger subvenio.,5,2024-10-13T16:53:16.685Z,0
670cca76e0941d56b05f1d51,670cca73e0941d56b05ee5f3,670cca73e0941d56b05ee88a,Volup vorago vado ulciscor deprecator via cibo tergo.,4,2024-10-13T22:26:34.705Z,0
670cca76e0941d56b05f1d52,670cca73e0941d56b05ee39b,670cca73e0941d56b05ee744,Tam cunabula asporto quae adversus paens absconditus aurum.,1,2024-10-14T05:17:27.471Z,0
670cca76e0941d56b05f1d53,670cca73e0941d56b05ee3f6,670cca73e0941d56b05ee678,Ara eum demulceo collum aranea.,1,2024-10-13T20:44:47.579Z,0
670cca76e0941d56b05f1d54,670cca73e0941d56b05ee585,670cca73e0941d56b05ee9d8,Torrens conqueror possimus convoco cumque tergeo.,1,2024-10-13T15:12:58.312Z,0
670cca76e0941d56b05f1d55,670cca73e0941d56b05ee651,670cca73e0941d56b05ee719,Thesaurus toties vulnero.,2,2024-10-13T17:43:14.994Z,0
670cca76e0941d56b05f1d56,670cca73e0941d56b05ee2d9,670cca73e0941d56b05ee7c5,Cornu damnatio cetera accusantium laudantium pecco.,4,2024-10-14T06:44:22.218Z,0
670cca76e0941d56b05f1d57,670cca73e0941d56b05ee5ee,670cca73e0941d56b05ee80b,Xiphias utor valeo torrens valde bene adimpleo confido absum.,5,2024-10-13T17:17:54.849Z,0
670cca76e0941d56b05f1d58,670cca73e0941d56b05ee58b,670cca73e0941d56b05ee75c,Pecto deleo ventosus.,2,2024-10-14T06:37:51.738Z,0
670cca76e0941d56b05f1d59,670cca73e0941d56b05ee2b3,670cca73e0941d56b05ee86e,Vereor aut repellendus molestias vilitas depono decipio callide aperio deinde.,5,2024-10-13T18:44:13.575Z,0
670cca76e0941d56b05f1d5a,670cca73e0941d56b05ee611,670cca73e0941d56b05ee8e3,Annus verecundia totam arto utique aperio terror.,5,2024-10-13T21:55:12.426Z,0
670cca76e0941d56b05f1d5b,670cca73e0941d56b05ee408,670cca73e0941d56b05ee7ec,Coniecto acidus vomer vomica reiciendis caput minima quasi.,2,2024-10-14T05:56:29.125Z,0
670cca76e0941d56b05f1d5c,670cca73e0941d56b05ee3eb,670cca73e0941d56b05ee73e,Concedo vitiosus suffoco.,2,2024-10-13T08:44:34.364Z,0
670cca76e0941d56b05f1d5d,670cca73e0941d56b05ee544,670cca73e0941d56b05ee89d,Coaegresco laborum commodo debitis copia surgo.,4,2024-10-13T17:40:17.825Z,0
670cca76e0941d56b05f1d5e,670cca73e0941d56b05ee3a0,670cca73e0941d56b05ee8a4,Tamisium synagoga vivo stultus ciminatio.,3,2024-10-13T19:17:36.122Z,0
670cca76e0941d56b05f1d5f,670cca73e0941d56b05ee48f,670cca73e0941d56b05ee800,Vetus thalassinus deludo eos adopto error teres decerno alter.,2,2024-10-14T06:49:19.770Z,0
670cca76e0941d56b05f1d60,670cca73e0941d56b05ee4e2,670cca73e0941d56b05ee95f,Coerceo absum annus solum.,2,2024-10-13T22:18:46.937Z,0
670cca76e0941d56b05f1d61,670cca73e0941d56b05ee5e5,670cca73e0941d56b05ee6a6,Eius cinis angustus.,2,2024-10-14T07:08:05.899Z,0
670cca76e0941d56b05f1d62,670cca73e0941d56b05ee47f,670cca73e0941d56b05ee7ac,Incidunt clibanus spiculum minima color caecus admiratio campana.,5,2024-10-13T09:37:38.452Z,0
670cca76e0941d56b05f1d63,670cca73e0941d56b05ee506,670cca73e0941d56b05ee90d,Attollo consequuntur laudantium ustilo.,4,2024-10-13T10:44:13.129Z,0
670cca76e0941d56b05f1d64,670cca73e0941d56b05ee278,670cca73e0941d56b05ee93b,Voluptate antiquus aperiam calcar.,3,2024-10-14T07:03:46.213Z,0
670cca76e0941d56b05f1d65,670cca73e0941d56b05ee5b7,670cca73e0941d56b05ee9a2,Ullus creo tibi alienus bene vomito vado sublime.,1,2024-10-13T09:33:37.054Z,0
670cca76e0941d56b05f1d66,670cca73e0941d56b05ee2cd,670cca73e0941d56b05ee927,Tabgo appono somnus.,2,2024-10-13T20:34:31.739Z,0
670cca76e0941d56b05f1d67,670cca73e0941d56b05ee4b4,670cca73e0941d56b05ee687,Recusandae subiungo bibo crepusculum vero vae terra.,4,2024-10-13T14:38:41.796Z,0
670cca76e0941d56b05f1d68,670cca73e0941d56b05ee513,670cca73e0941d56b05ee8be,Iusto conculco abundans avaritia combibo repellat.,1,2024-10-13T19:42:24.067Z,0
670cca76e0941d56b05f1d69,670cca73e0941d56b05ee33b,670cca73e0941d56b05ee978,Canto tibi celo alveus quis valetudo copia.,4,2024-10-13T19:39:35.510Z,0
670cca76e0941d56b05f1d6a,670cca73e0941d56b05ee28c,670cca73e0941d56b05ee6b6,Assentator nesciunt cenaculum aureus acies aperiam surculus sustineo templum cinis.,1,2024-10-14T02:38:19.196Z,0
670cca76e0941d56b05f1d6b,670cca73e0941d56b05ee468,670cca73e0941d56b05ee71f,Adulescens aperio arguo admoneo comes occaecati volva.,5,2024-10-13T13:59:23.113Z,0
670cca76e0941d56b05f1d6c,670cca73e0941d56b05ee444,670cca73e0941d56b05ee9cc,Deserunt coma volutabrum vito viridis.,5,2024-10-14T07:34:49.088Z,0
670cca76e0941d56b05f1d6d,670cca73e0941d56b05ee606,670cca73e0941d56b05eea27,Vitiosus coadunatio conduco strenuus sui solutio.,4,2024-10-13T15:58:02.509Z,0
670cca76e0941d56b05f1d6e,670cca73e0941d56b05ee448,670cca73e0941d56b05eea15,Ea bis villa triumphus adsidue quod trepide demulceo campana cervus.,3,2024-10-13T23:48:48.552Z,0
670cca76e0941d56b05f1d6f,670cca73e0941d56b05ee289,670cca73e0941d56b05ee7bc,Urbanus arbustum sumptus.,1,2024-10-13T23:33:50.478Z,0
670cca76e0941d56b05f1d70,670cca73e0941d56b05ee2aa,670cca73e0941d56b05ee947,Argumentum tristis cauda temporibus vilicus amicitia.,2,2024-10-13T10:52:21.748Z,0
670cca76e0941d56b05f1d71,670cca73e0941d56b05ee4d2,670cca73e0941d56b05eea1b,Sumptus absorbeo laborum voveo tabernus appello alter velit excepturi.,1,2024-10-13T13:51:23.875Z,0
670cca76e0941d56b05f1d72,670cca73e0941d56b05ee504,670cca73e0941d56b05ee998,Denuncio ager antepono sapiente cibus.,4,2024-10-13T21:39:13.895Z,0
670cca76e0941d56b05f1d73,670cca73e0941d56b05ee304,670cca73e0941d56b05ee712,Porro cometes cunctatio natus articulus apostolus sit distinctio adficio fugit.,5,2024-10-14T01:42:03.630Z,0
670cca76e0941d56b05f1d74,670cca73e0941d56b05ee367,670cca73e0941d56b05ee730,Cogo collum consuasor totus neque.,1,2024-10-14T01:42:59.129Z,0
670cca76e0941d56b05f1d75,670cca73e0941d56b05ee4e1,670cca73e0941d56b05ee7f5,Tubineus adeo ver subiungo valeo conservo.,1,2024-10-13T20:43:01.513Z,0
670cca76e0941d56b05f1d76,670cca73e0941d56b05ee2ec,670cca73e0941d56b05ee93a,Condico celer clam turpis cohibeo cupiditate subiungo.,2,2024-10-13T23:31:49.518Z,0
670cca76e0941d56b05f1d77,670cca73e0941d56b05ee556,670cca73e0941d56b05ee868,Asporto abeo atque.,1,2024-10-13T20:52:37.111Z,0
670cca76e0941d56b05f1d78,670cca73e0941d56b05ee400,670cca73e0941d56b05ee9cf,Thymum tumultus absum texo.,2,2024-10-13T12:20:22.808Z,0
670cca76e0941d56b05f1d79,670cca73e0941d56b05ee51b,670cca73e0941d56b05ee9f3,Ullam coniecto adimpleo occaecati abundans decipio provident tamisium.,5,2024-10-13T23:02:17.731Z,0
670cca76e0941d56b05f1d7a,670cca73e0941d56b05ee59f,670cca73e0941d56b05ee9e7,Stipes astrum talis spectaculum.,3,2024-10-13T22:28:38.705Z,0
670cca76e0941d56b05f1d7b,670cca73e0941d56b05ee2de,670cca73e0941d56b05ee672,Cavus umerus cubo derideo adulatio tutamen.,5,2024-10-13T21:44:14.815Z,0
670cca76e0941d56b05f1d7c,670cca73e0941d56b05ee436,670cca73e0941d56b05ee84e,Tabesco sollicito via nulla studio aspernatur conforto caecus soluta.,4,2024-10-13T18:32:59.219Z,0
670cca76e0941d56b05f1d7d,670cca73e0941d56b05ee410,670cca73e0941d56b05ee7e7,Explicabo credo vomito creber clementia defungo cedo cognatus sit.,4,2024-10-13T11:37:33.925Z,0
670cca76e0941d56b05f1d7e,670cca73e0941d56b05ee581,670cca73e0941d56b05ee7a4,Cedo aliquid accedo vociferor aufero.,5,2024-10-14T03:33:48.056Z,0
670cca76e0941d56b05f1d7f,670cca73e0941d56b05ee304,670cca73e0941d56b05ee80c,Thalassinus cometes custodia dolor.,5,2024-10-14T05:18:59.436Z,0
670cca76e0941d56b05f1d80,670cca73e0941d56b05ee42c,670cca73e0941d56b05ee738,Defetiscor facere testimonium compello vel cerno defungo crustulum.,3,2024-10-13T18:38:29.803Z,0
670cca76e0941d56b05f1d81,670cca73e0941d56b05ee5b0,670cca73e0941d56b05ee938,Pauper aer modi thermae.,1,2024-10-14T05:13:53.258Z,0
670cca76e0941d56b05f1d82,670cca73e0941d56b05ee4a7,670cca73e0941d56b05ee966,Coruscus nam derideo concedo sursum.,2,2024-10-14T05:28:45.348Z,0
670cca76e0941d56b05f1d83,670cca73e0941d56b05ee3e1,670cca73e0941d56b05ee893,Apud acceptus candidus.,4,2024-10-13T21:09:43.929Z,0
670cca76e0941d56b05f1d84,670cca73e0941d56b05ee2e0,670cca73e0941d56b05ee765,Curis suggero virga cimentarius aiunt tabgo.,3,2024-10-13T23:34:43.835Z,0
670cca76e0941d56b05f1d85,670cca73e0941d56b05ee639,670cca73e0941d56b05ee9f5,Cetera synagoga claudeo sodalitas possimus tremo.,4,2024-10-13T23:18:42.535Z,0
670cca76e0941d56b05f1d86,670cca73e0941d56b05ee2c7,670cca73e0941d56b05ee69a,Quos summa tantum suscipit audax stips depromo vestigium antea deinde.,2,2024-10-13T18:54:56.826Z,0
670cca76e0941d56b05f1d87,670cca73e0941d56b05ee584,670cca73e0941d56b05ee8f6,Aegrus degero fugit delego stella usitas facere accendo curis.,4,2024-10-14T06:56:19.394Z,0
670cca76e0941d56b05f1d88,670cca73e0941d56b05ee534,670cca73e0941d56b05ee991,Claro virgo thema et sumo aggredior solvo.,3,2024-10-13T15:24:04.238Z,0
670cca76e0941d56b05f1d89,670cca73e0941d56b05ee555,670cca73e0941d56b05ee70d,Comptus basium claro cui damno colligo.,5,2024-10-13T18:02:47.441Z,0
670cca76e0941d56b05f1d8a,670cca73e0941d56b05ee5f5,670cca73e0941d56b05ee7f9,Approbo arcesso minima ulterius summisse.,1,2024-10-14T05:47:20.790Z,0
670cca76e0941d56b05f1d8b,670cca73e0941d56b05ee290,670cca73e0941d56b05ee68f,Facere acsi thorax summopere terga appositus arbustum.,1,2024-10-14T02:08:06.064Z,0
670cca76e0941d56b05f1d8c,670cca73e0941d56b05ee495,670cca73e0941d56b05ee872,Cursus conor argentum.,5,2024-10-13T16:24:26.395Z,0
670cca76e0941d56b05f1d8d,670cca73e0941d56b05ee354,670cca73e0941d56b05eea3d,Blandior impedit necessitatibus.,3,2024-10-14T00:42:37.911Z,0
670cca76e0941d56b05f1d8e,670cca73e0941d56b05ee2bf,670cca73e0941d56b05ee714,Appello quibusdam ancilla utrimque cresco vitae tamdiu viridis.,2,2024-10-13T08:04:10.145Z,0
670cca76e0941d56b05f1d8f,670cca73e0941d56b05ee3cf,670cca73e0941d56b05ee97f,Tricesimus desparatus tepidus celebrer tersus.,4,2024-10-13T10:29:34.338Z,0
670cca76e0941d56b05f1d90,670cca73e0941d56b05ee363,670cca73e0941d56b05ee789,Carcer arbor bardus sufficio tremo super appello ad.,2,2024-10-14T04:38:49.453Z,0
670cca76e0941d56b05f1d91,670cca73e0941d56b05ee5b3,670cca73e0941d56b05ee97c,Compono demo auxilium adhuc voluptate cum ante conforto.,5,2024-10-13T20:53:59.295Z,0
670cca76e0941d56b05f1d92,670cca73e0941d56b05ee5e5,670cca73e0941d56b05ee814,Congregatio ago nostrum theologus tego.,3,2024-10-13T19:26:44.285Z,0
670cca76e0941d56b05f1d93,670cca73e0941d56b05ee589,670cca73e0941d56b05ee746,Absorbeo conculco peccatus torrens antiquus amor corrumpo videlicet.,5,2024-10-13T15:30:22.661Z,0
670cca76e0941d56b05f1d94,670cca73e0941d56b05ee467,670cca73e0941d56b05ee7aa,Vomer suffragium voco avaritia deinde aranea urbanus confido demens cribro.,2,2024-10-13T22:46:10.715Z,0
670cca76e0941d56b05f1d95,670cca73e0941d56b05ee52b,670cca73e0941d56b05ee9db,Ambitus aspernatur blandior theologus exercitationem commemoro cernuus sint excepturi desidero.,2,2024-10-14T01:24:40.158Z,0
670cca76e0941d56b05f1d96,670cca73e0941d56b05ee380,670cca73e0941d56b05ee8da,Valetudo tergiversatio tribuo arbor coniuratio et.,2,2024-10-13T20:05:29.680Z,0
670cca76e0941d56b05f1d97,670cca73e0941d56b05ee5ba,670cca73e0941d56b05ee9d1,Sit corrumpo tenetur commemoro iusto catena inventore colligo cupiditate combibo.,2,2024-10-13T15:49:05.930Z,0
670cca76e0941d56b05f1d98,670cca73e0941d56b05ee3f9,670cca73e0941d56b05ee883,Sustineo adaugeo deleniti claudeo defungo truculenter attero cupiditas decerno desparatus.,2,2024-10-13T20:22:46.970Z,0
670cca76e0941d56b05f1d99,670cca73e0941d56b05ee555,670cca73e0941d56b05ee781,Ars summisse tego via terror currus depono timor.,4,2024-10-13T14:06:07.450Z,0
670cca76e0941d56b05f1d9a,670cca73e0941d56b05ee46b,670cca73e0941d56b05ee984,Illo tersus ante deripio sopor.,1,2024-10-13T10:58:36.152Z,0
670cca76e0941d56b05f1d9b,670cca73e0941d56b05ee3a2,670cca73e0941d56b05ee9a8,Nobis sequi socius videlicet vinco.,5,2024-10-14T07:09:31.784Z,0
670cca76e0941d56b05f1d9c,670cca73e0941d56b05ee436,670cca73e0941d56b05ee727,Complectus tribuo vis articulus.,3,2024-10-14T03:38:00.381Z,0
670cca76e0941d56b05f1d9d,670cca73e0941d56b05ee52d,670cca73e0941d56b05ee8d7,Quaerat rerum canto curis demo deleniti vulnero corporis desolo.,3,2024-10-13T15:57:24.894Z,0
670cca76e0941d56b05f1d9e,670cca73e0941d56b05ee2c7,670cca73e0941d56b05ee713,Spes sumo corona colligo repudiandae tepidus.,4,2024-10-14T03:05:48.727Z,0
670cca76e0941d56b05f1d9f,670cca73e0941d56b05ee5de,670cca73e0941d56b05ee9b3,Ara vinitor cursus.,1,2024-10-14T02:15:36.912Z,0
670cca76e0941d56b05f1da0,670cca73e0941d56b05ee3f5,670cca73e0941d56b05ee88d,Adeo delectus patria aegrus carmen vivo.,4,2024-10-13T21:00:57.292Z,0
670cca76e0941d56b05f1da1,670cca73e0941d56b05ee492,670cca73e0941d56b05ee95f,Amo terror attollo titulus.,5,2024-10-13T14:33:22.262Z,0
670cca76e0941d56b05f1da2,670cca73e0941d56b05ee4cc,670cca73e0941d56b05ee9bb,Aduro vulticulus quos torrens asper somnus abbas admitto culpo.,3,2024-10-14T05:46:02.155Z,0
670cca76e0941d56b05f1da3,670cca73e0941d56b05ee393,670cca73e0941d56b05ee9fe,Amaritudo voluntarius abutor.,4,2024-10-13T13:48:31.788Z,0
670cca76e0941d56b05f1da4,670cca73e0941d56b05ee488,670cca73e0941d56b05ee769,Ea numquam aranea bellum canto colo quae cilicium.,4,2024-10-13T17:28:41.250Z,0
670cca76e0941d56b05f1da5,670cca73e0941d56b05ee304,670cca73e0941d56b05ee9e4,Fugiat vulnus inventore comburo maiores non.,5,2024-10-13T17:35:19.187Z,0
670cca76e0941d56b05f1da6,670cca73e0941d56b05ee381,670cca73e0941d56b05ee996,Condico turbo sonitus nihil paulatim benevolentia sollers solio.,4,2024-10-13T08:37:25.340Z,0
670cca76e0941d56b05f1da7,670cca73e0941d56b05ee560,670cca73e0941d56b05ee990,Maiores capio crustulum videlicet spiritus certus maxime.,1,2024-10-14T02:23:48.111Z,0
670cca76e0941d56b05f1da8,670cca73e0941d56b05ee339,670cca73e0941d56b05ee7ec,Conturbo tergeo conspergo tener demonstro theologus cometes decipio sperno depereo.,3,2024-10-13T11:29:07.992Z,0
670cca76e0941d56b05f1da9,670cca73e0941d56b05ee591,670cca73e0941d56b05ee8a4,Sint canto ullam talio veritas.,3,2024-10-14T06:54:26.347Z,0
670cca76e0941d56b05f1daa,670cca73e0941d56b05ee54e,670cca73e0941d56b05ee9d9,Subnecto cursus tenax quaerat vix.,5,2024-10-13T09:42:49.638Z,0
670cca76e0941d56b05f1dab,670cca73e0941d56b05ee53d,670cca73e0941d56b05eea44,Amoveo desidero allatus ex.,3,2024-10-14T04:09:49.422Z,0
670cca76e0941d56b05f1dac,670cca73e0941d56b05ee318,670cca73e0941d56b05ee7d4,Thymbra aspernatur attero.,2,2024-10-13T12:35:00.538Z,0
670cca76e0941d56b05f1dad,670cca73e0941d56b05ee45e,670cca73e0941d56b05ee7fc,Crudelis ducimus aperiam consequuntur vae.,2,2024-10-13T20:59:52.189Z,0
670cca76e0941d56b05f1dae,670cca73e0941d56b05ee585,670cca73e0941d56b05ee8db,Reprehenderit ducimus magni accendo adaugeo.,2,2024-10-13T10:23:19.743Z,0
670cca76e0941d56b05f1daf,670cca73e0941d56b05ee574,670cca73e0941d56b05ee7e9,Volutabrum aer arto astrum laborum curto vociferor cui.,1,2024-10-13T14:00:40.362Z,0
670cca76e0941d56b05f1db0,670cca73e0941d56b05ee48f,670cca73e0941d56b05ee907,Iste suscipio crastinus ater quasi.,4,2024-10-13T10:05:26.977Z,0
670cca76e0941d56b05f1db1,670cca73e0941d56b05ee5ef,670cca73e0941d56b05ee792,Spiritus ad inflammatio via cupiditas iste crustulum.,2,2024-10-14T00:44:29.836Z,0
670cca76e0941d56b05f1db2,670cca73e0941d56b05ee43a,670cca73e0941d56b05ee869,Tredecim velut comburo aggero accedo voluptate.,3,2024-10-14T00:30:41.242Z,0
670cca76e0941d56b05f1db3,670cca73e0941d56b05ee5b1,670cca73e0941d56b05ee730,Ager vorago congregatio.,4,2024-10-13T09:23:15.796Z,0
670cca76e0941d56b05f1db4,670cca73e0941d56b05ee5b7,670cca73e0941d56b05ee6ae,Caveo aer statua apostolus tego ambulo aperte.,2,2024-10-13T17:53:54.499Z,0
670cca76e0941d56b05f1db5,670cca73e0941d56b05ee343,670cca73e0941d56b05ee7c9,Tres depulso varietas thema adhuc.,1,2024-10-13T12:57:14.426Z,0
670cca76e0941d56b05f1db6,670cca73e0941d56b05ee53d,670cca73e0941d56b05ee9de,Pel tabesco illo tot denique aequus conculco nesciunt vociferor.,3,2024-10-13T11:30:04.943Z,0
670cca76e0941d56b05f1db7,670cca73e0941d56b05ee410,670cca73e0941d56b05ee8c3,Cervus adamo cariosus.,3,2024-10-13T15:31:16.844Z,0
670cca76e0941d56b05f1db8,670cca73e0941d56b05ee567,670cca73e0941d56b05ee735,Verbum acceptus spiritus hic subnecto stabilis.,4,2024-10-13T20:17:28.917Z,0
670cca76e0941d56b05f1db9,670cca73e0941d56b05ee4ea,670cca73e0941d56b05ee789,Aestus numquam vomito alveus vomer cruciamentum capto doloribus.,1,2024-10-13T15:23:16.112Z,0
670cca76e0941d56b05f1dba,670cca73e0941d56b05ee431,670cca73e0941d56b05eea14,Odio adiuvo ascisco usus cubo iste coadunatio tabgo apostolus tardus.,3,2024-10-14T01:36:39.307Z,0
670cca76e0941d56b05f1dbb,670cca73e0941d56b05ee27f,670cca73e0941d56b05ee92c,Bellum derideo eius acceptus decens ars adfectus.,2,2024-10-13T13:23:20.652Z,0
670cca76e0941d56b05f1dbc,670cca73e0941d56b05ee46b,670cca73e0941d56b05ee991,Clarus convoco blanditiis ex spiritus curis pecus ipsam vinitor.,2,2024-10-13T18:33:35.721Z,0
670cca76e0941d56b05f1dbd,670cca73e0941d56b05ee53b,670cca73e0941d56b05ee89b,Cruciamentum incidunt terra viriliter cultura.,3,2024-10-13T16:42:45.299Z,0
