_id,userId,learningMaterialId,feedback,rating,createdAt,__v
670cca76e0941d56b05f1e67,670cca73e0941d56b05ee569,670cca73e0941d56b05ee851,Appono deficio bonus pecus debilito vigilo cavus abutor aptus cilicium.,5,2024-10-13T14:40:41.182Z,0
670cca76e0941d56b05f1e68,670cca73e0941d56b05ee4a4,670cca73e0941d56b05ee8b6,Amoveo timidus crapula arx conturbo artificiose.,1,2024-10-13T14:22:05.609Z,0
670cca76e0941d56b05f1e69,670cca73e0941d56b05ee45a,670cca73e0941d56b05ee893,Defessus tersus acies viduo abbas quam demergo deficio validus sub.,4,2024-10-13T22:08:48.089Z,0
670cca76e0941d56b05f1e6a,670cca73e0941d56b05ee2cf,670cca73e0941d56b05ee9bb,Accendo talus delectus adhaero accommodo vicinus deludo mollitia sapiente aranea.,3,2024-10-13T15:57:17.572Z,0
670cca76e0941d56b05f1e6b,670cca73e0941d56b05ee457,670cca73e0941d56b05ee8e9,Atqui terreo atrox velum velum tempora cohaero vicinus civitas calco.,4,2024-10-13T20:09:52.909Z,0
670cca76e0941d56b05f1e6c,670cca73e0941d56b05ee586,670cca73e0941d56b05ee77b,Celer curis ipsam voveo voluptas creta cotidie voro.,5,2024-10-13T19:53:38.960Z,0
670cca76e0941d56b05f1e6d,670cca73e0941d56b05ee2a8,670cca73e0941d56b05ee82d,Deputo quaerat corpus.,4,2024-10-14T02:29:48.755Z,0
670cca76e0941d56b05f1e6e,670cca73e0941d56b05ee595,670cca73e0941d56b05ee956,Pauci carus vero vox succurro avarus tristis depopulo vulticulus strenuus.,5,2024-10-13T23:18:31.669Z,0
670cca76e0941d56b05f1e6f,670cca73e0941d56b05ee526,670cca73e0941d56b05ee7d6,Voluptas capillus tametsi.,4,2024-10-14T05:17:54.742Z,0
670cca76e0941d56b05f1e70,670cca73e0941d56b05ee513,670cca73e0941d56b05ee6d3,Delinquo adaugeo uxor depopulo debilito vaco solio.,5,2024-10-13T09:27:51.224Z,0
670cca76e0941d56b05f1e71,670cca73e0941d56b05ee5c1,670cca73e0941d56b05ee890,Soluta curo repellendus quos patrocinor adficio amplitudo vesper.,5,2024-10-13T09:38:35.683Z,0
670cca76e0941d56b05f1e72,670cca73e0941d56b05ee35c,670cca73e0941d56b05ee9d4,Maxime calco deprecator depromo aegre astrum cognomen clementia auctus atque.,1,2024-10-14T04:26:44.036Z,0
670cca76e0941d56b05f1e73,670cca73e0941d56b05ee51d,670cca73e0941d56b05ee7ab,Celer patria delectus terra utpote delectatio.,4,2024-10-13T23:46:23.074Z,0
670cca76e0941d56b05f1e74,670cca73e0941d56b05ee3ad,670cca73e0941d56b05ee770,Congregatio thesis calco cognatus catena.,3,2024-10-14T01:56:45.586Z,0
670cca76e0941d56b05f1e75,670cca73e0941d56b05ee5f4,670cca73e0941d56b05ee80a,Vacuus venio suscipio aspicio cohibeo calculus venio acervus quae tumultus.,4,2024-10-14T00:07:42.228Z,0
670cca76e0941d56b05f1e76,670cca73e0941d56b05ee3d3,670cca73e0941d56b05ee73a,Asper spero colo demergo.,4,2024-10-14T06:59:50.487Z,0
670cca76e0941d56b05f1e77,670cca73e0941d56b05ee557,670cca73e0941d56b05ee987,Adimpleo apostolus tunc cupiditas via alii sum careo thorax volo.,3,2024-10-14T02:05:58.892Z,0
670cca76e0941d56b05f1e78,670cca73e0941d56b05ee484,670cca73e0941d56b05ee880,Cornu consectetur desino xiphias placeat admoneo rerum.,4,2024-10-13T08:39:36.045Z,0
670cca76e0941d56b05f1e79,670cca73e0941d56b05ee4f6,670cca73e0941d56b05ee9ee,Minima demergo provident totidem appositus ut theca conor.,2,2024-10-13T22:54:24.515Z,0
670cca76e0941d56b05f1e7a,670cca73e0941d56b05ee31e,670cca73e0941d56b05ee661,Deserunt thema cunae alii adsuesco.,1,2024-10-13T19:47:51.639Z,0
670cca76e0941d56b05f1e7b,670cca73e0941d56b05ee304,670cca73e0941d56b05ee798,Tumultus cito subnecto.,4,2024-10-13T16:55:42.636Z,0
670cca76e0941d56b05f1e7c,670cca73e0941d56b05ee50e,670cca73e0941d56b05ee68d,Arx tabgo aperte vitae cruentus atavus aggero utrimque.,5,2024-10-14T02:05:26.793Z,0
670cca76e0941d56b05f1e7d,670cca73e0941d56b05ee3a8,670cca73e0941d56b05ee92f,Theca cogo repudiandae video.,1,2024-10-14T05:17:26.321Z,0
670cca76e0941d56b05f1e7e,670cca73e0941d56b05ee403,670cca73e0941d56b05ee7b6,Voluptate id demonstro urbs curo.,5,2024-10-14T07:29:26.236Z,0
670cca76e0941d56b05f1e7f,670cca73e0941d56b05ee4f9,670cca73e0941d56b05ee6a4,Curatio admitto cado.,2,2024-10-14T05:56:46.829Z,0
670cca76e0941d56b05f1e80,670cca73e0941d56b05ee3f7,670cca73e0941d56b05ee827,Tres tertius decipio adfero tamisium subiungo inflammatio occaecati autus.,1,2024-10-13T14:05:22.709Z,0
670cca76e0941d56b05f1e81,670cca73e0941d56b05ee491,670cca73e0941d56b05ee98d,Textilis cariosus comptus sumo claro.,1,2024-10-13T20:45:44.545Z,0
670cca76e0941d56b05f1e82,670cca73e0941d56b05ee650,670cca73e0941d56b05ee72c,Agnitio quos somniculosus cumque.,1,2024-10-13T14:48:32.704Z,0
670cca76e0941d56b05f1e83,670cca73e0941d56b05ee332,670cca73e0941d56b05ee8f5,Summisse vicissitudo turba conor doloremque asporto acervus claudeo.,1,2024-10-13T09:44:06.054Z,0
670cca76e0941d56b05f1e84,670cca73e0941d56b05ee44e,670cca73e0941d56b05ee76a,Ultio aut volubilis.,2,2024-10-13T10:30:55.855Z,0
670cca76e0941d56b05f1e85,670cca73e0941d56b05ee64e,670cca73e0941d56b05ee92d,Attero calcar deserunt censura dicta.,2,2024-10-13T22:03:03.251Z,0
670cca76e0941d56b05f1e86,670cca73e0941d56b05ee55e,670cca73e0941d56b05ee8a9,Vulgaris ipsa admitto comis sui canis nobis.,4,2024-10-14T06:08:12.848Z,0
670cca76e0941d56b05f1e87,670cca73e0941d56b05ee422,670cca73e0941d56b05ee934,Anser somniculosus ulterius aufero summisse cura alienus.,5,2024-10-13T09:40:22.882Z,0
670cca76e0941d56b05f1e88,670cca73e0941d56b05ee45d,670cca73e0941d56b05ee8a5,Alter crepusculum amaritudo hic villa solus impedit tantillus doloremque.,3,2024-10-14T00:06:25.658Z,0
670cca76e0941d56b05f1e89,670cca73e0941d56b05ee544,670cca73e0941d56b05ee962,Tracto sollicito cupressus crapula.,3,2024-10-14T06:27:39.928Z,0
670cca76e0941d56b05f1e8a,670cca73e0941d56b05ee5d4,670cca73e0941d56b05eea42,Quas illum utor vicissitudo tergiversatio cum.,4,2024-10-14T05:26:58.494Z,0
670cca76e0941d56b05f1e8b,670cca73e0941d56b05ee4cd,670cca73e0941d56b05ee984,Deorsum theca varius crebro eaque communis armarium ducimus tres supellex.,4,2024-10-14T01:10:20.322Z,0
670cca76e0941d56b05f1e8c,670cca73e0941d56b05ee443,670cca73e0941d56b05ee8c3,Titulus taedium sapiente nulla inflammatio ullam clementia talus.,2,2024-10-14T01:41:14.269Z,0
670cca76e0941d56b05f1e8d,670cca73e0941d56b05ee516,670cca73e0941d56b05ee900,Pecto terebro aegrotatio trepide.,2,2024-10-14T04:55:48.449Z,0
670cca76e0941d56b05f1e8e,670cca73e0941d56b05ee39b,670cca73e0941d56b05ee93f,Arcesso uxor cena cunctatio cribro asperiores vestigium thesis.,2,2024-10-13T16:43:33.837Z,0
670cca76e0941d56b05f1e8f,670cca73e0941d56b05ee4d5,670cca73e0941d56b05ee74e,Conscendo vulariter coerceo alo talus alo valens copiose terra.,2,2024-10-13T17:42:14.884Z,0
670cca76e0941d56b05f1e90,670cca73e0941d56b05ee5c4,670cca73e0941d56b05eea40,Caste textilis benevolentia thesis sponte libero barba candidus.,1,2024-10-13T15:30:01.087Z,0
670cca76e0941d56b05f1e91,670cca73e0941d56b05ee357,670cca73e0941d56b05ee7ac,Iste adstringo minima tenetur denego viduo corrupti necessitatibus.,4,2024-10-13T08:01:51.836Z,0
670cca76e0941d56b05f1e92,670cca73e0941d56b05ee5e5,670cca73e0941d56b05ee66e,Angelus utilis conventus ter quia demergo torrens.,5,2024-10-14T05:38:45.631Z,0
670cca76e0941d56b05f1e93,670cca73e0941d56b05ee5c3,670cca73e0941d56b05ee66d,Aspicio desipio cubicularis coruscus ambulo corrumpo vulgaris quia aperiam coruscus.,3,2024-10-14T01:38:31.647Z,0
670cca76e0941d56b05f1e94,670cca73e0941d56b05ee279,670cca73e0941d56b05ee693,Tersus ocer allatus.,5,2024-10-13T08:06:47.137Z,0
670cca76e0941d56b05f1e95,670cca73e0941d56b05ee4d6,670cca73e0941d56b05ee951,Xiphias virga creptio verecundia despecto brevis suasoria quisquam quidem.,1,2024-10-14T00:34:17.223Z,0
670cca76e0941d56b05f1e96,670cca73e0941d56b05ee45e,670cca73e0941d56b05ee74b,Cetera arcus deludo ante toties vigor magnam caste labore.,5,2024-10-14T07:17:24.061Z,0
670cca76e0941d56b05f1e97,670cca73e0941d56b05ee388,670cca73e0941d56b05ee834,Careo apparatus vacuus ait.,1,2024-10-14T06:56:40.991Z,0
670cca76e0941d56b05f1e98,670cca73e0941d56b05ee27c,670cca73e0941d56b05ee89b,Strues callide crustulum sustineo assumenda baiulus deripio.,4,2024-10-13T08:38:47.841Z,0
670cca76e0941d56b05f1e99,670cca73e0941d56b05ee3a7,670cca73e0941d56b05ee966,Vomer comes bos.,1,2024-10-13T11:18:00.442Z,0
670cca76e0941d56b05f1e9a,670cca73e0941d56b05ee31b,670cca73e0941d56b05ee89d,Canto templum quos admiratio conturbo ustulo thymum tui acies.,1,2024-10-13T22:44:03.100Z,0
670cca76e0941d56b05f1e9b,670cca73e0941d56b05ee618,670cca73e0941d56b05ee766,Comedo suffragium nobis custodia.,4,2024-10-13T17:34:43.001Z,0
670cca76e0941d56b05f1e9c,670cca73e0941d56b05ee595,670cca73e0941d56b05ee6c8,Denuo copiose ubi nobis statua cogito.,3,2024-10-14T03:32:30.568Z,0
670cca76e0941d56b05f1e9d,670cca73e0941d56b05ee5b5,670cca73e0941d56b05ee844,Soleo tibi tenuis pel caecus villa degusto velit synagoga.,4,2024-10-14T05:58:12.342Z,0
670cca76e0941d56b05f1e9e,670cca73e0941d56b05ee375,670cca73e0941d56b05ee86d,Apparatus cupiditate amicitia agnosco aro deinde vester acidus benigne approbo.,1,2024-10-14T03:40:56.763Z,0
670cca76e0941d56b05f1e9f,670cca73e0941d56b05ee366,670cca73e0941d56b05ee77f,Acquiro antiquus curto nihil aureus tracto tantillus timidus turbo.,1,2024-10-14T05:07:21.805Z,0
670cca76e0941d56b05f1ea0,670cca73e0941d56b05ee507,670cca73e0941d56b05ee81a,Tubineus comminor utor.,2,2024-10-14T06:26:24.524Z,0
670cca76e0941d56b05f1ea1,670cca73e0941d56b05ee40b,670cca73e0941d56b05ee8c8,Certe rerum corrigo.,1,2024-10-13T07:44:06.953Z,0
670cca76e0941d56b05f1ea2,670cca73e0941d56b05ee65b,670cca73e0941d56b05ee76a,Cilicium viridis tepesco canis vomito demulceo cerno damnatio quia.,3,2024-10-14T00:49:50.105Z,0
670cca76e0941d56b05f1ea3,670cca73e0941d56b05ee2b4,670cca73e0941d56b05eea0d,Thesis iure vilicus degenero abduco capitulus.,5,2024-10-13T19:44:05.433Z,0
670cca76e0941d56b05f1ea4,670cca73e0941d56b05ee2be,670cca73e0941d56b05ee8a5,Uter venustas patrocinor claustrum corpus alienus absconditus.,5,2024-10-13T15:53:54.384Z,0
670cca76e0941d56b05f1ea5,670cca73e0941d56b05ee53a,670cca73e0941d56b05ee9e9,Vulpes cogito rerum defleo soluta coaegresco.,5,2024-10-13T13:54:49.874Z,0
670cca76e0941d56b05f1ea6,670cca73e0941d56b05ee545,670cca73e0941d56b05ee985,Adversus deficio virgo casso aptus totam sopor tui delicate.,2,2024-10-13T11:05:37.339Z,0
670cca76e0941d56b05f1ea7,670cca73e0941d56b05ee30c,670cca73e0941d56b05ee8fb,Ubi damno tenus alo molestiae avaritia verumtamen admoveo amiculum officia.,5,2024-10-13T23:28:01.100Z,0
670cca76e0941d56b05f1ea8,670cca73e0941d56b05ee585,670cca73e0941d56b05ee909,Corpus impedit amoveo tepesco cinis articulus deludo.,2,2024-10-13T16:01:31.600Z,0
670cca76e0941d56b05f1ea9,670cca73e0941d56b05ee584,670cca73e0941d56b05eea35,Qui derideo claudeo.,4,2024-10-13T22:27:07.545Z,0
670cca76e0941d56b05f1eaa,670cca73e0941d56b05ee56b,670cca73e0941d56b05ee9f6,Claudeo temptatio creptio antepono.,2,2024-10-14T04:10:49.368Z,0
670cca76e0941d56b05f1eab,670cca73e0941d56b05ee433,670cca73e0941d56b05ee707,Nemo comes arbustum temptatio audacia sustineo canonicus crur texo.,4,2024-10-13T07:45:50.028Z,0
670cca76e0941d56b05f1eac,670cca73e0941d56b05ee398,670cca73e0941d56b05ee67d,Solutio corporis accusamus quo conatus thymum abduco.,3,2024-10-13T13:14:37.879Z,0
670cca76e0941d56b05f1ead,670cca73e0941d56b05ee49f,670cca73e0941d56b05ee9ef,Aspicio caries adstringo aliquid vitae temperantia.,5,2024-10-13T11:31:19.336Z,0
670cca76e0941d56b05f1eae,670cca73e0941d56b05ee2fd,670cca73e0941d56b05ee966,Ustilo causa quibusdam vilitas.,5,2024-10-14T06:15:11.628Z,0
670cca76e0941d56b05f1eaf,670cca73e0941d56b05ee573,670cca73e0941d56b05ee87d,Aureus coepi quidem sono desidero.,3,2024-10-14T07:02:52.643Z,0
670cca76e0941d56b05f1eb0,670cca73e0941d56b05ee3ef,670cca73e0941d56b05eea19,Alias id curriculum vulariter censura desparatus bardus.,2,2024-10-14T05:12:25.232Z,0
670cca76e0941d56b05f1eb1,670cca73e0941d56b05ee5dc,670cca73e0941d56b05ee985,Spargo occaecati talis conservo vomer.,2,2024-10-13T23:22:01.140Z,0
670cca76e0941d56b05f1eb2,670cca73e0941d56b05ee439,670cca73e0941d56b05ee9c0,Tricesimus campana velociter uter.,2,2024-10-14T05:30:14.487Z,0
670cca76e0941d56b05f1eb3,670cca73e0941d56b05ee2f8,670cca73e0941d56b05ee681,Turbo impedit toties.,3,2024-10-14T00:26:29.676Z,0
670cca76e0941d56b05f1eb4,670cca73e0941d56b05ee40d,670cca73e0941d56b05ee96d,Deleo balbus vox crebro distinctio alias thymum excepturi.,2,2024-10-14T03:18:07.682Z,0
670cca76e0941d56b05f1eb5,670cca73e0941d56b05ee4fb,670cca73e0941d56b05ee9d5,Impedit degusto ars vulgivagus bonus pauper solvo pauper cupiditate.,1,2024-10-13T08:37:02.970Z,0
670cca76e0941d56b05f1eb6,670cca73e0941d56b05ee658,670cca73e0941d56b05ee845,Aperio deleo architecto comedo totidem delinquo ait adsum.,5,2024-10-13T11:34:45.542Z,0
670cca76e0941d56b05f1eb7,670cca73e0941d56b05ee512,670cca73e0941d56b05ee8c4,Corrumpo caecus cubitum solus sustineo accusantium sublime.,4,2024-10-13T22:03:06.291Z,0
670cca76e0941d56b05f1eb8,670cca73e0941d56b05ee5bd,670cca73e0941d56b05ee953,Utilis eum vivo tergum abscido tempora placeat arbitro desidero.,3,2024-10-13T15:10:00.464Z,0
670cca76e0941d56b05f1eb9,670cca73e0941d56b05ee5d5,670cca73e0941d56b05ee8a3,Tepidus utique astrum cui utrum.,1,2024-10-13T16:02:11.652Z,0
670cca76e0941d56b05f1eba,670cca73e0941d56b05ee4be,670cca73e0941d56b05eea20,Teneo averto thorax.,1,2024-10-13T08:58:59.498Z,0
670cca76e0941d56b05f1ebb,670cca73e0941d56b05ee407,670cca73e0941d56b05ee76d,Tutamen assentator defluo volup turba venio adipisci.,3,2024-10-13T16:40:01.249Z,0
670cca76e0941d56b05f1ebc,670cca73e0941d56b05ee587,670cca73e0941d56b05ee794,Vel carcer utor claudeo ambulo sol vigilo quia validus.,2,2024-10-13T23:29:33.743Z,0
670cca76e0941d56b05f1ebd,670cca73e0941d56b05ee658,670cca73e0941d56b05ee9c8,Carmen charisma derelinquo aptus quam sumo dolorem sum uxor.,2,2024-10-13T12:05:49.551Z,0
670cca76e0941d56b05f1ebe,670cca73e0941d56b05ee286,670cca73e0941d56b05ee687,Sordeo accommodo pel.,2,2024-10-14T00:32:09.850Z,0
670cca76e0941d56b05f1ebf,670cca73e0941d56b05ee2e7,670cca73e0941d56b05ee708,Ea vinum auxilium adinventitias vulticulus.,1,2024-10-14T03:11:31.614Z,0
670cca76e0941d56b05f1ec0,670cca73e0941d56b05ee4d3,670cca73e0941d56b05ee6e4,Sordeo tergo harum tubineus sulum acerbitas perferendis vado.,5,2024-10-14T06:40:35.067Z,0
670cca76e0941d56b05f1ec1,670cca73e0941d56b05ee333,670cca73e0941d56b05ee7fc,Curatio defluo compono.,3,2024-10-14T05:49:40.117Z,0
670cca76e0941d56b05f1ec2,670cca73e0941d56b05ee444,670cca73e0941d56b05ee8bc,Denique truculenter magnam tempus volutabrum texo vomica volubilis coaegresco colo.,1,2024-10-14T00:51:29.728Z,0
670cca76e0941d56b05f1ec3,670cca73e0941d56b05ee34b,670cca73e0941d56b05ee7ca,Terebro tumultus ago.,1,2024-10-13T21:02:46.714Z,0
670cca76e0941d56b05f1ec4,670cca73e0941d56b05ee2c4,670cca73e0941d56b05ee95b,Valetudo cedo despecto.,1,2024-10-14T04:34:04.868Z,0
670cca76e0941d56b05f1ec5,670cca73e0941d56b05ee34c,670cca73e0941d56b05ee8e5,Vigilo turba adsuesco deripio aliquam tonsor.,2,2024-10-13T21:06:08.872Z,0
670cca76e0941d56b05f1ec6,670cca73e0941d56b05ee5c3,670cca73e0941d56b05ee77d,Absconditus spargo degero tandem auctor trans amissio concido infit nostrum.,2,2024-10-13T13:31:28.778Z,0
670cca76e0941d56b05f1ec7,670cca73e0941d56b05ee449,670cca73e0941d56b05ee974,Sonitus velum talus quam volutabrum laboriosam.,2,2024-10-13T14:36:25.248Z,0
670cca76e0941d56b05f1ec8,670cca73e0941d56b05ee2a7,670cca73e0941d56b05ee9b8,Illum conforto quos provident virtus acervus tam arma admiratio.,1,2024-10-13T16:47:39.575Z,0
670cca76e0941d56b05f1ec9,670cca73e0941d56b05ee48a,670cca73e0941d56b05ee8a9,Aequitas tollo cubitum contra custodia numquam casso.,1,2024-10-13T07:41:13.965Z,0
670cca76e0941d56b05f1eca,670cca73e0941d56b05ee2e5,670cca73e0941d56b05ee854,Toties theatrum canonicus audentia stipes solus cernuus canonicus.,4,2024-10-13T08:08:59.307Z,0
670cca76e0941d56b05f1ecb,670cca73e0941d56b05ee418,670cca73e0941d56b05ee9a4,Templum supplanto vomer cado ager suppellex repellat absorbeo.,4,2024-10-13T09:02:19.482Z,0
670cca76e0941d56b05f1ecc,670cca73e0941d56b05ee3e5,670cca73e0941d56b05ee898,Tripudio crinis benigne thymum aptus.,2,2024-10-13T16:00:50.778Z,0
670cca76e0941d56b05f1ecd,670cca73e0941d56b05ee452,670cca73e0941d56b05ee68d,Spiculum curia demo acceptus caterva.,5,2024-10-13T08:55:38.065Z,0
670cca76e0941d56b05f1ece,670cca73e0941d56b05ee543,670cca73e0941d56b05ee8a2,Admoneo cupressus audeo aestas.,3,2024-10-13T11:11:30.241Z,0
670cca76e0941d56b05f1ecf,670cca73e0941d56b05ee372,670cca73e0941d56b05ee828,Aggero audio itaque amita.,2,2024-10-13T20:54:42.489Z,0
670cca76e0941d56b05f1ed0,670cca73e0941d56b05ee64b,670cca73e0941d56b05ee831,Tergo vulgaris verus sapiente valde cilicium.,5,2024-10-13T16:52:45.199Z,0
670cca76e0941d56b05f1ed1,670cca73e0941d56b05ee462,670cca73e0941d56b05ee896,Sit uberrime arcesso crustulum trucido pecco conservo.,5,2024-10-13T12:58:38.423Z,0
670cca76e0941d56b05f1ed2,670cca73e0941d56b05ee5ea,670cca73e0941d56b05ee9da,Complectus suscipio turpis.,2,2024-10-14T03:04:47.988Z,0
670cca76e0941d56b05f1ed3,670cca73e0941d56b05ee33b,670cca73e0941d56b05ee681,Callide umquam suffragium.,5,2024-10-13T14:15:13.824Z,0
670cca76e0941d56b05f1ed4,670cca73e0941d56b05ee3f9,670cca73e0941d56b05ee681,Reiciendis terga canonicus demitto brevis.,4,2024-10-14T02:27:43.795Z,0
670cca76e0941d56b05f1ed5,670cca73e0941d56b05ee4d7,670cca73e0941d56b05ee7a3,Terreo acceptus decimus sonitus accusantium amplexus.,3,2024-10-13T09:54:26.760Z,0
670cca76e0941d56b05f1ed6,670cca73e0941d56b05ee549,670cca73e0941d56b05ee832,Crux stillicidium surculus minima allatus.,2,2024-10-13T13:25:08.252Z,0
670cca76e0941d56b05f1ed7,670cca73e0941d56b05ee61e,670cca73e0941d56b05ee65f,Crinis cubo nostrum cicuta solum apud adversus aveho candidus.,5,2024-10-13T23:58:09.788Z,0
670cca76e0941d56b05f1ed8,670cca73e0941d56b05ee477,670cca73e0941d56b05ee9e1,Speciosus debeo votum comis a.,2,2024-10-14T02:15:38.189Z,0
670cca76e0941d56b05f1ed9,670cca73e0941d56b05ee44d,670cca73e0941d56b05ee8bf,Sortitus ullam aurum communis temperantia territo annus.,4,2024-10-14T05:00:52.438Z,0
670cca76e0941d56b05f1eda,670cca73e0941d56b05ee3d4,670cca73e0941d56b05eea00,Vociferor eos adicio creta perferendis sursum demo acidus attero.,4,2024-10-13T09:06:51.070Z,0
670cca76e0941d56b05f1edb,670cca73e0941d56b05ee2ec,670cca73e0941d56b05ee8ee,Assumenda suus angustus volup apto ventito aequus annus.,5,2024-10-13T20:52:55.136Z,0
670cca76e0941d56b05f1edc,670cca73e0941d56b05ee5f8,670cca73e0941d56b05ee911,Demonstro tepidus aurum argentum cui accusamus ea tempore.,5,2024-10-14T01:08:44.449Z,0
670cca76e0941d56b05f1edd,670cca73e0941d56b05ee614,670cca73e0941d56b05ee663,Vomica veritas solum ex.,4,2024-10-13T12:34:49.365Z,0
670cca76e0941d56b05f1ede,670cca73e0941d56b05ee4d4,670cca73e0941d56b05ee6ce,Sapiente amor cuppedia corporis candidus talus.,4,2024-10-14T03:02:06.458Z,0
670cca76e0941d56b05f1edf,670cca73e0941d56b05ee356,670cca73e0941d56b05ee6a6,Usque quia inflammatio tubineus voluptas.,3,2024-10-13T16:29:55.628Z,0
670cca76e0941d56b05f1ee0,670cca73e0941d56b05ee308,670cca73e0941d56b05ee79b,Assumenda delectatio suppono aeger caste reprehenderit.,1,2024-10-13T21:51:51.157Z,0
670cca76e0941d56b05f1ee1,670cca73e0941d56b05ee3a9,670cca73e0941d56b05ee6d0,Conscendo vulgo temporibus tenetur cubicularis claro traho abundans.,1,2024-10-13T22:43:51.818Z,0
670cca76e0941d56b05f1ee2,670cca73e0941d56b05ee4f9,670cca73e0941d56b05ee89d,Virtus super dolorem eum cras arcus crastinus.,1,2024-10-13T10:51:39.659Z,0
670cca76e0941d56b05f1ee3,670cca73e0941d56b05ee565,670cca73e0941d56b05ee926,Turpis alias defendo tandem tribuo excepturi vigor clamo speculum.,2,2024-10-13T09:22:32.363Z,0
670cca76e0941d56b05f1ee4,670cca73e0941d56b05ee35d,670cca73e0941d56b05ee968,Suscipio totus adflicto.,3,2024-10-14T03:14:23.173Z,0
670cca76e0941d56b05f1ee5,670cca73e0941d56b05ee58b,670cca73e0941d56b05ee9bd,Tergiversatio concedo dapifer tutamen deprecator comburo aliquid minus abundans pectus.,2,2024-10-13T18:01:33.688Z,0
670cca76e0941d56b05f1ee6,670cca73e0941d56b05ee404,670cca73e0941d56b05ee9bc,Trado absorbeo adeo altus temeritas peccatus clementia civitas.,3,2024-10-13T20:49:44.625Z,0
670cca76e0941d56b05f1ee7,670cca73e0941d56b05ee519,670cca73e0941d56b05ee8ce,Dolorum agnitio usitas demum cultura.,1,2024-10-13T08:08:39.620Z,0
670cca76e0941d56b05f1ee8,670cca73e0941d56b05ee404,670cca73e0941d56b05ee6fd,Decens beneficium solitudo uter cuppedia officia.,5,2024-10-13T21:30:01.775Z,0
670cca76e0941d56b05f1ee9,670cca73e0941d56b05ee46f,670cca73e0941d56b05ee714,Caste tum certe minima astrum succedo cras delectus.,2,2024-10-14T02:44:26.357Z,0
670cca76e0941d56b05f1eea,670cca73e0941d56b05ee5fa,670cca73e0941d56b05ee7fe,Peior adulescens quibusdam conitor claustrum.,4,2024-10-13T11:13:55.274Z,0
670cca76e0941d56b05f1eeb,670cca73e0941d56b05ee320,670cca73e0941d56b05ee803,Arceo ascit arto velociter tui.,2,2024-10-14T01:33:37.962Z,0
670cca76e0941d56b05f1eec,670cca73e0941d56b05ee554,670cca73e0941d56b05ee9b4,Hic denego tandem.,2,2024-10-13T23:58:25.932Z,0
670cca76e0941d56b05f1eed,670cca73e0941d56b05ee4cc,670cca73e0941d56b05eea22,Conforto cupressus tracto subseco charisma sustineo depromo bos venio.,5,2024-10-13T11:16:04.911Z,0
670cca76e0941d56b05f1eee,670cca73e0941d56b05ee53d,670cca73e0941d56b05ee6ae,Victoria caries abundans adulescens cornu cultura cohibeo.,4,2024-10-14T03:21:21.905Z,0
670cca76e0941d56b05f1eef,670cca73e0941d56b05ee4bd,670cca73e0941d56b05ee9a7,Termes porro terra quia.,5,2024-10-13T22:20:09.051Z,0
670cca76e0941d56b05f1ef0,670cca73e0941d56b05ee3a3,670cca73e0941d56b05ee857,Adamo solvo pauci crastinus barba strenuus undique animi.,3,2024-10-14T03:35:15.726Z,0
670cca76e0941d56b05f1ef1,670cca73e0941d56b05ee4c1,670cca73e0941d56b05ee744,Titulus totus triumphus clibanus beatus calamitas arbor spero cui ademptio.,5,2024-10-13T12:12:52.504Z,0
670cca76e0941d56b05f1ef2,670cca73e0941d56b05ee4e4,670cca73e0941d56b05ee9dc,Velociter ipsa pauci credo sed verbum suffragium sub.,1,2024-10-13T11:49:14.915Z,0
670cca76e0941d56b05f1ef3,670cca73e0941d56b05ee65e,670cca73e0941d56b05ee751,Sodalitas vulgus veritatis uter volutabrum aro suspendo.,2,2024-10-13T17:18:34.353Z,0
670cca76e0941d56b05f1ef4,670cca73e0941d56b05ee394,670cca73e0941d56b05ee8f2,Volaticus tandem cibo atqui occaecati strues caveo vester.,2,2024-10-13T15:03:14.230Z,0
670cca76e0941d56b05f1ef5,670cca73e0941d56b05ee2c2,670cca73e0941d56b05ee7b0,Cresco cupressus animadverto adhaero venia amo vulgus.,1,2024-10-14T06:02:06.128Z,0
670cca76e0941d56b05f1ef6,670cca73e0941d56b05ee484,670cca73e0941d56b05ee957,Coerceo somniculosus eius xiphias cupressus uxor trepide absque tener.,5,2024-10-13T19:41:11.765Z,0
670cca76e0941d56b05f1ef7,670cca73e0941d56b05ee609,670cca73e0941d56b05ee86b,Sophismata saepe decretum terminatio.,2,2024-10-14T02:23:30.926Z,0
670cca76e0941d56b05f1ef8,670cca73e0941d56b05ee306,670cca73e0941d56b05ee8c7,Deserunt vulticulus una alo velociter deprimo causa tabula absque.,1,2024-10-13T08:58:53.254Z,0
670cca76e0941d56b05f1ef9,670cca73e0941d56b05ee36d,670cca73e0941d56b05ee71a,Uxor tribuo tracto decimus varius.,5,2024-10-13T11:41:28.422Z,0
670cca76e0941d56b05f1efa,670cca73e0941d56b05ee482,670cca73e0941d56b05ee7fa,Delectus arbustum vito canto teneo torqueo aurum tendo tollo natus.,2,2024-10-13T09:33:57.431Z,0
670cca76e0941d56b05f1efb,670cca73e0941d56b05ee51e,670cca73e0941d56b05ee7d6,Armarium ascit eum.,4,2024-10-13T20:29:30.154Z,0
670cca76e0941d56b05f1efc,670cca73e0941d56b05ee277,670cca73e0941d56b05ee85e,Amor combibo cicuta.,5,2024-10-13T15:40:51.457Z,0
670cca76e0941d56b05f1efd,670cca73e0941d56b05ee3f9,670cca73e0941d56b05eea37,Triduana asper totam distinctio crapula deorsum caterva appositus.,3,2024-10-14T04:32:30.535Z,0
670cca76e0941d56b05f1efe,670cca73e0941d56b05ee2f2,670cca73e0941d56b05ee812,Quas cursus somniculosus suus odit amet cohaero studio vociferor adsuesco.,3,2024-10-13T09:41:08.188Z,0
670cca76e0941d56b05f1eff,670cca73e0941d56b05ee351,670cca73e0941d56b05ee775,Consuasor tenax cognatus vallum voluptatum delectus thesis ullus quos debitis.,2,2024-10-13T16:26:33.375Z,0
670cca76e0941d56b05f1f00,670cca73e0941d56b05ee596,670cca73e0941d56b05eea14,Eveniet aperte peccatus subnecto non adimpleo acer cinis cinis labore.,2,2024-10-14T00:52:31.699Z,0
670cca76e0941d56b05f1f01,670cca73e0941d56b05ee63b,670cca73e0941d56b05ee7c3,Arcus tristis infit amplitudo tendo constans abstergo cinis.,2,2024-10-14T01:47:41.572Z,0
670cca76e0941d56b05f1f02,670cca73e0941d56b05ee496,670cca73e0941d56b05ee74f,Audacia derelinquo ventito capitulus.,5,2024-10-14T05:32:16.280Z,0
670cca76e0941d56b05f1f03,670cca73e0941d56b05ee59f,670cca73e0941d56b05ee7b0,Caelestis ara viridis altus.,5,2024-10-13T10:59:11.369Z,0
670cca76e0941d56b05f1f04,670cca73e0941d56b05ee4e4,670cca73e0941d56b05ee908,Adipiscor degenero tertius crinis architecto comedo adeo alias.,3,2024-10-13T16:12:00.813Z,0
670cca76e0941d56b05f1f05,670cca73e0941d56b05ee379,670cca73e0941d56b05ee72a,Adimpleo volaticus tergeo viduo cinis torqueo maxime dolorum.,2,2024-10-14T03:51:25.042Z,0
670cca76e0941d56b05f1f06,670cca73e0941d56b05ee31f,670cca73e0941d56b05ee736,Terror ustulo spes.,1,2024-10-14T01:51:24.744Z,0
670cca76e0941d56b05f1f07,670cca73e0941d56b05ee4cd,670cca73e0941d56b05ee8d1,Tredecim carcer demum cumque ulciscor cimentarius arcesso adipiscor bos conor.,2,2024-10-13T08:36:46.982Z,0
670cca76e0941d56b05f1f08,670cca73e0941d56b05ee4af,670cca73e0941d56b05ee793,Vix torqueo tristis denique curia amissio utrimque antea.,4,2024-10-14T03:53:32.299Z,0
670cca76e0941d56b05f1f09,670cca73e0941d56b05ee348,670cca73e0941d56b05ee6fb,Ter agnitio adhuc maiores allatus claustrum torqueo.,1,2024-10-13T19:58:13.563Z,0
670cca76e0941d56b05f1f0a,670cca73e0941d56b05ee5c1,670cca73e0941d56b05ee748,Defetiscor dedico solutio claudeo.,5,2024-10-13T13:50:29.676Z,0
670cca76e0941d56b05f1f0b,670cca73e0941d56b05ee516,670cca73e0941d56b05ee9ee,Audentia corpus tui subiungo amissio.,3,2024-10-13T16:39:52.053Z,0
670cca76e0941d56b05f1f0c,670cca73e0941d56b05ee33e,670cca73e0941d56b05ee691,Vos coma aegrotatio decet solus.,4,2024-10-14T07:09:52.709Z,0
670cca76e0941d56b05f1f0d,670cca73e0941d56b05ee286,670cca73e0941d56b05ee8de,Uxor substantia vapulus coniuratio desparatus adhaero tonsor suspendo compono subseco.,3,2024-10-13T12:01:59.327Z,0
