_id,userId,learningMaterialId,feedback,rating,createdAt,__v
670cca76e0941d56b05f1dbe,670cca73e0941d56b05ee307,670cca73e0941d56b05ee9a9,Ceno vindico clibanus creo surgo ademptio virtus adsum.,1,2024-10-13T23:29:29.845Z,0
670cca76e0941d56b05f1dbf,670cca73e0941d56b05ee2c9,670cca73e0941d56b05ee7c6,Sollers tener tibi calamitas conspergo aut caelum cohibeo.,5,2024-10-14T03:00:50.094Z,0
670cca76e0941d56b05f1dc0,670cca73e0941d56b05ee4e4,670cca73e0941d56b05ee7c3,Dedecor infit turba dolore abstergo adimpleo voluptatum accommodo coepi.,3,2024-10-13T13:55:12.919Z,0
670cca76e0941d56b05f1dc1,670cca73e0941d56b05ee4b3,670cca73e0941d56b05ee85a,Trado ulterius baiulus.,3,2024-10-14T01:21:50.871Z,0
670cca76e0941d56b05f1dc2,670cca73e0941d56b05ee2e6,670cca73e0941d56b05ee9f8,Censura terra explicabo cilicium auctus urbs curia vallum sumptus.,2,2024-10-14T07:33:36.291Z,0
670cca76e0941d56b05f1dc3,670cca73e0941d56b05ee40e,670cca73e0941d56b05ee6f4,Cuppedia sed valetudo officia timor conor agnosco.,1,2024-10-14T04:09:53.584Z,0
670cca76e0941d56b05f1dc4,670cca73e0941d56b05ee3a1,670cca73e0941d56b05ee89a,Quos umquam cresco veritas verto speciosus canis degenero.,2,2024-10-13T21:04:43.895Z,0
670cca76e0941d56b05f1dc5,670cca73e0941d56b05ee62b,670cca73e0941d56b05ee7e5,Tricesimus ultra circumvenio sollers usus crur aetas odio.,4,2024-10-14T05:23:46.115Z,0
670cca76e0941d56b05f1dc6,670cca73e0941d56b05ee334,670cca73e0941d56b05ee9ee,Odio turbo ciminatio commodi.,4,2024-10-13T16:41:45.309Z,0
670cca76e0941d56b05f1dc7,670cca73e0941d56b05ee410,670cca73e0941d56b05ee977,Sapiente vigilo solus textor aperio animi umerus pel tergeo creptio.,2,2024-10-13T21:42:08.905Z,0
670cca76e0941d56b05f1dc8,670cca73e0941d56b05ee550,670cca73e0941d56b05ee6b1,Via tenuis sumo video suppono arguo auditor verecundia.,4,2024-10-14T01:16:25.384Z,0
670cca76e0941d56b05f1dc9,670cca73e0941d56b05ee51b,670cca73e0941d56b05ee99d,Arma admoveo esse aranea deficio alius tero.,3,2024-10-14T00:46:16.123Z,0
670cca76e0941d56b05f1dca,670cca73e0941d56b05ee56f,670cca73e0941d56b05ee6d0,Voluptatem calco aperiam adaugeo conduco.,2,2024-10-13T15:44:12.572Z,0
670cca76e0941d56b05f1dcb,670cca73e0941d56b05ee461,670cca73e0941d56b05ee67b,Ago aegre virga ante.,4,2024-10-14T04:06:50.370Z,0
670cca76e0941d56b05f1dcc,670cca73e0941d56b05ee635,670cca73e0941d56b05eea2b,Voluptatum tandem id verbum arguo cultura deficio.,1,2024-10-14T03:46:28.598Z,0
670cca76e0941d56b05f1dcd,670cca73e0941d56b05ee2b4,670cca73e0941d56b05ee685,Cotidie statua adfectus trado clam vilitas consequuntur eum abundans abeo.,3,2024-10-14T05:32:35.168Z,0
670cca76e0941d56b05f1dce,670cca73e0941d56b05ee534,670cca73e0941d56b05ee913,Asporto volutabrum creator deputo spero comes quos defendo combibo.,1,2024-10-13T17:12:04.217Z,0
670cca76e0941d56b05f1dcf,670cca73e0941d56b05ee5b2,670cca73e0941d56b05ee671,Verus cubitum adversus creta debilito surculus cena.,4,2024-10-13T20:43:39.989Z,0
670cca76e0941d56b05f1dd0,670cca73e0941d56b05ee568,670cca73e0941d56b05ee999,Cultellus dolore universe ab tot aeneus.,4,2024-10-13T14:54:03.883Z,0
670cca76e0941d56b05f1dd1,670cca73e0941d56b05ee29b,670cca73e0941d56b05ee8f7,Nisi magnam commemoro ambulo allatus angulus alienus substantia vitae sol.,4,2024-10-13T14:48:10.772Z,0
670cca76e0941d56b05f1dd2,670cca73e0941d56b05ee5cd,670cca73e0941d56b05ee993,Vergo venia crebro deficio.,5,2024-10-14T02:17:39.211Z,0
670cca76e0941d56b05f1dd3,670cca73e0941d56b05ee339,670cca73e0941d56b05ee6e4,Pecus absconditus circumvenio sumptus atrox nam.,1,2024-10-13T22:44:41.404Z,0
670cca76e0941d56b05f1dd4,670cca73e0941d56b05ee5c1,670cca73e0941d56b05eea0f,Sto vir fugit debeo valde sollers.,3,2024-10-14T01:50:51.684Z,0
670cca76e0941d56b05f1dd5,670cca73e0941d56b05ee5bb,670cca73e0941d56b05ee914,Natus capillus coaegresco sumo reprehenderit omnis porro copiose.,5,2024-10-13T11:14:35.804Z,0
670cca76e0941d56b05f1dd6,670cca73e0941d56b05ee4f0,670cca73e0941d56b05ee92b,Taedium corrigo odit aliquam.,5,2024-10-13T17:02:47.427Z,0
670cca76e0941d56b05f1dd7,670cca73e0941d56b05ee5b3,670cca73e0941d56b05ee84c,Quia antepono nihil.,4,2024-10-14T06:27:30.598Z,0
670cca76e0941d56b05f1dd8,670cca73e0941d56b05ee4b9,670cca73e0941d56b05ee800,Adeptio auxilium quasi tondeo velum.,3,2024-10-14T03:51:43.028Z,0
670cca76e0941d56b05f1dd9,670cca73e0941d56b05ee60c,670cca73e0941d56b05ee78d,Commodo debeo bardus optio.,2,2024-10-13T20:07:07.029Z,0
670cca76e0941d56b05f1dda,670cca73e0941d56b05ee295,670cca73e0941d56b05ee6d1,Expedita dolorum titulus charisma.,1,2024-10-13T21:24:56.244Z,0
670cca76e0941d56b05f1ddb,670cca73e0941d56b05ee541,670cca73e0941d56b05ee9dc,Defetiscor vesica cursim articulus anser pecco despecto territo conculco volva.,1,2024-10-13T16:13:16.418Z,0
670cca76e0941d56b05f1ddc,670cca73e0941d56b05ee4f4,670cca73e0941d56b05ee85a,Vicissitudo amoveo defaeco amaritudo altus conservo absque spero.,1,2024-10-13T12:21:43.918Z,0
670cca76e0941d56b05f1ddd,670cca73e0941d56b05ee4bf,670cca73e0941d56b05ee9cb,Causa constans tenax terror ventito credo.,2,2024-10-13T10:04:57.760Z,0
670cca76e0941d56b05f1dde,670cca73e0941d56b05ee5a1,670cca73e0941d56b05ee9fc,Quas solium substantia decet fuga callide necessitatibus tendo.,5,2024-10-13T12:43:09.673Z,0
670cca76e0941d56b05f1ddf,670cca73e0941d56b05ee324,670cca73e0941d56b05ee8e3,Cursus acer blanditiis ultra tempus certe assumenda pauper arbustum defendo.,1,2024-10-14T03:55:08.101Z,0
670cca76e0941d56b05f1de0,670cca73e0941d56b05ee2d9,670cca73e0941d56b05ee980,Distinctio consuasor canis admitto vociferor combibo vinculum delibero.,4,2024-10-14T06:31:16.890Z,0
670cca76e0941d56b05f1de1,670cca73e0941d56b05ee561,670cca73e0941d56b05ee9b0,Verumtamen cervus velit vilis amo.,1,2024-10-14T05:43:56.878Z,0
670cca76e0941d56b05f1de2,670cca73e0941d56b05ee2aa,670cca73e0941d56b05ee9cb,Alo ambitus caput decor super.,3,2024-10-13T13:46:30.641Z,0
670cca76e0941d56b05f1de3,670cca73e0941d56b05ee52f,670cca73e0941d56b05ee80a,Curis creo congregatio cervus tergum valde arguo suggero.,2,2024-10-14T04:02:04.168Z,0
670cca76e0941d56b05f1de4,670cca73e0941d56b05ee444,670cca73e0941d56b05ee9d7,Absconditus consuasor caveo acceptus dedecor occaecati.,3,2024-10-13T16:04:21.276Z,0
670cca76e0941d56b05f1de5,670cca73e0941d56b05ee5bb,670cca73e0941d56b05ee6d4,Vociferor careo subnecto.,3,2024-10-13T20:59:26.326Z,0
670cca76e0941d56b05f1de6,670cca73e0941d56b05ee282,670cca73e0941d56b05ee749,Suadeo tutis anser altus amaritudo contabesco caries deserunt vomito.,5,2024-10-13T08:14:45.728Z,0
670cca76e0941d56b05f1de7,670cca73e0941d56b05ee2c0,670cca73e0941d56b05ee7ad,Ventus defetiscor tantillus.,1,2024-10-13T22:29:12.045Z,0
670cca76e0941d56b05f1de8,670cca73e0941d56b05ee3b8,670cca73e0941d56b05ee973,Virgo contra pecco ex acidus ambitus.,2,2024-10-13T17:45:51.790Z,0
670cca76e0941d56b05f1de9,670cca73e0941d56b05ee2ec,670cca73e0941d56b05ee664,Attollo iste adimpleo canis patior vere demitto.,3,2024-10-13T13:29:39.467Z,0
670cca76e0941d56b05f1dea,670cca73e0941d56b05ee305,670cca73e0941d56b05ee677,Aspicio tametsi delectus voluntarius valde subvenio vaco depulso.,4,2024-10-14T07:36:17.297Z,0
670cca76e0941d56b05f1deb,670cca73e0941d56b05ee51d,670cca73e0941d56b05ee6a2,Aeneus thalassinus umbra illo trepide molestias cognomen.,4,2024-10-14T06:53:41.138Z,0
670cca76e0941d56b05f1dec,670cca73e0941d56b05ee2d5,670cca73e0941d56b05ee851,Tamdiu veniam cervus adhaero ventus.,2,2024-10-13T12:56:52.738Z,0
670cca76e0941d56b05f1ded,670cca73e0941d56b05ee333,670cca73e0941d56b05ee8fd,Vobis ait creator ducimus abbas alo ademptio non solio acidus.,3,2024-10-14T01:10:54.204Z,0
670cca76e0941d56b05f1dee,670cca73e0941d56b05ee5db,670cca73e0941d56b05ee70a,Claro speculum deporto benigne.,2,2024-10-13T12:13:46.337Z,0
670cca76e0941d56b05f1def,670cca73e0941d56b05ee38f,670cca73e0941d56b05ee6d5,Damno sumptus quisquam vae communis curiositas.,3,2024-10-13T14:40:24.022Z,0
670cca76e0941d56b05f1df0,670cca73e0941d56b05ee451,670cca73e0941d56b05ee799,Aestus capillus pectus.,5,2024-10-14T03:25:24.385Z,0
670cca76e0941d56b05f1df1,670cca73e0941d56b05ee60a,670cca73e0941d56b05ee7eb,Caecus cauda sophismata degero administratio cunabula cupiditas optio animus.,4,2024-10-14T04:39:25.631Z,0
670cca76e0941d56b05f1df2,670cca73e0941d56b05ee55f,670cca73e0941d56b05ee6c5,Comminor cenaculum sol.,5,2024-10-13T18:28:00.373Z,0
670cca76e0941d56b05f1df3,670cca73e0941d56b05ee3db,670cca73e0941d56b05ee7c0,Distinctio candidus condico peior vulgaris celer pecus.,5,2024-10-13T21:05:09.075Z,0
670cca76e0941d56b05f1df4,670cca73e0941d56b05ee4c0,670cca73e0941d56b05ee6cc,Desparatus sapiente crebro atavus nesciunt aro dolorem.,3,2024-10-13T13:19:54.084Z,0
670cca76e0941d56b05f1df5,670cca73e0941d56b05ee60a,670cca73e0941d56b05ee83a,Tyrannus supplanto apto ustulo alias.,5,2024-10-14T06:15:11.415Z,0
670cca76e0941d56b05f1df6,670cca73e0941d56b05ee510,670cca73e0941d56b05ee6df,Veritas caveo supellex civitas magnam cilicium theatrum stipes.,5,2024-10-13T07:59:20.183Z,0
670cca76e0941d56b05f1df7,670cca73e0941d56b05ee573,670cca73e0941d56b05ee713,Aureus venio valeo.,4,2024-10-14T03:44:32.652Z,0
670cca76e0941d56b05f1df8,670cca73e0941d56b05ee4c9,670cca73e0941d56b05ee6b7,Creator virga quaerat est congregatio terror ancilla sol utpote succurro.,2,2024-10-13T09:50:19.343Z,0
670cca76e0941d56b05f1df9,670cca73e0941d56b05ee35c,670cca73e0941d56b05ee7a2,Turpis voluntarius volubilis celebrer aperte succedo versus conicio.,1,2024-10-13T08:50:42.348Z,0
670cca76e0941d56b05f1dfa,670cca73e0941d56b05ee540,670cca73e0941d56b05ee99a,Sonitus adimpleo sophismata laborum.,5,2024-10-14T02:39:49.594Z,0
670cca76e0941d56b05f1dfb,670cca73e0941d56b05ee51b,670cca73e0941d56b05ee9c5,Tredecim desipio aegrus aptus voluptas accommodo taceo vinco ventito deprecator.,2,2024-10-14T01:49:34.710Z,0
670cca76e0941d56b05f1dfc,670cca73e0941d56b05ee4f6,670cca73e0941d56b05ee81c,Cruciamentum angelus defendo expedita adnuo adficio inflammatio sequi arguo uberrime.,1,2024-10-13T19:58:24.358Z,0
670cca76e0941d56b05f1dfd,670cca73e0941d56b05ee356,670cca73e0941d56b05ee957,Absorbeo cohibeo creptio creator voro aspicio celer umquam.,5,2024-10-13T17:15:37.044Z,0
670cca76e0941d56b05f1dfe,670cca73e0941d56b05ee631,670cca73e0941d56b05ee89a,Deorsum animi adamo vapulus cui soleo maiores animi vis.,5,2024-10-13T15:45:08.022Z,0
670cca76e0941d56b05f1dff,670cca73e0941d56b05ee5cf,670cca73e0941d56b05ee777,Demens dedecor tremo antiquus ascisco utilis.,3,2024-10-13T13:47:13.239Z,0
670cca76e0941d56b05f1e00,670cca73e0941d56b05ee354,670cca73e0941d56b05ee84c,Varietas contigo cavus timidus socius bellum tergum vestigium.,4,2024-10-13T22:13:18.485Z,0
670cca76e0941d56b05f1e01,670cca73e0941d56b05ee416,670cca73e0941d56b05ee827,Termes confugo magnam conatus bellicus.,3,2024-10-13T12:09:07.208Z,0
670cca76e0941d56b05f1e02,670cca73e0941d56b05ee343,670cca73e0941d56b05ee79d,Thema contabesco consectetur capio.,4,2024-10-14T02:25:59.652Z,0
670cca76e0941d56b05f1e03,670cca73e0941d56b05ee4ff,670cca73e0941d56b05ee953,Esse umerus cunae.,4,2024-10-14T06:36:46.572Z,0
670cca76e0941d56b05f1e04,670cca73e0941d56b05ee553,670cca73e0941d56b05ee8cd,Callide tergo clibanus cenaculum timidus sui.,3,2024-10-14T06:03:09.548Z,0
670cca76e0941d56b05f1e05,670cca73e0941d56b05ee54a,670cca73e0941d56b05ee6c2,Abeo aiunt summisse.,3,2024-10-13T13:47:16.868Z,0
670cca76e0941d56b05f1e06,670cca73e0941d56b05ee30a,670cca73e0941d56b05ee963,Torqueo centum delicate.,2,2024-10-13T07:51:18.179Z,0
670cca76e0941d56b05f1e07,670cca73e0941d56b05ee337,670cca73e0941d56b05ee8a1,Contigo autus sui.,1,2024-10-14T03:39:46.022Z,0
670cca76e0941d56b05f1e08,670cca73e0941d56b05ee438,670cca73e0941d56b05ee8a8,Bardus ratione aestivus aspicio depopulo dolorum amaritudo alius ter.,1,2024-10-13T21:50:23.429Z,0
670cca76e0941d56b05f1e09,670cca73e0941d56b05ee37c,670cca73e0941d56b05ee86c,Tamen defaeco creo explicabo crapula creta vobis consequuntur.,3,2024-10-13T23:50:12.869Z,0
670cca76e0941d56b05f1e0a,670cca73e0941d56b05ee3dd,670cca73e0941d56b05ee9fb,Depraedor collum veritatis toties.,2,2024-10-13T16:58:38.681Z,0
670cca76e0941d56b05f1e0b,670cca73e0941d56b05ee32c,670cca73e0941d56b05ee857,Vacuus explicabo strenuus spero coaegresco deduco tametsi speculum exercitationem.,1,2024-10-14T02:35:40.008Z,0
670cca76e0941d56b05f1e0c,670cca73e0941d56b05ee640,670cca73e0941d56b05ee818,Sufficio solitudo audentia territo admoneo termes spero.,5,2024-10-14T02:00:12.765Z,0
670cca76e0941d56b05f1e0d,670cca73e0941d56b05ee485,670cca73e0941d56b05ee932,Acidus ulterius votum censura quo cubicularis minima vehemens.,4,2024-10-13T20:16:52.831Z,0
670cca76e0941d56b05f1e0e,670cca73e0941d56b05ee2ed,670cca73e0941d56b05ee7c5,Conduco caute cur.,1,2024-10-13T22:04:08.803Z,0
670cca76e0941d56b05f1e0f,670cca73e0941d56b05ee59a,670cca73e0941d56b05ee846,Adeo tunc coepi.,1,2024-10-13T07:41:50.410Z,0
670cca76e0941d56b05f1e10,670cca73e0941d56b05ee602,670cca73e0941d56b05ee7f0,Terga aperio ullam succurro bellum delinquo textilis civis usitas.,1,2024-10-13T13:02:24.425Z,0
670cca76e0941d56b05f1e11,670cca73e0941d56b05ee2e7,670cca73e0941d56b05ee6ad,Voluptate aptus porro vester crepusculum vomito utroque.,3,2024-10-14T06:57:16.314Z,0
670cca76e0941d56b05f1e12,670cca73e0941d56b05ee4e9,670cca73e0941d56b05ee893,Debeo tactus utrimque defessus.,2,2024-10-13T16:23:23.639Z,0
670cca76e0941d56b05f1e13,670cca73e0941d56b05ee41c,670cca73e0941d56b05ee8dc,Porro approbo vos condico verbum veritatis vomito casus cui sufficio.,4,2024-10-13T17:27:43.820Z,0
670cca76e0941d56b05f1e14,670cca73e0941d56b05ee3d0,670cca73e0941d56b05ee744,Deripio alo tantum virgo quae.,4,2024-10-13T12:41:44.284Z,0
670cca76e0941d56b05f1e15,670cca73e0941d56b05ee468,670cca73e0941d56b05ee79b,Quam vereor cibo cui.,4,2024-10-13T17:54:49.902Z,0
670cca76e0941d56b05f1e16,670cca73e0941d56b05ee45c,670cca73e0941d56b05ee6ba,Cotidie conforto solum video.,4,2024-10-13T17:29:40.201Z,0
670cca76e0941d56b05f1e17,670cca73e0941d56b05ee35e,670cca73e0941d56b05ee942,Arceo studio coadunatio est.,5,2024-10-14T06:33:22.750Z,0
670cca76e0941d56b05f1e18,670cca73e0941d56b05ee546,670cca73e0941d56b05ee904,Spectaculum sperno defungo accusamus abscido credo vomito centum vulgaris.,3,2024-10-13T11:09:45.321Z,0
670cca76e0941d56b05f1e19,670cca73e0941d56b05ee55a,670cca73e0941d56b05ee727,Debeo tandem vesper velociter suus benevolentia.,4,2024-10-13T16:25:44.465Z,0
670cca76e0941d56b05f1e1a,670cca73e0941d56b05ee452,670cca73e0941d56b05ee722,Amiculum coaegresco vobis.,4,2024-10-14T02:49:36.755Z,0
670cca76e0941d56b05f1e1b,670cca73e0941d56b05ee5f5,670cca73e0941d56b05ee900,Casus cognomen apostolus arca statua quidem summisse demo defendo.,5,2024-10-14T03:24:49.827Z,0
670cca76e0941d56b05f1e1c,670cca73e0941d56b05ee2c6,670cca73e0941d56b05ee8c8,Solum adiuvo concedo turpis conor illum animus calcar.,3,2024-10-13T08:17:49.774Z,0
670cca76e0941d56b05f1e1d,670cca73e0941d56b05ee4f2,670cca73e0941d56b05ee919,Caste totus aggredior consuasor tres villa carbo.,5,2024-10-14T04:03:30.160Z,0
670cca76e0941d56b05f1e1e,670cca73e0941d56b05ee621,670cca73e0941d56b05ee6d8,Virga earum defessus baiulus utique carbo terror.,4,2024-10-13T11:15:51.125Z,0
670cca76e0941d56b05f1e1f,670cca73e0941d56b05ee31c,670cca73e0941d56b05ee722,Doloremque uter defleo tollo callide.,2,2024-10-13T14:24:35.464Z,0
670cca76e0941d56b05f1e20,670cca73e0941d56b05ee4f2,670cca73e0941d56b05ee940,Natus tantum nemo aurum concedo suffoco sono decipio.,4,2024-10-14T03:31:26.814Z,0
670cca76e0941d56b05f1e21,670cca73e0941d56b05ee589,670cca73e0941d56b05ee985,Quae deputo bellum aer correptius aperiam sophismata cupiditate ipsa.,1,2024-10-13T19:22:06.184Z,0
670cca76e0941d56b05f1e22,670cca73e0941d56b05ee4fe,670cca73e0941d56b05ee9ce,Volubilis quaerat nam cariosus alienus exercitationem claudeo speciosus dignissimos.,2,2024-10-13T13:56:04.234Z,0
670cca76e0941d56b05f1e23,670cca73e0941d56b05ee627,670cca73e0941d56b05ee722,Animus desidero depraedor adeo coerceo sortitus.,2,2024-10-13T20:53:00.349Z,0
670cca76e0941d56b05f1e24,670cca73e0941d56b05ee4a5,670cca73e0941d56b05ee72b,Thalassinus adsuesco contra quisquam depromo asperiores.,5,2024-10-13T13:56:23.287Z,0
670cca76e0941d56b05f1e25,670cca73e0941d56b05ee58e,670cca73e0941d56b05ee963,Bestia celer vinculum deorsum repellat alius sublime cultellus deorsum.,3,2024-10-13T19:21:28.311Z,0
670cca76e0941d56b05f1e26,670cca73e0941d56b05ee5b1,670cca73e0941d56b05eea0d,Paens thesis sapiente validus magni.,1,2024-10-13T18:37:08.241Z,0
670cca76e0941d56b05f1e27,670cca73e0941d56b05ee51f,670cca73e0941d56b05ee7e7,Quas tantum agnosco perferendis.,4,2024-10-14T04:56:10.801Z,0
670cca76e0941d56b05f1e28,670cca73e0941d56b05ee531,670cca73e0941d56b05eea3b,Cogo itaque ademptio curtus curvo degero quibusdam spero vallum.,1,2024-10-13T16:00:21.826Z,0
670cca76e0941d56b05f1e29,670cca73e0941d56b05ee525,670cca73e0941d56b05eea24,Conor ars adipisci.,1,2024-10-13T22:08:30.868Z,0
670cca76e0941d56b05f1e2a,670cca73e0941d56b05ee494,670cca73e0941d56b05eea07,Numquam amiculum necessitatibus praesentium adsidue comparo.,5,2024-10-13T19:39:49.281Z,0
670cca76e0941d56b05f1e2b,670cca73e0941d56b05ee611,670cca73e0941d56b05ee7f9,Quas curo patria vigilo colligo combibo tamquam ustulo.,4,2024-10-13T23:51:59.423Z,0
670cca76e0941d56b05f1e2c,670cca73e0941d56b05ee3eb,670cca73e0941d56b05ee89a,Coma undique voluptatum tutis tamen.,2,2024-10-14T06:28:46.754Z,0
670cca76e0941d56b05f1e2d,670cca73e0941d56b05ee3ea,670cca73e0941d56b05ee795,Sono dolor accusamus decet tardus eos cinis.,4,2024-10-13T23:50:06.966Z,0
670cca76e0941d56b05f1e2e,670cca73e0941d56b05ee613,670cca73e0941d56b05ee8bb,Volaticus tempore depopulo rem quisquam alter.,3,2024-10-13T20:39:38.115Z,0
670cca76e0941d56b05f1e2f,670cca73e0941d56b05ee488,670cca73e0941d56b05ee964,Dedecor utroque terra cognomen cohaero toties vallum desipio conforto ter.,4,2024-10-14T02:08:32.781Z,0
670cca76e0941d56b05f1e30,670cca73e0941d56b05ee5fa,670cca73e0941d56b05ee9af,Tot accusantium eaque nemo culpa careo magnam.,2,2024-10-13T19:01:41.420Z,0
670cca76e0941d56b05f1e31,670cca73e0941d56b05ee56f,670cca73e0941d56b05ee7a5,Ipsam amiculum carpo.,3,2024-10-13T22:57:26.932Z,0
670cca76e0941d56b05f1e32,670cca73e0941d56b05ee2ce,670cca73e0941d56b05ee7bd,Spargo sto expedita antiquus deputo temporibus vehemens suasoria.,3,2024-10-13T11:53:28.174Z,0
670cca76e0941d56b05f1e33,670cca73e0941d56b05ee4b0,670cca73e0941d56b05ee8bb,Cubitum avaritia celo unde.,4,2024-10-14T02:06:56.763Z,0
670cca76e0941d56b05f1e34,670cca73e0941d56b05ee2d3,670cca73e0941d56b05ee797,Cibus viduo verecundia umquam valeo celebrer.,2,2024-10-14T03:10:00.830Z,0
670cca76e0941d56b05f1e35,670cca73e0941d56b05ee63e,670cca73e0941d56b05ee92d,Curtus tero curtus culpa.,1,2024-10-14T03:44:55.307Z,0
670cca76e0941d56b05f1e36,670cca73e0941d56b05ee62d,670cca73e0941d56b05eea42,Nostrum adfectus bibo civitas amissio texo caelestis curtus carcer.,5,2024-10-13T14:42:27.252Z,0
670cca76e0941d56b05f1e37,670cca73e0941d56b05ee3c6,670cca73e0941d56b05ee784,Verbum ocer sol.,2,2024-10-13T13:49:38.066Z,0
670cca76e0941d56b05f1e38,670cca73e0941d56b05ee470,670cca73e0941d56b05ee71b,Cerno curia adstringo thalassinus armarium odit defendo.,5,2024-10-14T01:07:38.409Z,0
670cca76e0941d56b05f1e39,670cca73e0941d56b05ee408,670cca73e0941d56b05ee961,Apparatus sponte totidem vulnero.,4,2024-10-13T13:21:55.375Z,0
670cca76e0941d56b05f1e3a,670cca73e0941d56b05ee4c1,670cca73e0941d56b05ee959,Sint uberrime defaeco deprecator.,3,2024-10-13T16:44:18.305Z,0
670cca76e0941d56b05f1e3b,670cca73e0941d56b05ee561,670cca73e0941d56b05ee858,Molestias condico desidero.,3,2024-10-13T14:14:06.489Z,0
670cca76e0941d56b05f1e3c,670cca73e0941d56b05ee612,670cca73e0941d56b05ee997,Creptio verbum aer agnitio cunctatio alter confido amplexus.,3,2024-10-13T10:53:16.392Z,0
670cca76e0941d56b05f1e3d,670cca73e0941d56b05ee4a6,670cca73e0941d56b05ee9a7,Angulus consequatur angustus demitto commodo enim.,3,2024-10-13T13:42:07.434Z,0
670cca76e0941d56b05f1e3e,670cca73e0941d56b05ee333,670cca73e0941d56b05ee84c,Ipsam testimonium una despecto cotidie terra pecto.,1,2024-10-13T15:36:51.919Z,0
670cca76e0941d56b05f1e3f,670cca73e0941d56b05ee5fb,670cca73e0941d56b05ee6e4,Quidem aestivus stultus creta aegrotatio pariatur trepide vinitor comptus enim.,3,2024-10-13T21:19:41.894Z,0
670cca76e0941d56b05f1e40,670cca73e0941d56b05ee642,670cca73e0941d56b05ee6f6,Aestus celo tenetur capitulus.,2,2024-10-14T05:05:02.895Z,0
670cca76e0941d56b05f1e41,670cca73e0941d56b05ee62e,670cca73e0941d56b05ee879,Somnus voluptatem corrumpo voluptatum agnosco ultra talus perspiciatis arguo.,1,2024-10-13T08:33:20.476Z,0
670cca76e0941d56b05f1e42,670cca73e0941d56b05ee2c2,670cca73e0941d56b05ee937,Tondeo provident quam voluptatibus paulatim absorbeo magni argumentum.,4,2024-10-13T10:40:07.378Z,0
670cca76e0941d56b05f1e43,670cca73e0941d56b05ee48c,670cca73e0941d56b05ee7b1,Curso tempus volup recusandae cerno adflicto accusator.,3,2024-10-13T11:54:59.249Z,0
670cca76e0941d56b05f1e44,670cca73e0941d56b05ee641,670cca73e0941d56b05ee848,Careo aduro cras arca amor ex curto.,3,2024-10-13T09:30:50.002Z,0
670cca76e0941d56b05f1e45,670cca73e0941d56b05ee5a1,670cca73e0941d56b05ee7c6,Sequi sed compono tabernus celebrer eum tardus deinde quia cometes.,4,2024-10-13T16:34:11.000Z,0
670cca76e0941d56b05f1e46,670cca73e0941d56b05ee334,670cca73e0941d56b05ee866,Tum timidus ex teres denuncio videlicet.,4,2024-10-13T12:51:56.568Z,0
670cca76e0941d56b05f1e47,670cca73e0941d56b05ee3f0,670cca73e0941d56b05ee665,Provident depraedor maxime dedico crastinus cinis.,3,2024-10-13T22:49:08.206Z,0
670cca76e0941d56b05f1e48,670cca73e0941d56b05ee484,670cca73e0941d56b05ee931,Ager voluptas quam amor.,5,2024-10-14T04:17:43.570Z,0
670cca76e0941d56b05f1e49,670cca73e0941d56b05ee300,670cca73e0941d56b05ee81b,Collum aer subnecto aegrus.,4,2024-10-13T14:16:20.314Z,0
670cca76e0941d56b05f1e4a,670cca73e0941d56b05ee485,670cca73e0941d56b05ee84e,Deserunt vir utor sortitus veritas conforto.,3,2024-10-14T05:48:12.423Z,0
670cca76e0941d56b05f1e4b,670cca73e0941d56b05ee51a,670cca73e0941d56b05ee69b,Utpote tutis amo patria cohibeo molestias laborum velum.,1,2024-10-13T20:33:01.980Z,0
670cca76e0941d56b05f1e4c,670cca73e0941d56b05ee60e,670cca73e0941d56b05ee9b5,Solio cattus peccatus aestas valeo solio itaque fuga tubineus.,4,2024-10-13T08:30:56.214Z,0
670cca76e0941d56b05f1e4d,670cca73e0941d56b05ee3ae,670cca73e0941d56b05eea1a,Vigilo valeo tricesimus incidunt tego apud atqui sui.,5,2024-10-14T02:06:58.846Z,0
670cca76e0941d56b05f1e4e,670cca73e0941d56b05ee4ff,670cca73e0941d56b05ee7e0,Argentum vapulus volaticus eveniet vaco territo catena.,4,2024-10-13T09:06:31.543Z,0
670cca76e0941d56b05f1e4f,670cca73e0941d56b05ee40c,670cca73e0941d56b05ee97b,Apparatus consequatur unus ex textilis.,3,2024-10-14T07:11:39.796Z,0
670cca76e0941d56b05f1e50,670cca73e0941d56b05ee5c4,670cca73e0941d56b05ee9ea,Asper praesentium coruscus quae approbo decet vehemens celo solium.,3,2024-10-13T09:07:04.054Z,0
670cca76e0941d56b05f1e51,670cca73e0941d56b05ee5dc,670cca73e0941d56b05ee890,Quae terror tristis paulatim atque creber amitto.,5,2024-10-13T09:48:55.025Z,0
670cca76e0941d56b05f1e52,670cca73e0941d56b05ee5af,670cca73e0941d56b05ee6e8,Strues crux bos.,4,2024-10-13T18:07:03.346Z,0
670cca76e0941d56b05f1e53,670cca73e0941d56b05ee523,670cca73e0941d56b05eea35,Animus eligendi molestiae sumo cupio aggero.,1,2024-10-13T11:56:49.809Z,0
670cca76e0941d56b05f1e54,670cca73e0941d56b05ee5ac,670cca73e0941d56b05ee845,Congregatio curvo aeternus comptus sollers deorsum.,4,2024-10-13T11:23:21.440Z,0
670cca76e0941d56b05f1e55,670cca73e0941d56b05ee55b,670cca73e0941d56b05ee69d,Eligendi nisi villa vitiosus admiratio solvo paulatim.,4,2024-10-13T18:33:37.910Z,0
670cca76e0941d56b05f1e56,670cca73e0941d56b05ee2aa,670cca73e0941d56b05ee9d2,Aliquid ars debitis vitiosus valde paens triumphus.,4,2024-10-14T01:09:55.363Z,0
670cca76e0941d56b05f1e57,670cca73e0941d56b05ee5da,670cca73e0941d56b05ee6b9,Asper adicio cohors capitulus autus vado tego tres tondeo.,2,2024-10-13T21:26:32.267Z,0
670cca76e0941d56b05f1e58,670cca73e0941d56b05ee529,670cca73e0941d56b05ee84d,Audax ex ambulo causa sollicito sollers aranea sortitus.,5,2024-10-14T07:31:38.155Z,0
670cca76e0941d56b05f1e59,670cca73e0941d56b05ee3b8,670cca73e0941d56b05ee66b,Attonbitus optio bene argentum decerno creo praesentium ustulo.,1,2024-10-14T02:23:31.156Z,0
670cca76e0941d56b05f1e5a,670cca73e0941d56b05ee431,670cca73e0941d56b05ee74d,Nam tamen nostrum adfectus statua terreo.,5,2024-10-14T00:53:51.036Z,0
670cca76e0941d56b05f1e5b,670cca73e0941d56b05ee4fd,670cca73e0941d56b05ee65f,Usus tertius ex terror aliqua solum vesper.,1,2024-10-14T00:42:07.370Z,0
670cca76e0941d56b05f1e5c,670cca73e0941d56b05ee386,670cca73e0941d56b05ee8c2,Totus turpis molestiae.,4,2024-10-13T16:51:50.364Z,0
670cca76e0941d56b05f1e5d,670cca73e0941d56b05ee3de,670cca73e0941d56b05ee7b7,Calamitas caute civitas amplexus.,2,2024-10-13T13:17:33.671Z,0
670cca76e0941d56b05f1e5e,670cca73e0941d56b05ee41a,670cca73e0941d56b05ee712,Suffoco dedico amoveo demo pel civis.,4,2024-10-13T14:21:46.429Z,0
670cca76e0941d56b05f1e5f,670cca73e0941d56b05ee39d,670cca73e0941d56b05ee97a,Distinctio adaugeo contigo vitium vitium usque vesica.,5,2024-10-13T14:43:32.554Z,0
670cca76e0941d56b05f1e60,670cca73e0941d56b05ee58a,670cca73e0941d56b05ee9ec,Aut versus triumphus sed amet addo tamdiu.,1,2024-10-14T01:19:20.313Z,0
670cca76e0941d56b05f1e61,670cca73e0941d56b05ee2f0,670cca73e0941d56b05ee9c2,Auctor chirographum cerno triumphus utilis unde usitas tardus.,2,2024-10-13T16:19:34.263Z,0
670cca76e0941d56b05f1e62,670cca73e0941d56b05ee330,670cca73e0941d56b05ee6d7,Absque curiositas arbor vitium reiciendis verto tepidus deficio.,5,2024-10-14T03:21:17.649Z,0
670cca76e0941d56b05f1e63,670cca73e0941d56b05ee2bc,670cca73e0941d56b05ee883,Copia spiritus volva thorax vilitas civitas xiphias demitto carmen solvo.,4,2024-10-13T18:48:58.162Z,0
670cca76e0941d56b05f1e64,670cca73e0941d56b05ee359,670cca73e0941d56b05eea10,Celer benevolentia accendo.,2,2024-10-13T20:24:39.408Z,0
670cca76e0941d56b05f1e65,670cca73e0941d56b05ee428,670cca73e0941d56b05ee824,Demitto vociferor templum demens conforto.,1,2024-10-13T19:40:28.470Z,0
670cca76e0941d56b05f1e66,670cca73e0941d56b05ee41e,670cca73e0941d56b05ee921,Delectus eligendi vulgivagus vindico ustilo suggero addo brevis aequitas.,2,2024-10-13T08:04:30.198Z,0
